,title,budget,revenue,genres,production_countries,production_companies,adult,popularity,original_language,release_date,runtime,vote_average,vote_count
640,Intruder,0,0,Horror,,,False,1.612,en,2008-10-22,85,4.3,3
641,Running on Empty,0,0,"Action, Drama",Australia,,False,0.873,en,1982-08-05,83,5.8,7
642,Buried Alive,0,0,"TV Movie, Horror, Thriller",United States of America,"Niki Marvin Productions, Universal Television",False,3.533,en,1990-05-09,93,6.4,56
643,The Polar Bear King,0,0,"Adventure, Fantasy, Romance, Family","Germany, Norway, Sweden","MovieMakers, Northern Lights, Connexion Film",False,1.348,no,1991-06-20,88,6.0,12
644,LT22 Radio La Colifata,0,0,Documentary,"Argentina, Spain",,False,1.128,es,2007-01-01,93,0.0,0
645,A Serious Shock! Yes Madam!,0,0,"Action, Adventure",Hong Kong,New Treasurer Films Company,False,0.84,cn,1993-09-23,98,6.0,2
646,The House of Orphans,0,0,,Sweden,Sick Films,False,0.708,sv,2008-01-05,,1.0,1
647,Take Off,0,0,Drama,South Korea,"KM Culture Co., Showbox",False,2.525,ko,2009-07-29,137,5.9,14
648,WholphinVolume 9,0,0,,,,False,0.6,en,,2,0.0,0
649,Shinsengumi: Assassins of Honor,0,0,"Action, Drama, History",Japan,"Toho Company, Ltd., Mifune Production Co., Ltd.",False,2.132,ja,1969-12-05,122,6.4,9
650,Sting: The Brand New Day Tour: Live From The Universal Amphitheatre,0,0,Music,,Universal Music,False,1.021,en,1999-09-08,88,7.3,2
651,Level 42 - Guaranteed Live,0,0,Music,,,False,0.6,en,1991-01-01,95,8.0,1
652,Andrew Dice Clay: One Night with Dice,0,0,Comedy,United States of America,,False,0.6,en,1987-05-16,45,0.0,0
653,Big Country: Live at Rockpalast,0,0,,,,False,0.6,en,1986-01-01,,8.0,1
654,Big Country: Live at Rockpalast,0,0,,,,False,0.6,en,1991-01-01,,8.0,1
655,Big Country: Final Fling,0,0,"Documentary, Music",United Kingdom,Classic Pictures Entertainment,False,0.6,en,2002-05-16,200,10.0,1
656,Big Country: Eclectic,0,0,,,,False,0.6,en,,,9.0,1
657,Level 42 - Live at the Apollo,0,0,,,,False,0.6,en,2005-01-01,,0.0,0
658,Neil Peart - A Work in Progress,0,0,Music,,,False,1.484,en,2002-05-16,,5.3,2
659,Joe Satriani: Live in San Francisco,0,0,Music,,,False,0.84,en,2001-01-01,,6.2,3
660,Tears For Fears: Scenes from the Big Chair,0,0,Music,,,False,0.911,en,1985-05-16,200,6.0,1
661,The Swell Season Live From The Artists Den,0,0,,,,False,0.6,en,2008-01-01,,0.0,0
662,Seal: Live In Paris,0,0,Music,,,False,1.081,en,2004-06-05,112,4.0,3
663,Queensryche: The Art of Live,0,0,,,,False,0.6,en,2004-04-06,,6.0,1
664,Flex Appeal,0,0,Documentary,United States of America,Vista Video International,True,0.6,en,2003-01-01,78,0.0,0
665,King At The Controls - The King Jammy Story,0,0,Documentary,"Jamaica, United States of America",,False,0.6,en,2006-04-06,,7.0,1
666,Andrew Dice Clay: Dice Rules,0,0,Comedy,United States of America,"Seven Arts Pictures, Carolco Pictures",False,0.655,en,1991-05-17,85,7.7,3
667,Mark King Of Level 42 - Live In Concert,0,0,,,,False,0.6,en,2002-01-01,,0.0,0
668,Tears For Fears - Going To California,0,0,Music,,,False,0.6,en,1990-01-01,,3.8,2
669,Level 42 - The Retroglide Tour Live,0,0,,,,False,0.6,en,2006-10-31,,0.0,0
670,Tears for Fears: Tears Roll Down - Greatest Hits '82-'92,0,0,,,,False,0.85,en,2015-04-28,58,0.0,0
671,Motörhead: Stage Fright,0,0,Music,,,False,0.6,en,2005-07-18,240,6.0,1
672,The Way,12000000,0,"Action, Adventure",Russia,Way Film Company,False,1.329,en,2009-05-21,90,1.5,2
673,Amphitryon – Aus den Wolken kommt das Glück,0,0,"Comedy, Music",Germany,Universum Film (UFA),False,0.6,de,1935-07-18,105,8.0,2
674,Queensrÿche: Live Evolution,0,0,Music,,,False,0.696,en,2001-01-01,,4.8,2
675,Hell's Kitchen,6000000,0,"Crime, Drama",United States of America,HK Film Corporation,False,2.542,en,1998-09-11,95,5.1,22
676,The Crater Lake Monster,0,0,"Horror, Science Fiction",United States of America,Crown International Pictures,False,1.481,en,1977-03-01,85,3.9,13
677,Corrado,0,0,"Action, Crime, Drama, Thriller",United States of America,,False,1.291,de,2009-01-01,77,5.0,2
678,The White Ribbon,15238800,0,"Drama, Mystery","Austria, France, Germany, Italy","Lucky Red, wega film vienna, Les Films du Losange, X-Filme Creative Pool",False,7.496,de,2009-10-06,144,7.5,463
679,Land of the Minotaur,0,0,"Drama, Horror","Greece, United Kingdom, United States of America","Getty Pictures Corp., Poseidon Productions",False,1.322,en,1976-08-11,90,4.6,10
680,The Horde,0,0,"Action, Horror, Thriller",France,"Le Pacte, Capture The Flag Films",False,6.145,fr,2009-08-28,90,5.8,175
681,Together Again for the First Time,0,0,Comedy,,,False,0.6,en,2008-10-14,85,5.8,2
682,Keep Cool,0,0,Comedy,China,Guangxi Film Studio,False,3.181,zh,1997-05-16,93,7.7,9
683,Voices of a Distant Star,0,0,"Animation, Science Fiction, Romance",Japan,CoMix Wave Films,False,5.641,ja,2002-02-02,25,6.5,124
684,5 Against the House,0,0,"Drama, Action, Thriller",United States of America,"Dayle, Columbia Pictures",False,2.131,en,1955-06-10,84,5.8,10
685,Killer Queen!,0,0,Documentary,,,False,1.4,en,2002-06-01,92,0.0,0
686,Alexander the Great - The man behind the Legend,0,0,,,,False,0.6,en,,53,0.0,0
687,Swept Away,0,0,"Romance, Drama, Comedy",Italy,Medusa Produzione,False,4.995,it,1974-12-18,116,7.5,94
688,Honkytonk Man,0,0,"Western, Comedy, Drama, Music",United States of America,Malpaso Productions,False,4.422,en,1982-12-15,122,6.1,66
689,The Agronomist,0,0,Documentary,,,False,0.816,en,2004-04-23,90,6.6,6
690,In Search of History - The Knights Templar,0,0,Documentary,,"FilmRoos Productions, The History Channel",False,0.6,en,1997-11-12,43,0.0,0
691,An American Rhapsody,0,850225,"Drama, Family","United States of America, Hungary","Fireworks Pictures, Seven Arts Pictures, Paramount Vantage",False,2.001,en,2001-06-22,106,6.4,26
692,In Harm's Way,0,0,"War, Drama",United States of America,"Paramount, Otto Preminger Films",False,4.228,en,1965-04-05,165,6.9,40
693,Unconditional Love,0,0,"Drama, Comedy, Thriller",United States of America,Avery Pix,False,2.722,en,2002-08-23,124,6.4,28
694,Last Embrace,0,0,"Thriller, Mystery, Romance",United States of America,"United Artists, Taylor-Wigutow Productions",False,3.469,en,1979-05-04,102,5.6,25
695,Sweeney Todd,0,0,"Drama, Horror, Thriller, Music",United Kingdom,BBC,False,3.812,en,2006-01-03,90,6.4,68
696,Celine: Through the Eyes of the World,0,0,"Documentary, Music",Canada,,False,0.76,en,2010-02-17,120,6.7,5
697,"Abraxas, Guardian of the Universe",0,0,"Adventure, Science Fiction, Action","Canada, United States of America","Phoenix Entertainment Group (PEG), Rose & Ruby Productions",False,1.235,en,1990-12-18,90,3.1,16
698,Statues Also Die,0,0,Documentary,France,"Tadié Cinéma, Présence Africaine",False,1.758,fr,1953-05-01,30,6.9,15
699,Cencoroll,0,0,"Animation, Science Fiction",Japan,"Aniplex, Anime Innovation Tokyo",False,2.619,ja,2009-08-22,27,6.1,22
700,Fortress,0,0,"Horror, Thriller",Australia,Crawford Productions,False,2.582,en,1985-11-24,88,7.2,39
701,The Evilmaker,9000,0,Horror,United States of America,Pipedreams Entertainment,False,0.6,en,2000-06-03,99,0.0,0
702,MacGruber,10000000,6110000,"Action, Adventure, Comedy",United States of America,Relativity Media,False,6.371,en,2010-05-21,90,5.3,276
703,Flicka 2,0,0,"Adventure, Drama",United States of America,20th Century Fox,False,5.098,en,2010-05-04,96,6.0,50
704,Tales from Earthsea,22000000,68000000,"Adventure, Fantasy, Animation, Science Fiction",Japan,Studio Ghibli,False,7.172,ja,2006-07-29,115,6.6,517
705,One Dark Night,978000,0,Horror,United States of America,The Picture Company,False,2.639,en,1982-12-31,94,5.9,35
706,Happy Birthday to Me,0,0,"Drama, Horror, Thriller, Mystery",Canada,"Famous Players, Canadian Film Development Corporation (CFDC), The Birthday Film Company, Columbia Pictures",False,4.63,en,1981-05-15,110,6.1,63
707,Don't Look Back,0,0,Drama,Japan,Euro Space,False,0.6,ja,1999-10-23,75,7.0,1
708,Stranger in Our House,0,0,"Horror, Thriller, TV Movie",United States of America,"Finnegan Associates, Interplanetary Pictures Productions",False,2.0,en,1978-10-31,100,5.2,26
709,Youth of the Beast,0,0,"Action, Drama, Crime",Japan,Nikkatsu Corporation,False,3.066,ja,1963-04-21,92,6.9,32
710,Bleach: The Sealed Sword Frenzy,0,0,"Action, Comedy, Drama, Fantasy, Animation",Japan,"Dentsu, Pierrot",False,1.33,ja,2005-05-12,32,7.1,10
711,Vinnaithaandi Varuvaayaa,3000000,12000000,"Drama, Romance","India, United Kingdom","Escape Artists Motion Pictures, RS Infotainment",False,2.55,ta,2010-02-26,157,7.6,29
712,City of Fear,0,0,"Drama, Thriller",United States of America,Columbia Pictures,False,2.544,en,1959-02-01,81,6.3,9
713,Eureka,0,123572,"Drama, Action, Thriller","United Kingdom, United States of America","Sunley Productions Ltd., JF Productions, Recorded Picture Company (RPC), United Artists",False,3.215,en,1983-05-01,130,6.0,22
714,The Lazarus Child,0,0,Drama,"Germany, United States of America, Italy, Canada, United Kingdom","Tandem Communications, Eagle Pictures, Illusions Entertainment Corporation, Midsummer Films, Morgan Creek Productions",False,0.804,en,2006-11-03,93,5.4,11
715,The Lion in Winter,0,0,"Drama, History",United States of America,"Flying Freehold Productions, HCC Happy Crew Company, Hallmark Entertainment, Matt IV, Showtime Networks",False,0.849,en,2003-12-26,153,6.8,7
716,Sin,0,0,"Action, Crime, Drama, Romance, Thriller, Mystery",United States of America,,False,2.159,en,2003-01-01,107,5.2,12
717,Snakehead Terror,0,0,"Comedy, Horror, Science Fiction",,,False,4.815,en,2004-01-01,77,5.1,17
718,Strange Hearts,0,0,"Comedy, Drama",,,False,0.706,en,2002-10-23,90,5.0,1
719,A Monkey's Tale,0,0,"Adventure, Animation, Family","Hungary, France, United Kingdom, Germany","Steve Walsh Productions, Cologne Cartoon, Les Films du Triangle",False,1.913,fr,1999-06-02,80,5.8,21
720,Charlie St. Cloud,44000000,48190704,"Drama, Romance",United States of America,"Marc Platt Productions, Universal Pictures, Relativity Media",False,8.92,en,2010-05-01,99,6.9,1436
721,Raajneeti,0,0,"Drama, Thriller",India,UTV Motion Pictures,False,4.021,hi,2010-06-04,167,6.3,34
722,The Weeping Meadow,0,0,"Romance, Drama, History","France, Germany, Greece, Italy","ZDF/Arte, Hellenic Radio & Television (ERT), Attica Art Productions, Networxx - Film Management, Intermédias, Classic, Istituto Luce, Rai Cinemafiction, Bac Films, Movie Reinhold Elschot, ZDF, Eurimages, Greek Film Centre, Network Movie Film-und Fernsehproduktion, Rai Cinema, Theo Angelopoulos Films, Canal+, ARTE France Cinéma",False,1.785,el,2004-02-20,170,7.6,24
723,This Is Love,0,0,Drama,Germany,Badlands Film,False,0.6,en,2009-09-20,106,0.0,0
724,The Breaking Point,0,0,"Drama, Crime",United States of America,Warner Bros. Pictures,False,2.357,en,1950-10-06,97,7.0,25
725,A Walk to Beautiful,0,0,Documentary,Ethiopia,Engel Entertainment,False,0.713,en,2007-05-05,85,6.4,4
726,The House Across the Bay,713965,684374,Drama,United States of America,"Walter Wanger Productions, United Artists",False,1.809,en,1940-03-01,88,6.1,6
727,Morcheeba: From Brixton to Beijing,0,0,Music,,"Rhino Films, WEA/Reprise",False,1.4,en,2003-06-30,125,4.5,2
728,Immortals,75000000,226904017,"Fantasy, Action, Drama",United States of America,"Virgin Produced, Mark Canton Productions",False,9.853,en,2011-11-10,110,5.8,1454
729,GO,0,0,"Comedy, Drama",Japan,,False,3.598,ja,2001-10-20,122,7.1,20
730,The Million Eyes of Sumuru,0,0,"Action, Adventure, Crime",United Kingdom,American International Pictures (AIP),False,1.681,en,1967-05-05,80,4.5,15
731,Kaiji: The Ultimate Gambler,0,0,"Thriller, Drama",Japan,"Toho Company, Ltd., Nippon Television Network (NTV), Horipro",False,2.429,ja,2009-10-10,130,6.2,10
732,Phobia 2,0,0,"Thriller, Horror",Thailand,GMM Tai Hub (GTH),False,2.814,th,2009-09-23,125,6.2,39
733,Brown Sugar,8000000,27362712,"Comedy, Romance",,,False,5.385,en,2002-10-05,109,6.7,52
734,The Incredible Journey,0,0,"Adventure, Family","Canada, United States of America",Walt Disney Pictures,False,2.803,en,1963-11-20,80,6.7,46
735,Hide,0,0,"Action, Horror, Mystery","Canada, Argentina",Wishbone Entertainment Inc.,False,2.898,en,2008-12-17,96,6.3,6
736,Bet Your Life,5000000,0,"TV Movie, Action, Thriller",,,False,0.962,en,2004-08-02,120,4.3,4
737,Alone,0,0,"Drama, Horror, Thriller",Thailand,"Dedicate Ltd., GMM Tai Hub (GTH), Phenomena",False,4.049,th,2007-03-28,90,6.6,73
738,The Star Maker,0,0,"Drama, Romance",Italy,Cecchi Gori Group Tiger Cinematografica,False,4.693,it,1995-09-21,113,7.0,64
739,Timeless... A National Parks Odyssey,0,0,Documentary,,,False,0.6,en,2006-01-01,50,4.3,2
740,The Black Cat,0,0,"Horror, Drama, Fantasy",Italy,"World Picture, 21st Century Film Corporation",False,0.6,en,1989-01-01,89,2.5,2
741,Niagara Motel,0,0,Drama,"Canada, United Kingdom","Aquarius Films, Buffalo Gal Pictures, Indian Grove Productions, Muse Entertainment",False,0.872,en,2005-03-23,88,5.9,4
742,Saviors in the Night,0,0,Drama,"France, Germany","3L Filmproduktion GmbH, Acajou Films, FilmForm Köln",False,1.274,de,2009-10-07,95,4.2,3
743,Endless Orgy for the Goddess of Perversion,0,0,Documentary,,,False,0.873,en,2008-05-03,78,0.0,0
744,I.K.U.,0,0,Science Fiction,Japan,"Aries [jp], Uplink Co.",True,2.444,en,2000-01-01,90,3.8,5
745,Rabbit Fever,0,0,Comedy,United Kingdom,Starfield Productions,False,0.947,en,2006-09-22,85,6.5,2
746,Eye in the Sky,0,0,"Action, Thriller",Hong Kong,Milkyway Image Company,False,1.983,cn,2007-06-21,90,6.3,24
747,The Trials Of Darryl Hunt,0,0,Documentary,United States of America,,False,1.841,en,2007-06-15,106,8.4,7
748,Kamen Rider Kabuto: God Speed Love,6000000,0,"Science Fiction, Action, Adventure",Japan,"Ishimori Productions, Toei Company, Ltd.",False,1.391,ja,2006-08-05,66,6.0,4
749,Innocents,0,0,Thriller,,,False,1.374,en,2000-01-10,90,3.5,3
750,Vares: Private Eye,0,0,"Action, Comedy, Crime",Finland,Solar Films,False,2.186,fi,2004-07-22,95,6.1,17
751,Don't Try This at Home!,0,0,,,,False,0.6,en,1990-11-23,47,8.0,1
752,Don Camillo in Moscow,0,0,Comedy,"Italy, France, Germany","Francoriz Production, Omnia-Film, Rizzoli Film",False,4.152,it,1965-09-17,95,7.2,75
753,Phantom Lady,0,0,"Crime, Drama",United States of America,Universal Pictures,False,3.972,en,1944-01-28,87,6.7,41
754,Angels of the Sun,0,0,Drama,Brazil,"Globo Filmes, Apema Filmes, Caradecão Filmes",False,1.656,pt,2006-03-04,92,7.2,19
755,Ecstasy of the Angels,0,0,"Action, Drama, Romance, Mystery",Japan,"Wakamatsu Production, Art Theatre Guild",False,1.322,ja,1972-03-11,89,6.7,10
756,The Insects Unlisted in the Encyclopedia,0,0,,Japan,,False,0.689,ja,2007-06-23,103,10.0,2
757,Federal Protection,0,0,"TV Movie, Action, Crime, Drama",United States of America,"City Heat Productions, Chariot Communications",False,1.686,de,2002-01-01,,5.4,5
758,Permanent Vacation,0,0,Drama,United States of America,Cinesthesia Productions,False,3.976,en,1980-01-01,75,6.4,58
759,Freeze Me,0,0,"Drama, Horror, Thriller",Japan,,False,2.003,ja,2000-05-23,101,6.3,15
760,Fog and Night,0,0,,Turkey,,False,0.712,tr,2007-02-23,90,5.8,4
761,Rainbow Eyes,0,0,"Thriller, Romance",,,False,1.81,ko,2007-12-27,99,7.4,8
762,Part of the Weekend Never Dies,0,0,"Music, Documentary",,,False,0.817,en,2008-04-24,60,5.4,6
763,Little Lord Fauntleroy,0,0,"TV Movie, Family, Drama",United Kingdom,Norman Rosemont Productions,False,5.099,en,1980-11-25,103,7.4,119
764,Kamui,0,0,"Drama, Action",Japan,,False,2.631,ja,2009-09-19,115,6.0,17
765,The Trouble with Angels,0,0,"Comedy, Family",United States of America,Columbia Pictures,False,2.638,en,1966-03-29,112,7.0,24
766,Power Trip,0,0,Documentary,"Georgia, United States of America",,False,0.6,da,2003-12-17,86,4.0,2
767,Rooie Sien,0,0,,,,False,0.6,nl,1975-03-27,,0.0,0
768,Automatic,0,0,"Action, Science Fiction, Horror, Thriller",United States of America,"Lakeview Productions, Republic Pictures (II)",False,1.377,en,1995-04-08,90,5.1,10
769,George Lopez: Why You Crying?,0,0,Comedy,United States of America,,False,1.772,en,2005-09-23,79,10.0,2
770,Veda - Atatürk,0,0,"History, Drama",,,False,0.757,en,2010-02-26,,5.9,8
771,Romantik Komedi,0,0,"Romance, Comedy",,,False,2.813,tr,2010-02-05,,5.0,16
772,Heartbreak Hotel,0,0,"Comedy, Music",United States of America,"Silver Screen Partners III, Touchstone Pictures",False,2.211,en,1988-09-30,97,5.0,11
773,Marjoe,0,0,Documentary,United States of America,"Mauser Productions, Cinema X",False,1.431,en,1972-07-24,88,7.9,11
774,Off Limits,12000000,7242035,"Action, Crime, Drama, Mystery, Thriller",United States of America,"American Entertainment Partners L.P., 20th Century Fox",False,3.465,en,1988-03-11,102,6.0,22
775,Tarzan and the Lost City,0,0,"Action, Adventure","Australia, Germany, United States of America","Dieter Geissler Filmproduktion, Alta Vista, Village Roadshow Pictures, Clipsal Films, Film Afrika Worldwide",False,1.508,en,1998-04-24,83,3.9,14
776,Whatever,0,0,Drama,France,"Lazennec Films, Canal+",False,1.847,fr,1999-10-13,120,6.1,12
777,Revolution in the Head: Rage Against the Machine and the Art of Protest,0,0,,,,False,0.6,en,2010-02-23,60,0.0,0
778,Firelight,0,0,"Romance, Drama","United Kingdom, United States of America","Wind Dancer Productions, Hollywood Pictures",False,3.439,en,1997-09-14,103,7.0,26
779,UFC 114: Rampage vs. Evans,0,0,,,,False,0.701,en,2010-05-29,178,3.8,2
780,UFC 115: Liddell vs. Franklin,0,0,,,,False,0.6,en,2010-06-12,177,6.4,4
781,Battle Under Orion,0,0,"Drama, Action, War",Japan,"ABC TV, tv asahi, Toho Company, Ltd.",False,0.6,ja,2009-06-13,120,6.0,3
782,1940 Lo Oka Gramam,0,0,Drama,India,,False,0.93,te,2010-04-16,132,0.0,0
783,Dhee,0,0,Comedy,,,False,0.683,te,2007-04-13,143,6.3,3
784,Bear Island,12200000,0,Thriller,"Canada, United Kingdom","Bear Island Films (U.K.) Limited, Canadian Film Development Corporation (CFDC), Selkirk Films, Columbia Pictures",False,2.451,en,1979-12-05,118,6.4,15
785,The Burning Man Festival,0,0,Documentary,United States of America,,False,0.6,en,1997-01-01,45,4.3,2
786,Confessions of a Burning Man,0,0,Documentary,United States of America,,False,0.6,en,2003-10-23,83,4.0,2
787,The Craven Sluck,0,0,"Comedy, Science Fiction",United States of America,,False,0.84,en,1967-01-01,20,7.6,5
788,"Gou-Gou, the Cat",0,0,"Drama, Comedy",,Asmik Ace,False,1.043,ja,2008-09-06,116,6.0,3
789,Dancing Outlaw,0,0,Documentary,United States of America,,False,1.596,en,1991-01-01,28,6.3,6
790,The Danish Poet,0,0,"Animation, Romance","Canada, Norway","Mikrofilm, National Film Board of Canada",False,1.719,en,2006-02-15,15,7.1,22
791,Dancing Outlaw II: Jesco Goes to Hollywood,0,0,Documentary,United States of America,,False,0.6,en,1999-01-01,30,4.3,2
792,Vaaranam Aayiram,3000000,14000000,"Drama, Romance",India,"Aascar Film Pvt. Ltd, Cloud Nine Movies",False,1.89,ta,2008-11-14,169,7.6,24
793,Divine Horsemen: The Living Gods of Haiti,0,0,Documentary,"Haiti, United States of America",,False,1.36,en,1977-12-11,52,6.5,5
794,D.I.Y. or Die: How to Survive as an Independent Artist,0,0,Documentary,United States of America,,False,1.449,en,2002-01-01,55,4.6,4
795,Choke,0,0,Thriller,United States of America,,False,0.801,en,2001-01-01,89,3.7,5
796,Doomsday Gun,0,0,"History, Drama, Action, Thriller",United States of America,HBO,False,1.853,en,1994-07-23,120,6.0,5
797,Pimp,0,0,Thriller,United Kingdom,"Coppola Productions, Jubilee Pictures, The Mews Post Production, Premiere Picture, Triple S Films",False,1.64,en,2010-05-21,91,3.7,6
798,Los Angeles Plays Itself,0,0,Documentary,,,False,1.691,en,2003-09-07,169,7.5,23
799,And Then Came Lola,0,0,"Comedy, Drama",,,False,2.87,en,2009-01-01,71,5.8,18
800,Nicholas and Alexandra,0,0,"Romance, Drama, War, History",United Kingdom,Columbia Pictures,False,4.303,en,1971-11-29,189,7.1,28
801,This Year's Love,0,0,"Drama, Comedy, Romance",United Kingdom,"Kismet Film Company, Entertainment Film Distributors",False,0.979,en,1999-02-19,108,5.8,4
802,Caravan to Vaccarès,0,0,"Thriller, Action, Mystery","France, United Kingdom","Geoffrey Reeve Productions, Societe Nouvelle Prodis, Crowndale Holdings Ltd., Rank Film (UK)",False,1.176,en,1974-08-08,98,6.0,2
803,The Hostage Tower,0,0,"Thriller, Crime",United States of America,"Sandrews, Jerry Leider Productions",False,0.6,en,1980-09-19,100,7.0,1
804,Night Watch,6000000,0,"TV Movie, Action, Thriller","United Kingdom, United States of America, Croatia","Jadran Film, J&M Entertainment, British Lion Films",False,1.337,en,1995-10-04,94,4.7,14
805,River of Death,0,0,Adventure,United States of America,"Breton Film Productions, Cannon Group, Pathé Entertainment",False,3.302,en,1989-09-29,107,5.5,14
806,The Way to Dusty Death,0,0,"Crime, Action",,,False,0.621,en,1995-09-25,,7.0,1
807,When Eight Bells Toll,0,0,"Action, Thriller",United Kingdom,"Winkast Film Productions, Jerry Gershwin-Elliott Kastner",False,3.32,en,1971-03-09,94,5.5,14
808,"Boeing, Boeing",0,0,"Comedy, Drama",United States of America,"Paramount, Hal Wallis Productions",False,3.363,en,1965-12-22,102,6.6,34
809,Battle at Bloody Beach,0,0,"Drama, War",United States of America,"Associated Producers (API), 20th Century Fox",False,0.831,en,1961-06-20,83,4.0,3
810,Ride a Crooked Trail,0,0,Western,United States of America,Universal International Pictures,False,3.04,en,1958-09-01,87,5.8,6
811,Six Black Horses,0,0,"Drama, Romance, Western",United States of America,,False,2.519,en,1962-08-24,80,4.9,7
812,Tarzan Escapes,0,0,"Action, Adventure",United States of America,Metro-Goldwyn-Mayer,False,4.362,en,1936-11-06,89,6.0,22
813,The Hurricane Express,0,0,Adventure,United States of America,Mascot Pictures,False,1.486,en,1932-08-01,79,5.7,6
814,Åsa-Nisse på jaktstigen,0,0,Comedy,Sweden,AB Svensk Talfilm,False,0.776,en,1950-09-11,94,3.3,3
815,The Kid from Texas,0,0,"Action, Western",United States of America,Universal International Pictures,False,1.546,en,1950-03-01,78,4.5,9
816,The Legend of the Lone Ranger,18000000,2945600,"Action, Adventure, Romance, Western",United States of America,ITC Entertainment,False,2.899,en,1981-08-20,98,3.8,18
817,The Wild and the Innocent,0,0,Western,United States of America,Universal International Pictures,False,1.915,en,1959-05-27,84,6.2,6
818,Srebrenica: A Cry from the Grave,0,0,Documentary,"Netherlands, United Kingdom, United States of America",BBC,False,0.6,en,1999-01-01,150,0.0,0
819,The Eternal Jew,0,0,Documentary,Germany,Deutsche Film Gesellschaft (DFG),False,3.185,de,1940-11-28,62,4.2,22
820,Tornado Valley,0,0,"Action, Adventure, Drama, Thriller","United States of America, Canada",,False,1.103,en,2009-01-01,87,7.5,7
821,The Five Man Army,0,0,Western,Italy,"Tiger Film, Metro-Goldwyn-Mayer",False,1.873,it,1969-10-16,105,6.9,14
822,Åsa-Nisse,0,0,Comedy,Sweden,AB Svensk Talfilm,False,0.928,sv,1949-10-22,102,3.0,4
823,Åsa-Nisse på nya äventyr,0,0,Comedy,Sweden,Svensk Talfilm,False,1.238,en,1952-09-19,88,3.3,3
824,Trailer Park Boys,0,0,Comedy,Canada,Showcase Television,False,2.814,en,1999-07-15,67,7.5,29
825,Adhurs,0,0,"Action, Comedy, Drama",India,,False,0.831,te,2010-01-13,150,6.2,5
826,National Geographic: China's Lost Girls,0,0,Documentary,,,False,1.239,en,2004-06-20,43,6.0,1
827,40 Guns to Apache Pass,0,0,Western,United States of America,Columbia Pictures,False,2.411,en,1967-05-01,95,4.2,11
828,Mission Bloody Mary,0,0,Adventure,"France, Italy, Spain","Fida Cinematografica, Época Films S.A.",False,0.6,fr,1965-08-13,101,6.5,2
829,The Battle at Apache Pass,0,0,"Action, Western",United States of America,Universal International Pictures,False,2.031,en,1952-04-01,85,5.8,7
830,Cobra Woman,0,0,"Adventure, Drama",United States of America,Universal Pictures,False,1.543,en,1944-05-12,71,5.9,7
831,Jane Eyre,0,34710627,"Drama, Romance","United Kingdom, United States of America","BBC Films, Ruby Films, Focus Features, Lipsync Productions",False,5.843,en,2011-03-11,120,7.1,780
832,The Little Unicorn,0,0,Family,,Peakviewing Transatlantic Plc,False,0.824,en,2002-12-14,81,2.5,4
833,The Boys from Baghdad High,0,0,Documentary,,,False,0.6,en,2008-01-07,88,6.0,1
834,Flesh and the Devil,373000,658000,"Drama, Romance",United States of America,Metro-Goldwyn-Mayer,False,2.678,en,1926-12-25,112,7.5,19
835,Pandora and the Flying Dutchman,0,0,"Drama, Fantasy, Mystery, Romance",United Kingdom,"Romulus Films, Dorkay Productions",False,3.766,en,1951-02-15,122,6.3,37
836,Coney Island,0,0,Comedy,United States of America,Comique Film Company,False,2.468,en,1917-10-29,25,6.2,27
837,Joe Kid on a Stingray,0,0,,,,False,0.84,en,2005-01-27,60,9.0,3
838,Moonbeam Bear and His Friends,0,0,"Animation, Family",Germany,"Universum Film (UFA), Beta Film, Caligari Film GmbH",False,0.661,de,2008-10-16,71,6.5,2
839,Monsieur Hire,0,0,"Crime, Drama",France,,False,2.622,fr,1989-05-24,81,7.3,57
840,Ti Stramo,0,0,,Italy,,False,1.33,it,2008-11-28,95,4.8,25
841,Hollywood Canteen,0,0,"Comedy, Music, Romance",United States of America,Warner Bros. Pictures,False,1.429,en,1944-12-31,124,6.8,13
842,Brave New World,0,0,"Science Fiction, TV Movie",United States of America,Universal Television,False,0.839,en,1980-03-07,180,5.8,7
843,Bad Boys for Life,0,0,"Thriller, Action, Crime",United States of America,"Columbia Pictures, Sony Pictures, Jerry Bruckheimer Films, Platinum Dunes, 2.0 Entertainment",False,4.07,en,2020-01-16,,0.0,0
844,The Devil's Rain,0,0,Horror,United States of America,"Sandy Howard Productions, Bryanston Distributing",False,3.888,en,1975-07-01,86,5.2,24
845,Reckless,0,0,"Drama, Romance",United States of America,Metro-Goldwyn-Mayer,False,1.503,en,1984-02-03,90,6.9,9
846,The Cruel Tower,0,0,Drama,United States of America,Lindsley Parsons Picture Corporation,False,0.667,en,1956-10-28,79,6.3,3
847,The Fargo Kid,0,0,Western,United States of America,RKO Radio Pictures,False,0.6,en,1940-12-06,63,7.0,1
848,Convict 13,0,0,Comedy,United States of America,Joseph M. Schenck Production,False,2.824,fr,1920-10-27,20,6.9,36
849,The Sect,0,0,"Thriller, Horror",Italy,"ADC Films, Penta Films",False,4.351,it,1991-03-01,116,5.8,31
850,Gangster's Boy,0,0,Drama,United States of America,Monogram Pictures,False,0.638,en,1938-11-16,80,0.0,0
