,title,budget,revenue,genres,production_countries,production_companies,adult,popularity,original_language,release_date,runtime,vote_average,vote_count
278,Serenity,25000000,8547045,Thriller,United States of America,"IM Global, Global Road Entertainment, Shoebox Films, Starlings Entertainment",False,21.469,en,2019-01-24,106,5.2,428
279,Mr. Pride VS Miss. Prejudice,0,0,"Romance, Comedy",China,,False,1.798,zh,2017-04-21,108,6.7,7
280,Cheating Cheaters,0,0,Comedy,United States of America,Universal Pictures,False,0.6,en,1934-11-05,70,0.0,0
281,A Whispery Weekend,0,0,,,,False,0.6,en,,1,0.0,0
282,"On a Day of Ordinary Violence, My Friend Michel Seurat...",0,0,Documentary,"France, Lebanon","Maram CTV, Leil Production, Alia Films, La Sept-Arte",False,1.091,fr,1996-04-19,50,0.0,0
283,Come Fly With Me: The Story of Pan Am,0,0,,,,False,0.6,en,2011-11-12,60,0.0,0
284,Trump Rally,0,0,Documentary,United States of America,Veryape,False,0.891,en,2016-01-31,21,0.0,0
285,Youkali,0,0,Drama,Germany,,True,0.6,de,,74,0.0,0
286,Honor Thy Father,0,0,Drama,Taiwan,Central Motion Picture Corporation,False,0.664,zh,1989-04-18,120,0.0,0
287,Nikki Hearts’ Turning Girls Out,0,0,,,,True,0.6,en,2015-01-12,128,10.0,1
288,Намір,35000,0,"Mystery, Drama",Ukraine,,False,0.6,uk,,,0.0,0
289,Lily Cade’s Lesbian Lock-Up,0,0,,,,True,0.6,en,2013-10-14,125,9.0,1
290,The Real L Word XXX NYC Edition,0,0,,,,True,0.6,en,2013-02-25,156,10.0,1
291,Chévere o la victoria de Wellington,0,0,"Comedy, Drama",Venezuela,Chevere,False,0.621,es,1971-03-17,20,0.0,0
292,Pájaros negros,0,0,,,,False,0.6,es,2015-10-15,,4.0,2
293,Dandy,0,0,Drama,United States of America,Dynacom Productions Inc.,False,1.124,en,1970-11-13,82,0.0,0
294,Lezzz Be Roommates,0,0,,,,True,0.6,en,2016-04-25,115,10.0,1
295,Power,0,0,,,,False,0.855,en,2016-07-24,140,0.0,0
296,Mining for God,0,0,"Family, Documentary",,,False,0.84,en,2015-08-10,64,0.0,0
297,A Song for Tibet,0,0,Documentary,Canada,National Film Board of Canada,False,0.6,en,1991-01-01,57,0.0,0
298,Park Shanghai,0,0,,,,False,0.6,en,,94,0.0,0
299,Huevos con besos brujos y mucho amor,0,0,"Romance, Drama",Mexico,Centro,False,0.6,en,2006-06-03,4,1.0,1
300,"The Films of Charles & Ray Eames, Vol. 2",0,0,,,,False,0.6,en,2000-09-05,,0.0,0
301,"The Films of Charles & Ray Eames, Vol. 1: The Powers of 10",0,0,,,,False,0.6,en,2000-09-05,,0.0,0
302,"The Films of Charles & Ray Eames, Vol. 3: The World of Franklin & Jefferson",0,0,,,,False,0.6,en,2000-10-10,,0.0,0
303,"The Films of Charles & Ray Eames, Vol. 4",0,0,,,,False,0.6,en,2000-11-07,,0.0,0
304,"The Films of Charles & Ray Eames, Vol. 5",0,0,,,,False,0.6,en,2000-12-19,,0.0,0
305,Autumn,0,0,Drama,Portugal,Ukbar Films,False,0.6,pt,2014-07-05,11,0.0,0
306,"The Films of Charles & Ray Eames, Vol. 6",0,0,,,,False,0.6,en,2005-08-23,,0.0,0
307,Crime of the Century,0,0,"Thriller, Science Fiction, Crime, Action",,,False,0.6,en,,,0.0,0
308,Dancing the Nutcracker: Inside the Royal Ballet,0,0,Documentary,United Kingdom,"BBC, Oxford Film and Television",False,0.84,en,2016-01-01,90,0.0,0
309,Strangers On The Earth,0,0,Documentary,,,False,0.6,en,2017-04-22,96,0.0,0
310,Along the Oregon Trail,0,0,Western,United States of America,Republic Pictures,False,0.627,en,1947-08-30,64,0.0,0
311,Le Retour à la terre,0,0,Documentary,Canada,National Film Board of Canada,False,0.6,fr,1976-01-01,,0.0,0
312,Mattress,0,0,Comedy,Canada,Crazy8s Film Society,False,0.6,en,2014-02-14,10,0.0,0
313,The Fighting Vigilantes,0,0,Western,United States of America,Producers Releasing Corporation (PRC),False,0.825,en,1947-11-15,61,5.0,1
314,RiffTrax Live: Night of the Living Dead,0,0,,,,False,0.6,en,2013-10-24,116,8.0,1
315,The Mornings of a Sensible Youth,0,0,Drama,Romania,Filmstudio București,False,1.491,ro,1967-01-16,93,5.0,1
316,The Ambassador of God,1,0,Documentary,United States of America,Diamond in the Rough Films,False,0.6,en,2015-10-18,93,0.0,0
317,Venal,0,0,Drama,,,False,0.6,ml,1981-07-03,104,0.0,0
318,I Am Battle Comic,0,0,Documentary,"United States of America, Afghanistan, Kuwait, Iraq",Brady Oil Entertainment,False,1.4,en,2017-03-23,,9.0,1
319,The Phonebook,0,0,,Canada,,False,0.6,en,,10,0.0,0
320,Anal Teen Dreams 2,0,0,,,Wicked Pictures,True,0.6,en,2013-06-10,,0.0,0
321,I have no memory of my direction,0,0,Documentary,,,False,0.6,en,2005-01-01,,0.0,0
322,This Actually Happens a Lot,0,0,Animation,United States of America,CalArts,False,1.403,en,2013-05-09,3,8.0,4
323,Everybody's Nuts,0,0,,,,False,0.6,en,,13,0.0,0
324,Workplace,0,0,Documentary,United States of America,,False,0.6,en,2016-01-01,64,0.0,0
325,Body Farm,0,0,Horror,,,False,1.032,en,2017-10-31,,0.0,0
326,Men in Scoring Position,0,0,Drama,,,False,0.6,en,1999-01-01,,0.0,0
327,the INDIAN PACIFIC WHEEL RACE,0,0,Documentary,Australia,NuthinButShorts International,False,0.6,en,2017-04-16,44,0.0,0
328,7 Witches,0,31100,"Horror, Thriller",United States of America,GMMG Films,False,2.536,en,2017-04-14,75,4.8,22
329,"Cook, mug, cook!",0,0,Animation,Czech Republic,Alkay Animation Prague,False,0.674,cs,2007-05-06,,5.0,1
330,Oru Kochu Swapnam,0,0,,,,False,0.638,ml,1984-03-02,124,0.0,0
331,Jellywolf,0,0,"Drama, Fantasy",,Delirio Films,False,0.887,en,2017-02-27,8,0.0,0
332,The Cave of the Silken Web,0,0,"Adventure, Fantasy",China,,False,0.665,zh,1927-02-02,59,0.0,0
333,The Cave of the Silken Web II,0,0,"Adventure, Fantasy",China,,False,0.6,en,1930-02-03,,0.0,0
334,Prom?!,0,0,Comedy,United States of America,,False,0.6,en,2013-07-19,4,0.0,0
335,The Adventures of Sun Wu Kung,0,0,"Adventure, Fantasy",Japan,"Toho Company, Ltd.",False,0.6,ja,1959-04-19,98,0.0,0
336,Chillu,0,0,Drama,,,False,0.644,ml,1982-07-09,116,0.0,0
337,Red apples,0,0,Drama,"Armenia, United States of America, Georgia",Zinahar Films,False,0.692,en,2017-04-19,15,5.0,1
338,Happy Birthday Mario Woods,0,0,Documentary,,,False,0.6,en,2017-04-19,6,0.0,0
339,Meaningless Conversations in Beautiful Environments,0,0,"Drama, Comedy",Sweden,GNUFILM,False,0.816,en,2017-04-19,8,0.0,0
340,Fire Ball,0,0,"Fantasy, Animation, Adventure",Taiwan,,False,0.6,en,2005-06-01,,0.0,0
341,Break of Day,0,0,"Mystery, Drama",,,False,1.192,en,2017-04-19,19,0.0,0
342,In The Wake of Ghost Ship,0,0,,,,False,0.6,en,2017-04-19,20,0.0,0
343,Wu Kong,0,0,"Fantasy, Action, Adventure",China,,False,5.471,zh,2017-07-13,130,7.5,24
344,Couples Seduce Teens 5,0,0,,United States of America,Pink Visual,True,0.6,en,2006-12-28,160,0.0,0
345,Gülşah Küçük Anne,0,0,"Family, Drama",Turkey,Gülşah Film,False,0.6,tr,1976-01-01,,0.0,0
346,Η αγάπη μας,0,0,"Comedy, Drama, Music, Romance",Greece,Karagiannis-Karatzopoulos,False,2.546,el,1968-03-25,95,5.3,3
347,Changeover,0,0,Drama,United States of America,,False,1.134,en,2016-04-12,90,6.0,1
348,"I Move, So I Am",0,0,Animation,Netherlands,cilia van dijk Filmproduktie,False,0.909,nl,1998-01-01,8,7.0,2
349,Slashed Prices: The Making of Intruder,0,0,,,,False,0.641,en,2011-12-13,38,10.0,1
350,Varyemez,0,0,"Comedy, Drama",Turkey,Erler Film,False,1.39,tr,1991-01-01,,5.0,5
351,The High Cost of Cheap Gas,0,0,Documentary,,,False,0.6,en,2015-01-01,56,0.0,0
352,Kamen Rider Decade: All Riders Super Spin-off,0,0,"Comedy, Action, Science Fiction",Japan,"Ishinomori Productions, Toei Company, Ltd.",False,0.9,ja,2009-07-17,71,0.0,0
353,Room 511,0,0,Horror,,,False,1.126,en,,,0.0,0
354,Metamorphoses,0,0,Documentary,,,False,0.6,fi,2017-03-31,75,0.0,0
355,Supermassive Black Holes,0,0,Documentary,United Kingdom,,False,0.836,en,2000-11-30,49,7.7,3
356,The Boy from Lapland,0,0,"Family, Adventure, Drama",Norway,,False,0.6,en,1977-01-01,86,0.0,0
357,White Oil II,0,0,,Palestinian Territory,,False,0.61,ar,2017-04-07,48,0.0,0
358,Talih Kuşu,0,0,"Drama, Comedy",Turkey,Erler Film,False,1.143,tr,1989-01-01,,7.0,5
359,Bázo,0,0,Drama,Norway,Filmpool Nord,False,0.6,en,2003-09-12,,0.0,0
360,The Twin,0,0,"Thriller, Drama, Horror, Mystery, TV Movie",United States of America,Rose Noir Films,False,1.503,en,2017-01-01,,6.3,15
361,Gülen Adam,0,0,"Drama, Comedy",Turkey,Cem Film,False,0.883,tr,1989-01-26,,6.9,7
362,Road Back To Malice,0,0,Documentary,United Kingdom,,False,0.6,en,2017-03-27,25,0.0,0
363,DC Super Hero Girls: Intergalactic Games,0,0,"Animation, Family",United States of America,,False,2.256,en,2017-05-09,76,5.0,6
364,Duoddara árbi,0,0,"Documentary, Drama","Finland, Norway, Sweden",Eurimages,False,0.805,sv,1994-12-16,82,0.0,0
365,Give us our skeletons!,0,0,Documentary,"Finland, Norway, Sweden, Denmark",,False,0.841,en,1999-03-05,51,0.0,0
366,Art of the Game: Ukiyo-e Heroes,0,0,Documentary,,,False,0.6,en,2017-05-02,,0.0,0
367,Buñuel: Atheist Thanks to God,0,0,Documentary,France,"StudioCanal, CinéCinéma",False,0.84,fr,2005-11-14,32,5.0,1
368,Vigathakumaran,0,0,,India,The Travancore National Pictures Limited,False,0.6,ml,1930-10-23,,0.0,0
369,"Boysetsfire Farewell Show - June 9th, The Trocadero, Philadelphia, PA",0,0,Music,United States of America,Elany Arts,False,0.6,en,2009-06-01,,0.0,0
370,The Lebanese Mission,0,0,,,,False,0.6,fr,1956-09-12,,0.0,0
371,The River Man,0,0,,,,False,0.6,en,,,0.0,0
372,Haroun - Spectacle Spécial Elections,0,0,Comedy,,,False,0.931,fr,2017-04-18,,7.0,2
373,Dix puissance moins quarante-trois seconde,0,0,,France,Miyu Productions,False,0.859,fr,2017-01-01,14,0.0,0
374,Ormakkayi,0,0,,,,False,0.6,ml,1982-10-10,111,0.0,0
375,Feel Good To Say Goodbye,0,0,Drama,Thailand,,False,0.6,th,2016-09-09,,0.0,0
376,Lake Alice,0,0,Horror,United States of America,"Glass Horse Films, Gas Lamp Entertainment",False,2.131,en,2017-05-08,80,4.3,25
377,Den ryska dörren,0,0,"TV Movie, Drama, Comedy",Sweden,Trelandsfilm AB,False,1.244,ru,2010-04-05,57,9.0,1
378,Summer with Kuro,0,0,"Drama, Animation, History",Japan,"Gen Productions, Chugoku Broadcasting (RCC)",False,0.6,ja,1990-06-04,67,0.0,0
379,Zagubione uczucia,0,0,,,,False,0.6,pl,1957-10-20,75,0.0,0
380,Gun Talk,0,0,Western,United States of America,Monogram Pictures,False,0.6,en,1947-12-20,57,0.0,0
381,The Silent Teacher,0,0,,,,False,0.6,zh,2017-05-18,73,0.0,0
382,Herkules,0,0,Documentary,Germany,,False,0.84,de,2017-03-25,,0.0,0
383,Byttinger,0,0,Drama,,,False,1.4,no,1991-12-26,,0.0,0
384,A Murderous Affair: The Carolyn Warmus Story,0,0,"Drama, Crime",United States of America,Spectacor Films,False,0.6,en,1992-09-13,96,5.0,1
385,2CELLOS (Sulic & Hauser) Live at Arena Zagreb,0,0,,,,False,0.941,it,2018-03-23,79,0.0,1
386,Lokmanya - Ek Yugpurush,5,10,,,,False,0.946,mr,,139,10.0,2
387,King of the Wild Horses,0,0,"Family, Western",United States of America,Columbia Pictures,False,0.665,en,1947-03-28,79,0.0,0
388,L'explosion,0,0,Documentary,France,,False,0.6,fr,2007-01-01,,0.0,0
389,Last Frontier Uprising,0,0,Western,United States of America,Republic Pictures,False,0.851,en,1947-02-01,67,0.0,0
390,Daughter of Don Q,0,0,"Adventure, Action",United States of America,Republic Pictures,False,1.4,en,1946-06-27,167,0.0,0
391,Boyfriend Killer,1000000,0,"TV Movie, Thriller, Drama",United States of America,Concord Film,False,1.769,it,2017-01-08,120,6.9,8
392,Luau MTV (Capital Inicial),0,0,,,,False,1.4,pt,,,6.0,1
393,Horse Riders,32000,0,Drama,Macedonia,Emperor Production,False,0.84,mk,2017-05-05,85,0.0,0
394,Baaki Itihaas,0,0,Drama,India,"Chhoti Production Company Pvt. Ltd., CinePlay Digital",False,0.6,hi,2017-03-28,127,6.0,1
395,Rajdarshan,0,0,Comedy,India,"Chhoti Production Company Pvt. Ltd., CinePlay Digital",False,0.804,hi,,80,0.0,0
396,Battal Gazi'nin İntikamı,0,0,Adventure,Turkey,Ugur Film,False,2.177,tr,1973-02-01,,6.0,4
397,Mazinger Z: Infinity,0,2732673,"Action, Science Fiction, Animation",Japan,Toei Animation,False,5.48,ja,2017-10-27,107,5.8,92
398,Come Spy with Me,0,0,,,,False,1.126,en,1989-01-01,,0.0,0
399,Cowboy,0,0,,,,False,0.84,en,1988-01-01,,0.0,0
400,Inside Split,0,0,,,,False,0.84,en,1986-01-01,,0.0,0
401,Negative Image,0,0,,,,False,0.6,en,1987-01-01,96,0.0,0
402,Street Games,0,0,,,,False,0.6,en,1987-01-01,96,0.0,0
403,Superconductor,0,0,,,,False,1.09,en,1988-01-01,96,0.0,0
404,The Shifting,0,0,"Action, Drama",,,False,0.6,ru,2013-06-01,,0.0,0
405,Savulun Battal Gazi Geliyor,0,0,Adventure,Turkey,Ugur Film,False,1.236,tr,1973-11-01,,5.5,4
406,Lego Batman: The Videogame,0,0,"Action, Adventure, Comedy, Crime, Family",,,False,1.083,en,2008-09-23,71,8.4,8
407,Catacombe,0,0,"Thriller, Drama","Belgium, Netherlands","New Amsterdam Film Company, Wrong Men North",False,1.143,nl,2018-09-13,,6.0,1
408,Women's Letters,0,0,"Animation, Drama",France,"Xbo films, pictor media",False,0.6,fr,2014-05-01,10,8.5,3
409,Worth It,0,0,,,,False,0.84,en,2013-12-25,4,0.0,0
410,Undertow,0,0,,,,False,0.915,en,1955-01-01,7,0.0,0
411,Freedom or Fascism,0,0,Documentary,,,False,1.166,en,2006-06-05,434,0.0,0
412,The One Romantic Venture of Edward,0,0,,,,False,0.805,en,1956-01-01,8,0.0,0
413,Strawberry Shortcake: Berry Bake Shop,0,0,,,,False,0.6,en,2016-03-01,,0.0,0
414,The 40 and 1 Nights,0,0,,,,False,0.915,en,1961-01-01,6,0.0,0
415,Two on the Tiles,0,0,,,,False,0.6,en,1951-09-01,73,5.5,2
416,Hildur and the Magician,0,0,Fantasy,United States of America,,False,0.876,en,1970-03-14,70,0.0,0
417,The Apparition,0,0,Drama,United States of America,,False,0.664,en,1976-01-01,50,0.0,0
418,Based on a Photo,0,0,"Drama, Animation",Iran,,False,0.6,xx,2015-03-08,,0.0,0
419,Ancestors,0,0,"Animation, Fantasy",United States of America,,False,1.126,en,1978-01-01,5,0.0,0
420,Strawberry Shortcake: Campberry Stories,0,0,,,,False,0.6,en,2016-06-07,,0.0,0
421,Entr'acte II,0,0,Animation,United States of America,,False,0.969,en,2015-01-01,2,0.0,0
422,Panteon Woods,0,0,Horror,United States of America,,False,0.6,en,2015-11-14,68,2.0,2
423,"""Guys Who Never Learn"" Part 2",0,0,Comedy,Japan,,False,0.6,ja,1987-11-21,104,0.0,0
424,Firstborn,0,0,Thriller,Latvia,National Film Centre of Latvia,False,1.017,lv,2017-09-22,,7.3,3
425,Football Headliners,0,0,,United States of America,RKO Radio Pictures,False,0.6,en,1955-12-09,,0.0,0
426,Prison School: Mad Wax,0,0,"Animation, Comedy",Japan,J.C.Staff,False,0.922,ja,2016-03-04,25,5.0,2
427,Grávido,0,0,,,,False,0.6,es,,,0.0,0
428,Nemuri Kyôshirô,0,0,"Action, Drama",Japan,,False,0.914,ja,1989-04-22,115,0.0,0
429,Nemuri Kyôshirô 2: Conspiracy in Edo Castle,0,0,"Drama, Action",Japan,,False,0.881,en,1993-04-17,90,0.0,0
430,Por Un Beso,0,0,,,,False,0.6,es,,,0.0,0
431,The Objects of Love,0,0,Drama,Spain,,False,2.826,es,2016-01-01,115,6.3,6
432,Nemuri Kyôshirô 3: The Man with No Tomorrow,0,0,"Action, Drama",Japan,,False,0.872,en,1996-04-20,90,0.0,0
433,Nemuri Kyôshirô 4: The Woman Who Loved Kyoshiro,0,0,"Drama, Action",Japan,,False,0.6,en,1998-04-18,90,0.0,0
434,The Gun Runner,0,0,"Crime, Action",United States of America,Jabe Films,False,0.6,en,1969-01-01,76,1.0,1
435,Lone Wolf & Child: Assassin on the Road to Hell,0,0,"Drama, Action, TV Movie",Japan,,False,1.201,ja,1989-04-22,140,0.0,0
436,Ak-47 temible cuerno de chivo,0,0,"Crime, Action, Adventure",United States of America,Condor Pictures,False,1.4,es,1997-01-01,89,0.0,0
437,The Wanderer Kenshin -The Romantic Story of a Meiji Swordsman-,0,0,,,,False,0.6,en,2016-04-28,158,0.0,0
438,Codicia mortal,0,0,"Crime, Action, Adventure",Mexico,Producciones Rigo,False,0.6,es,2000-01-01,90,0.0,0
439,Skin,0,0,,,,False,0.6,en,,2,0.0,0
440,The Neighbors,0,0,,,,False,0.6,en,,12,0.0,0
441,This Is Yates,0,0,,,,False,0.6,en,2014-06-10,12,0.0,0
442,Judas de la frontera,0,0,"Adventure, Action",Mexico,Producciones Martizan,False,0.6,es,1989-01-27,77,0.0,0
443,night light and leaping,0,0,,,,False,0.6,en,,22,0.0,0
444,murmurations,0,0,,,,False,0.876,en,,6,0.0,0
445,glow in the dark (january-june),0,0,,,,False,1.09,en,,6,0.0,0
446,come wishes be horses,0,0,,,,False,0.64,en,2016-01-01,8,0.0,0
447,Blue Mantle,0,0,,,,False,1.164,en,,34,0.0,0
448,Mark Lowry Goes to Hollywood,0,0,"Comedy, Family, Music",United States of America,"Spring House Productions, Gaither Television Productions",False,0.6,en,2005-09-13,100,0.0,0
449,The Miracle Song,0,0,"Family, Drama, Music",Mexico,Promex,False,0.841,es,1940-05-10,85,0.0,0
450,2084,0,0,"Comedy, Science Fiction",,,False,0.638,en,2017-02-02,3,4.0,1
451,Allá en el Trópico,0,0,"Music, Comedy, Drama",Mexico,,False,0.84,es,1940-06-21,110,0.0,0
452,Le Voyage de noces,0,0,,,,False,1.026,fr,1976-04-21,85,0.0,0
453,La risa en vacaciones,0,0,Comedy,Mexico,Televicine S.A. de C.V.,False,0.6,es,1988-02-01,,5.0,1
454,UFC Fight Night 108: Swanson vs. Lobov,0,0,Action,United States of America,"WME-IMG, Zuffa",False,1.149,en,2017-04-22,,0.0,0
455,El hijo de Cruz Diablo,0,0,"Drama, Adventure",Mexico,,False,0.841,es,1941-10-04,,0.0,0
456,La nueva risa en vacaciones,0,0,Comedy,Mexico,,False,0.638,es,1995-01-08,,0.0,0
457,Suicide Service,5000,0,Drama,Norway,Gloomy Elk,False,0.6,en,2017-11-25,110,0.0,0
458,Naked & Betrayed,0,0,,,,False,0.805,en,2004-04-22,82,0.0,0
459,641 Muriel Court,0,0,Documentary,,,False,0.84,en,2016-10-27,61,2.5,1
460,Deconstructing the Beatles' White Album,0,0,Documentary,,,False,0.6,en,2016-11-16,90,0.0,0
461,El monje loco,0,0,"Mystery, Horror",Mexico,,False,0.6,es,1940-12-19,,0.0,0
462,Creo en Dios,0,0,"Drama, Crime",Mexico,"Producciónes Grovas, Fernando de Fuentes",False,0.6,es,1941-04-09,105,0.0,0
463,Rodeo de media noche,0,0,"Drama, Action",Mexico,"Interbalsa S.A., Concord Plus Video",False,0.6,es,1997-01-01,85,5.0,1
464,La casa del rencor,0,0,"Mystery, Drama",Mexico,Films Mundiales,False,0.6,es,1941-11-06,89,0.0,0
465,Mi viuda alegre,0,0,Comedy,Mexico,Posa Films,False,0.6,es,1942-02-22,98,0.0,0
466,Eye of the Storm,0,0,"Adventure, Animation, Music, Science Fiction",United States of America,,False,0.6,en,2011-02-02,5,0.0,0
467,I'll Love You Forever... Tonight,0,0,Drama,United States of America,,False,0.6,en,1992-02-01,88,0.0,0
468,"1/48""",0,0,,Mexico,,False,1.4,en,,,0.0,0
469,The Case of Lena Smith,0,0,Drama,United States of America,Paramount,False,0.6,en,1929-01-29,4,5.0,1
470,The Alliance,0,0,,Argentina,,False,0.6,es,2010-12-10,17,0.0,0
471,The Anarchists vs ISIS,0,0,"Action, Drama",United States of America,"Bold Films, Nine Stories Productions",False,1.96,en,,,0.0,0
472,Burning Rainbow Farm,0,0,"Thriller, Drama",,,False,1.34,en,,,0.0,0
473,Wong Fei-Hung Burn the Tyrant's Lair,0,0,"History, Action, Drama",Hong Kong,,False,0.627,en,1949-10-12,72,0.0,0
474,Pietro,25,0,"Drama, Family",Brazil,"Departamento de Cinema e Vídeo (UFF), Universidade Federal Fluminense (UFF)",False,0.866,pt,2017-10-14,10,0.0,0
475,¡Tango!,0,0,"Drama, Music",Argentina,Argentina Sono Film S.A.C.I.,False,0.6,en,1933-04-26,79,0.0,0
476,Huang Fei-hong on Rainbow Bridge,0,0,"Drama, Action",Hong Kong,,False,0.6,en,1959-01-02,,0.0,0
477,Deconstructing The Beatles' Rubber Soul,0,0,Documentary,,,False,0.6,en,2017-04-01,90,0.0,0
478,Cochin Express,0,0,"Crime, Thriller",India,Jaya Maruthi,False,0.6,ml,1967-10-28,121,0.0,0
479,"Eu, Meu Pai e Os Cariocas",0,0,Documentary,Brazil,"Agência Nacional do Cinema (ANCINE), Globo Filmes",False,0.61,pt,2017-04-19,,0.0,0
480,How Huang Fei-hong Rescued the Orphan from the Tiger's Den,0,0,"Drama, Action",Hong Kong,,False,0.6,en,2011-04-02,,0.0,0
481,How Wong Fei-Hung Defeated the Tiger on the Opera Stage,0,0,"Drama, Action",Hong Kong,,False,1.211,en,1959-07-01,,0.0,0
482,Scary Tales: The Return of Mr. Longfellow,0,0,Horror,United States of America,Twisted Illusions,False,0.6,en,2003-03-01,88,0.0,0
483,Madam White Snake's Reincarnation,0,0,"Fantasy, Action, Adventure, Drama",Hong Kong,,False,0.6,cn,1959-05-08,,0.0,0
484,Las Cinéphilas,0,0,Documentary,"Spain, Argentina",,False,0.7,es,2017-04-20,70,6.0,3
485,Wong Fei Hung Trapped in Hell,0,0,"Drama, Action",Hong Kong,,False,0.841,cn,1959-06-07,,0.0,0
486,Yongsoon,0,0,"Drama, Comedy",South Korea,"ATO, Lotte Entertainment, Lotte Cinema Arte",False,0.984,ko,2017-06-08,104,5.7,3
487,No Solicitors,0,0,Horror,United States of America,Death By Solicitation,False,0.97,en,2015-04-11,99,0.0,0
488,Как верблюжонок и ослик в школу ходили,0,0,,,,False,0.6,ru,1975-04-22,,0.0,0
489,Как грибы с горохом воевали,0,0,,,,False,0.6,ru,1977-04-22,,8.0,1
490,Wong Fei-Hung's Battle with the Five Tigers in the Boxing Ring,0,0,"Action, Drama",Hong Kong,,False,0.841,en,1958-06-01,,0.0,0
491,The Little Match Girl,0,0,Comedy,Argentina,El Pampero Cine,False,0.6,en,2017-04-21,71,6.0,2
492,The Tip & Grinds,0,0,,,,False,0.6,en,2016-06-08,23,0.0,0
493,De reparto: retrato de un actor,0,0,Documentary,Spain,"raffel for film music, 7 jorobados, 2cs media, angular producciones s. l., pocateja",False,1.4,es,2009-07-16,,6.0,1
494,Как лиса зайца догоняла,0,0,Animation,Soviet Union,Soyuzmultfilm,False,0.6,ru,1979-04-22,,0.0,0
495,Orson Welles y Goya,0,0,Documentary,Spain,Ircania Producciones,False,0.6,es,2008-05-14,51,6.0,1
496,Как мы весну делали,0,0,,,,False,0.6,ru,1971-04-23,,0.0,0
497,Как ослик грустью заболел,0,0,,,,False,0.6,ru,1987-04-23,,0.0,0
498,Как утёнок-музыкант стал футболистом,0,0,Animation,Soviet Union,Soyuzmultfilm,False,0.6,ru,1978-04-22,,0.0,0
499,Как щенок учился плавать,0,0,,,,False,0.6,ru,1984-04-23,,0.0,0
500,Как это случилось,0,0,,,,False,0.6,ru,1973-04-23,,0.0,0
501,Камаринская,0,0,"Animation, Music",Soviet Union,Soyuzmultfilm,False,0.6,ru,1980-04-22,8,0.0,0
502,Капризная принцесса,0,0,,,,False,0.6,ru,1969-04-22,,9.0,1
503,Across Still Water,0,0,Documentary,United Kingdom,,False,0.6,en,2014-12-05,13,0.0,0
504,Pictures at an Exhibition,0,0,"Animation, Music",Soviet Union,Soyuzmultfilm,False,0.6,ru,1984-04-23,7,0.0,0
505,Королевские зайцы,0,0,,,Soyuzmultfilm,False,0.6,ru,1960-04-22,,0.0,0
506,Nami no kazu dake dakishimete,0,0,Romance,Japan,"Shogakukan Inc., Fuji Television Network",False,0.6,ja,1991-08-31,104,8.0,1
507,Королевский бутерброд,0,0,,,,False,0.6,ru,1985-04-23,,0.0,0
508,Two People,0,0,,,,False,0.6,en,,110,0.0,0
509,COMBO,0,0,Animation,Italy,studio cromie,False,0.873,xx,,,6.0,1
510,Коротышка – зелёные штанишки,0,0,Animation,Soviet Union,Soyuzmultfilm,False,0.6,ru,1987-04-23,,0.0,0
511,Кострома,0,0,,,,False,0.6,ru,1989-04-23,,0.0,0
512,The Cat Who Walked by Himself,0,0,Animation,Soviet Union,Soyuzmultfilm,False,0.621,ru,1968-04-22,20,7.0,1
513,"Кот, который умел петь",0,0,Animation,Soviet Union,Soyuzmultfilm,False,0.6,ru,1988-04-23,,0.0,0
514,"Christian Fuhlendorff - Det er ligegyldigt hva' andre tænker, ikk'?",0,0,Comedy,,,False,0.896,da,2017-04-22,,4.0,1
515,Les Chevaliers du Fiel - Mouniès président !,0,0,Comedy,France,Picture Two,False,0.84,fr,2017-04-21,,0.0,0
516,Paw Patrol: Pups and the Pirate Treasure,0,0,"Animation, Family",,,False,0.6,en,2015-09-09,89,0.0,0
517,Jack's Big Ass Show 8,0,0,,United States of America,Digital Playground,True,0.6,en,2008-06-05,127,5.0,1
518,Кружевная сказка,0,0,,,,False,0.6,ru,1992-04-23,,0.0,0
519,Roy Orbison: Black and White Night 30,0,0,Music,,,False,0.6,en,2017-01-31,,0.0,0
520,The California Golden Seals Story,0,0,Documentary,,,False,1.353,en,2016-02-06,96,0.0,0
521,"Крылатый, мохнатый, да масленый",0,0,,,,False,0.6,ru,1990-04-23,,0.0,0
522,Das Geheimnis der roten Katze,0,0,"Comedy, Crime",Germany,Deutsche Tonfilm Produktions,False,0.6,en,1931-05-20,81,0.0,0
523,A River Twice,0,0,,Australia,,False,0.6,en,2017-04-26,15,0.0,0
524,"Anthony, the Invisible One",0,0,,"Portugal, Switzerland",,False,0.84,en,2017-04-22,17,0.0,0
525,Gitano,0,0,"Music, Action",Philippines,LVN Pictures,False,0.851,tl,1949-04-23,110,0.0,0
526,Cat Fight,0,0,,,,False,0.6,en,2017-04-25,24,0.0,0
527,Крылья дядюшки марабу,0,0,,,,False,0.6,ru,1969-04-22,,0.0,0
528,Encarnación,0,0,,France,,False,0.61,en,2017-04-24,24,0.0,0
529,Familiar Tale,0,0,,Mexico,,False,0.862,en,2017-04-27,20,0.0,0
530,Girls and Honey,0,0,Documentary,"Ukraine, Belgium",,False,0.6,en,2017-04-25,8,0.0,0
531,Robo en el cine Capitol,0,0,Thriller,Spain,"cuervo films, clap producciones s.l., Cristal Producciones Cinematográficas S.A.",False,0.6,es,,,4.0,1
532,Gondwana,0,0,,Italy,,False,0.6,en,2017-04-26,29,0.0,0
533,Hypertable – Essay on Friendship,0,0,,Switzerland,,False,0.6,en,2017-04-24,20,0.0,0
534,Kappa Crucis,0,0,,Brazil,,False,0.6,en,2016-01-24,22,0.0,0
535,Jack's Teen America: Mission 22,0,0,,United States of America,Digital Playground,True,0.6,en,2008-12-16,133,7.0,1
536,La pesca,0,0,,"Colombia, Canada",,False,0.862,en,2017-04-25,22,0.0,0
537,Ma Yan Chan: Waves of Transition,0,0,,Switzerland,,False,0.6,en,2017-04-23,29,0.0,0
538,One Day in Aleppo,0,0,,Syrian Arab Republic,,False,0.89,en,2017-04-23,20,7.0,1
539,Los 5 Faust de F.W. Murnau,0,0,Documentary,Spain,"Instituto de la Cinematografía y de las Artes Audiovisuales, filmoteca española",False,0.625,es,2002-11-26,,7.0,1
540,Safe Passage,0,0,,Iran,,False,0.6,en,2017-04-27,16,0.0,0
541,Stars of Gaomeigu,0,0,Fantasy,Serbia,,False,0.6,en,2017-04-25,23,0.0,0
542,The Kodachrome Elegies,0,0,,United States of America,,False,0.899,en,2017-04-27,11,0.0,0
543,Who Is Your Grandfather?,0,0,,Germany,,False,0.61,en,2017-04-22,24,0.0,0
544,"Gonzalo Suárez: Sam Peckinpah, director salvaje (TV)",0,0,Documentary,Spain,Turner Classic Movies,False,0.696,es,2011-05-01,,6.0,1
545,A Piece of Sky,0,0,"Drama, Comedy, Romance","Armenia, Soviet Union",Armenia Studios,False,0.6,hy,1980-04-01,92,7.0,2
546,You Make a Better Window than You Do a Door,0,0,,"Lebanon, Belgium",,False,0.6,en,2017-04-23,29,0.0,0
547,Кто получит приз,0,0,,,,False,0.6,ru,1979-04-22,,0.0,0
548,Кто я такой?,0,0,,,,False,0.6,ru,1977-04-22,,0.0,0
549,Return of the Lash,0,0,Western,United States of America,Producers Releasing Corporation (PRC),False,0.6,en,1947-10-10,55,3.0,1
550,Ridin' Down the Trail,0,0,Western,United States of America,Monogram Pictures,False,0.6,en,1947-10-03,53,0.0,0
551,Juuza Engi: Engetsu Sangokuden - Gaiden Youzhou Genya,0,0,Animation,Japan,,False,1.4,ja,2014-11-28,25,0.0,0
