,title,budget,revenue,genres,production_countries,production_companies,adult,popularity,original_language,release_date,runtime,vote_average,vote_count
248,The Female Prince,0,0,"Drama, Romance, Music",Hong Kong,Shaw Brothers,False,0.6,zh,1964-12-10,102,0.0,0
249,The Imposter,0,0,Action,Hong Kong,Shaw Brothers,False,0.635,zh,1975-08-09,92,7.0,1
250,Vampire Settle On Police Camp,0,0,"Horror, Action",Hong Kong,D & B Films Co. Ltd.,False,1.4,en,1990-06-07,86,3.5,2
251,Born Wild,0,0,"Drama, Action",Hong Kong,,False,1.877,cn,2001-05-31,109,0.0,0
252,Santa Fe,0,0,Drama,,,False,0.871,en,1997-01-01,,2.0,1
253,Advertising and the End of the World,0,0,Documentary,United States of America,Media Education Foundation,False,0.841,en,1998-01-01,46,0.0,0
254,Chevelle: Any Last Words,0,0,,,,False,0.6,en,2011-01-11,,0.0,0
255,Chevelle: Live From the Norva,0,0,,,,False,0.6,en,2003-01-01,,0.0,0
256,The Ballroom,0,0,"Drama, Romance, Music",Brazil,"Gullane Filmes, Buriti Filmes",False,1.105,pt,2007-11-25,95,6.0,6
257,Crime and Punishment,0,0,"Crime, Drama",Finland,Villealfa Filmproductions,False,2.784,fi,1983-12-02,93,6.6,24
258,Digimon Frontier - Revival of the Ancient Digimon,0,0,"Action, Adventure, Animation",,,False,1.271,en,2002-07-20,40,7.3,2
259,Matariki,0,0,Drama,,,False,0.933,en,2010-11-18,89,6.0,1
260,Pomegranates and Myrrh,0,0,Drama,Palestinian Territory,,False,1.4,en,2009-02-01,95,6.0,3
261,Ritorno a casa Gori,0,0,Comedy,,Cecchi Gori Group,False,2.385,it,1996-10-18,102,6.2,8
262,Köyden İndim Şehire,0,0,"Comedy, Drama",Turkey,Arzu Film,False,4.144,tr,1974-01-01,77,7.8,20
263,Dharti,0,0,"Action, Drama",,,False,0.6,en,2011-04-22,115,5.9,4
264,Aaahh Belinda,0,0,Comedy,,,False,2.452,en,1986-04-02,100,6.8,5
265,The Village,0,0,Drama,Japan,"Shochiku Co., Ltd.",False,1.98,ja,1976-04-12,127,7.0,4
266,God Bless America,0,0,"Comedy, Drama",United States of America,"Darko Entertainment, Jerkschool Productions",False,9.457,en,2011-09-09,104,7.1,539
267,"Fordson: Faith, Fasting, Football",0,0,"Drama, History, Documentary",,,False,0.6,en,2011-09-09,,0.0,0
268,Detachment,0,72689,Drama,United States of America,"Paper Street Films, Kingsgate Films, Appian Way",False,9.025,en,2011-04-24,98,7.5,615
269,Hell and Back Again,0,0,Documentary,"United States of America, United Kingdom","Roast Beef Productions, Thought Engine Media Group",False,2.977,en,2011-10-04,88,6.5,24
270,"Ready, Set, Bag!",0,0,Documentary,,,False,0.6,en,2008-06-20,80,6.5,2
271,Planet of the Vampire Women,0,0,Science Fiction,,,False,0.741,en,2011-04-30,,5.3,4
272,"Truth in Numbers? Everything, According to Wikipedia",500000,0,Documentary,,,False,2.457,en,2010-07-01,85,6.6,9
273,Lady in the Fog,0,0,Mystery,United Kingdom,"Lippert Films, Hammer Film Productions",False,1.217,en,1952-10-13,59,6.0,3
274,Eye in the Labyrinth,0,0,"Horror, Thriller","Monaco, Italy","Transeuropa Film, TV13 Filmproduktion",False,1.57,it,1972-03-24,93,5.7,11
275,Bill Gates: How a Geek Changed the World,0,0,Documentary,,,False,0.875,en,2011-12-21,59,5.0,1
276,Ice Road Terror,0,0,Horror,,,False,2.181,en,2011-07-11,90,3.7,12
277,Scrubbers,0,0,Drama,,,False,0.696,en,1983-03-16,90,4.5,2
278,Lives of the Saints,0,0,Drama,,,False,1.46,en,2007-01-26,,5.3,3
279,Incident in a Small Town,0,0,"Drama, TV Movie",United States of America,"Procter & Gamble Productions (PGP), RHI Entertainment",False,0.6,en,1994-01-23,,6.0,1
280,Death of a Gunfighter,0,0,Western,United States of America,Universal Pictures,False,1.269,en,1969-04-04,100,6.2,9
281,L'Ennemi sans visage,0,0,"Comedy, Thriller",France,,False,0.841,fr,1946-11-20,,0.0,0
282,"Ring Of Power - The empire of ""THE CITY""",0,0,"Fantasy, Action, Documentary, Science Fiction",,,False,0.932,en,2006-09-04,300,6.8,3
283,The Quiet Family,0,0,"Horror, Comedy",South Korea,Myung Films,False,5.088,ko,1998-04-25,98,7.2,62
284,"Finally, the Sea",0,0,Drama,,,False,0.6,es,2005-01-27,,5.0,1
285,In Extremo: Raue Spree,0,0,Music,,,False,0.6,en,2006-02-09,118,5.3,2
286,Cradle Of Filth: Peace Through Superior Firepower,0,0,Music,,,False,0.6,en,2005-11-18,90,0.0,0
287,Antonio das Mortes,0,0,"Drama, Western","Brazil, France, Germany",Mapa Filmes,False,3.324,pt,1969-05-20,100,6.2,23
288,The Fairies - Fairy Dancing,0,0,"Animation, Family",,,False,0.6,en,2012-01-17,47,0.0,0
289,The Night Before the Night Before Christmas,2000000,0,"TV Movie, Family, Fantasy",Canada,,False,3.457,en,2010-09-07,91,5.5,11
290,Pátio,0,0,Drama,Brazil,,False,1.241,pt,1959-01-01,11,7.0,1
291,Sagan om Karl-Bertil Jonssons julafton,0,0,"Animation, Family, TV Movie",Sweden,,False,2.239,sv,1975-12-24,23,7.7,20
292,The Final Link,0,0,,United States of America,All Worlds Video,True,0.63,en,2000-11-29,160,8.0,1
293,Claro,0,0,"Drama, Documentary","Brazil, Italy",DPT-Spa,False,0.672,it,1975-01-01,111,7.0,1
294,"São Paulo, Sociedade Anônima",0,0,Drama,Brazil,Socine Produções Cinematográficas,False,1.78,pt,1965-01-01,111,7.8,10
295,Wonderful Adventures of Nils,0,0,"Adventure, Family","Japan, Sweden","Nordisk Tonefilm, Kenne Fant & Co",False,1.68,sv,1962-09-12,95,6.8,6
296,Di Cavalcanti,0,0,Documentary,Brazil,,False,1.994,pt,1977-03-11,18,5.3,8
297,Jorge Amado no Cinema,0,0,Documentary,Brazil,,False,0.6,pt,1979-01-01,37,0.0,0
298,Kidnap Syndicate,0,0,Crime,Italy,Cinemaster S.r.l.,False,1.116,it,1975-08-27,97,7.4,5
299,Manhunt 1,0,0,,United States of America,Hot House Entertainment,True,0.6,en,2004-10-27,105,7.5,1
300,Vengeance of the Zombies,0,0,Horror,Spain,Profilmes,False,2.886,es,1973-06-27,89,3.6,10
301,Man Island,0,0,,United States of America,"Black Scorpion Video, Black Scorpion Entertainment",True,0.623,en,2007-07-04,77,7.0,1
302,Dyngkåt och hur helig som helst,0,0,,Sweden,True Entertainment,False,1.4,sv,2011-10-19,120,10.0,2
303,San Giovanni decollato,0,0,Comedy,,,False,2.978,it,1940-12-12,,6.5,11
304,Mikadroid: Robokill Beneath Disco Club Layla,500000,0,"Horror, Science Fiction",Japan,"Toho Company, Ltd.",False,0.736,ja,1991-07-10,73,5.3,2
305,Goon,0,6483963,Comedy,"Canada, United States of America","Inferno Pictures, Don Carmody Productions, Caramel Films, No Trace Camping",False,10.926,en,2012-01-06,92,6.5,500
306,The Ukulele Orchestra of Great Britain - Anarchy in The Ukulele,0,0,Music,United Kingdom,,False,0.872,en,2005-01-01,67,8.5,1
307,Pier 23,0,0,"Crime, Mystery",United States of America,,False,0.695,en,1950-05-11,58,4.5,2
308,The Case Of The Baby-Sitter,0,0,Mystery,United States of America,,False,1.4,en,1947-07-26,41,4.0,1
309,Times Square Playboy,0,0,Comedy,United States of America,Warner Bros. Pictures,False,0.704,en,1936-05-09,62,5.0,1
310,Mollo tutto,0,0,Comedy,Italy,,False,1.262,it,1995-03-31,,5.9,10
311,Poongsan,0,0,"Action, Drama, Romance",South Korea,Next Entertainment World,False,2.817,ko,2011-06-23,121,6.5,13
312,Moby Dick,0,0,"Horror, Action, Thriller",South Korea,"Palette Pictures, Showbox",False,3.53,ko,2011-06-09,112,6.9,12
313,S.I.S.,0,0,"Action, Thriller",,,False,2.113,en,2008-08-24,79,4.6,8
314,Plötzlich fett,0,0,Comedy,"Germany, Austria","Dor Film Production Company, Ninety-Minute Film, Sat.1, Österreichischer Rundfunk",False,1.254,de,2011-08-26,89,5.8,8
315,The Concert for New York City,0,0,"Music, History, Documentary",United States of America,40 Acres & A Mule Filmworks,False,2.181,en,2001-10-20,296,5.0,2
316,Story of Jen,0,0,"Drama, Mystery","France, Canada","Cinéma Defacto, 1976 Productions",False,1.093,fr,2008-08-14,107,0.0,0
317,How I Unleashed World War II Part I: The Escape,0,0,"Comedy, War, Adventure",Poland,,False,3.113,pl,1970-04-02,86,7.7,17
318,Three Violent People,0,0,"Drama, Western",United States of America,Paramount,False,2.238,fr,1956-12-01,100,6.5,12
319,Ninjas vs. Vampires,15000,0,"Horror, Action, Comedy, Thriller",United States of America,,False,1.912,en,2010-10-29,89,3.8,6
320,How I Unleashed World War II Part III: Among Friends,0,0,"Action, History, Comedy",Poland,,False,2.19,pl,1970-04-06,73,7.4,11
321,Textiles,0,0,"Comedy, Drama",France,Les Films en Hiver,False,1.31,fr,2004-06-09,92,6.0,11
322,Féroce,0,0,Drama,France,,False,1.598,fr,2002-04-17,,5.8,4
323,Gag,0,0,Horror,United States of America,Detroit Riot Productions,False,2.187,en,2006-01-11,78,2.8,11
324,The Playaz Court,0,0,"Drama, Action",,,False,0.655,en,2000-01-01,97,0.0,0
325,The Beatles Unauthorized,0,0,"Music, Documentary, History",,,False,0.633,en,1965-01-01,51,0.0,0
326,Winnie Mandela,15000000,0,Drama,,,False,1.386,en,2011-09-16,107,5.7,6
327,Pocoyo: Fun & Dance with Pocoyo,0,0,"Animation, Family",United States of America,,False,1.4,en,2008-05-20,49,0.0,0
328,Sunrise Earth: Great Barrier Reef,0,0,Documentary,,Discovery Channel,False,0.653,en,2008-08-24,50,5.3,2
329,Holla,200,0,"Horror, Comedy",United States of America,"Rockstone Pictures, My Own Worst Enemy",False,1.638,en,2006-12-01,86,3.0,1
330,Alex Reymundo: One Funny Hick-Spanic,0,0,Comedy,United States of America,"Fishman Productions, United Cinema Group, Payaso Entertainment",False,1.4,en,2007-03-03,75,0.0,0
331,Chaos and Desire,7000000,0,"Drama, Mystery, Romance","Canada, France","Max Films Productions, EuropaCorp",False,1.678,fr,2002-08-22,115,6.3,11
332,Harland Williams: What a Treat,0,0,Comedy,United States of America,,False,1.4,en,2006-08-15,65,0.0,0
333,Convicts 4,0,0,Drama,United States of America,Allied Artists Pictures,False,1.809,en,1962-09-15,105,6.7,3
334,Found,0,0,"Thriller, Mystery, TV Movie",United States of America,,False,0.968,fr,2005-05-07,87,4.5,1
335,Pack Attack 1: Kent North,0,0,,United States of America,Hot House Entertainment,True,0.6,en,2006-02-08,100,9.0,1
336,The Drifters,0,0,Drama,Germany,Turanskyj & Ahlrichs,False,0.827,de,2011-01-06,97,5.0,1
337,20th Century Fox: The First 50 Years,0,0,Documentary,United States of America,,False,0.6,en,1997-01-21,150,8.5,2
338,My Brother's Keeper,0,0,"Drama, Thriller, Crime",United Kingdom,Gainsborough Pictures,False,1.4,en,1948-08-19,86,6.0,4
339,Celtic Thunder: Storm,0,0,Music,,,False,0.6,en,2011-09-20,60,0.0,0
340,Rainbow Bridge,0,0,"Music, Documentary",United States of America,,False,1.4,en,1972-03-01,108,5.5,3
341,Muni 2: Kanchana,0,0,"Horror, Comedy",India,,False,3.148,ta,2011-07-22,,6.0,6
342,Nitschewo,0,0,Drama,Germany,,False,0.916,de,2004-11-18,86,0.0,0
343,The President,0,0,"Drama, Mystery, Thriller","Italy, France","Cité Films, Fidès, G.E.S.I. Cinematografica, Terra Film Produktion",False,3.116,fr,1961-01-03,,7.0,20
344,Unfinished Business,0,0,Comedy,United States of America,,True,0.6,en,2011-07-06,91,0.0,0
345,Big Wet Asses 17,0,0,,United States of America,Elegant Angel,True,0.631,en,2010-06-30,174,0.0,0
346,Big Wet Asses 18,0,0,,United States of America,,True,1.113,en,2010-12-09,163,0.0,0
347,Big Wet Asses 19,0,0,,United States of America,,True,1.095,en,2011-07-06,159,0.0,0
348,Big Wet Black Tits 3,0,0,,United States of America,Elegant Angel,True,0.6,en,2011-06-30,174,0.0,0
349,Touchback,0,0,"Drama, Family, Fantasy",United States of America,Freedom Films,False,5.048,en,2011-04-13,118,5.7,34
350,Stilles Tal,0,0,Drama,Germany,,False,2.071,de,2011-09-07,,5.5,3
351,The Unholy Four,0,0,Western,Italy,"B.R.C. Produzione S.r.l., Produzioni Atlas Consorziate (P.A.C.)",False,2.151,it,1970-03-11,95,6.8,6
352,Fabrice Eboué - Faites entrer Fabrice Eboué,10,10000,Comedy,France,TF1 Droits Audiovisuels,False,2.086,fr,2010-10-17,,5.7,9
353,Bellator 51,0,0,,,,False,0.6,en,2011-09-24,,0.0,0
354,Dream 17,0,0,,,,False,1.345,en,2011-09-24,,0.0,0
355,Beware the Gonzo,0,0,Comedy,United States of America,Corner Store Entertainment,False,1.501,en,2010-04-22,94,5.9,16
356,Louis Armstrong: Satchmo,0,0,,,,False,1.433,en,1992-01-01,86,0.0,0
357,The Beach Boys: Endless Harmony,0,0,Documentary,United States of America,,False,2.323,en,2000-03-14,141,6.3,3
358,Brush with Fate,0,0,"Drama, Thriller",United States of America,Hallmark Hall of Fame Productions,False,1.943,en,2003-01-01,98,6.0,5
359,Pecos Pest,0,0,Animation,United States of America,,False,2.748,en,1955-11-11,6,6.7,8
360,Lotte Reiniger - The Fairy Tale Films,0,0,,,,False,1.373,en,2008-11-17,192,9.0,1
361,Oskar Fischinger Ten Films,0,0,,,,False,0.6,en,1947-08-22,48,0.0,0
362,Attack on the Pin-Up Boys,0,0,Comedy,South Korea,"Pollux Barunson, Chungeorahm Film",False,2.849,ko,2007-07-26,81,5.3,15
363,Red Victoria,5000,0,"Comedy, Horror",,,False,1.906,en,2008-03-01,88,4.5,4
364,Perfect Fit,0,0,,United States of America,Hot House Entertainment,True,0.6,en,2003-11-17,107,7.0,1
365,Sinterklaas en het geheim van het Grote Boek,0,0,,Netherlands,SRSP Films,False,0.911,nl,2008-10-09,90,7.5,2
366,Birds of Prey,0,0,"Action, Thriller, TV Movie",United States of America,Tomorrow Entertainment,False,1.052,en,1973-01-30,81,5.4,5
367,The Ball of Letters,0,0,Comedy,Colombia,Universal Music Colombia,False,1.082,es,2005-12-15,,8.0,4
368,Absolutely Fabulous,0,0,Comedy,France,"Josy Films, StudioCanal, TF1 Films Production, Bac Films",False,2.722,fr,2001-08-28,105,5.3,27
369,Slot Marsepeinstein - Het Mysterie Van De Pakjesmachine Deel 1,0,0,,,,False,0.6,nl,2010-11-01,,0.0,0
370,Blind Date,0,0,Comedy,United States of America,Wicked Pictures,True,0.6,en,2011-01-19,96,0.0,0
371,Pet Peeve,0,0,"Comedy, Animation",United States of America,Metro-Goldwyn-Mayer,False,3.091,en,1954-11-20,6,6.1,8
372,It's Great to be Young!,0,0,"Music, Comedy",United Kingdom,Marble Arch Productions,False,1.4,en,1956-12-26,90,5.5,2
373,Joe Pasquale: The Everything I Have Ever Done & The First of Many Goodbye Tours,0,0,,United Kingdom,"Classic Pictures, International Artists",False,1.416,en,2004-11-01,86,0.0,0
374,Catlow,0,0,"Western, Comedy","United Kingdom, United States of America",Metro-Goldwyn-Mayer,False,2.881,en,1971-10-01,101,4.4,7
375,Standing Sideways,0,0,"Comedy, Romance",,,False,0.6,en,2011-01-01,,0.0,0
376,Ollie Hopnoodle's Haven of Bliss,0,0,,,,False,0.873,en,1988-08-05,89,10.0,1
377,Sharpe's Enemy,0,0,"History, Action, Adventure, War, TV Movie",United Kingdom,"Celtic Films Entertainment, ITV Central, Picture Palace",False,2.491,en,1994-06-01,90,7.2,16
378,Sharpe's Honour,0,0,"History, Action, Adventure, TV Movie, War",United Kingdom,"Celtic Films Entertainment, ITV Central, Picture Palace",False,2.902,en,1994-06-08,101,6.8,16
379,Sharpe's Siege,0,0,"Action, Adventure, TV Movie, History, War",United Kingdom,"Carlton UK Productions, Celtic Films Entertainment, Picture Palace",False,3.115,en,1996-05-08,101,7.3,15
380,Sharpe's Mission,0,0,"Action, Adventure, History, War, TV Movie",United Kingdom,"Celtic Films Entertainment, Picture Palace",False,2.763,en,1996-05-15,100,7.0,14
381,Citizen Cohn,0,0,Drama,United States of America,HBO Films,False,0.834,en,1992-08-22,107,6.8,5
382,Sharpe's Justice,0,0,"Action, Adventure, History, War, TV Movie",United Kingdom,"Celtic Films Entertainment, Picture Palace",False,2.702,en,1997-05-14,100,7.0,11
383,Sharpe's Waterloo,0,0,"Action, Adventure, War, TV Movie, History",United Kingdom,"Celtic Films Entertainment, Carlton Television, Picture Palace",False,2.728,en,1997-05-27,101,7.3,12
384,Care Bears: Share Bear Shines,0,0,"Family, Animation",United States of America,,False,1.4,en,2011-09-06,70,4.0,2
385,Big Bad Love,0,100420,"Drama, Comedy",United States of America,,False,2.189,en,2001-10-11,111,6.5,4
386,A Separate Peace,0,0,Drama,United States of America,Paramount,False,0.84,en,1972-09-27,104,6.0,1
387,The Legacy of Sherwood,0,0,"Family, Comedy",United States of America,,False,0.917,en,2009-06-05,60,0.0,0
388,The Gentle Sex,0,0,"Comedy, Drama, War",United Kingdom,"Derrick De Marney Productions, Two Cities Films, Concanen Productions",False,1.842,en,1943-05-23,92,6.5,7
389,WWE Divas: Desert Heat,0,0,"Documentary, Action",United States of America,"WWE Home Video, World Wrestling Entertainment (WWE)",False,0.885,en,2003-06-06,120,0.0,0
390,Mausam,0,0,"Drama, Romance",,"Cinergy Pictures, Vistaar Religare Film Fund",False,3.355,hi,2011-09-23,161,5.9,18
391,WWE Divas: Do New York,0,0,"Action, Drama",United States of America,"WWE Home Video, World Wrestling Entertainment (WWE)",False,0.827,en,2006-02-21,160,0.0,0
392,WWE Divas: South Of The Border,0,0,Documentary,United States of America,"WWE Home Video, World Wrestling Entertainment (WWE)",False,1.212,en,2004-06-01,180,0.0,0
393,Third Star,0,0,Drama,United Kingdom,,False,5.353,en,2010-06-01,92,7.4,73
394,First Love,0,0,Documentary,Australia,,False,1.4,en,2010-04-04,58,8.5,2
395,The Grey,25000000,77278331,"Drama, Thriller, Action, Adventure",United States of America,"Open Road Films, Scott Free Productions, 1984 Private Defense Contractors, LD Entertainment, Inferno Distribution, Chambara Pictures",False,12.411,en,2012-01-26,117,6.5,2311
396,Turn A Gundam I: Earth Light,0,0,"Animation, Science Fiction",Japan,SUNRISE,False,2.411,en,2002-02-09,120,5.6,4
397,Turn A Gundam II: Moonlight Butterfly,0,0,"Animation, Science Fiction",Japan,SUNRISE,False,2.178,ja,2002-02-10,128,4.8,3
398,The Mountain,0,0,"Action, History, Documentary",,,False,0.6,en,,,0.5,1
399,Escort,800000,0,Thriller,Netherlands,IDTV Film,False,1.862,nl,2006-05-27,,6.0,5
400,Crazy n' the City,0,0,"Drama, Comedy",Hong Kong,Universe Films Distribution,False,1.325,zh,2005-01-14,93,6.8,2
401,"How Much Does Your Building Weigh, Mr Foster?",0,0,Documentary,"United Kingdom, Spain, Germany, United States of America, Switzerland, Hong Kong, France, China",,False,1.019,en,2010-10-08,78,8.3,4
402,Men's Private Parts,0,0,,,,False,0.6,zh,,126,0.0,0
403,The Birth Of The Beatles,0,0,"Drama, Music",United States of America,Dick Clark Productions,False,1.757,en,1979-11-23,104,6.6,5
404,Waiting Alone,0,0,"Comedy, Drama, Romance",China,,False,2.999,zh,2005-08-10,107,6.8,5
405,Niels Hausgaard: Hvad Munden Er Fuld Af,0,0,"Comedy, Music",Denmark,,False,0.6,da,2009-10-30,58,8.5,1
406,Gustne Gensyn,0,0,,,,False,0.6,da,,,0.0,0
407,The Mad Monk,0,0,"Action, Comedy",Hong Kong,"Cosmopolitan Film Productions Co., Ltd.",False,3.355,cn,1993-07-29,89,5.6,13
408,Welcome Aboard,12000000,0,Comedy,France,"Same Player, Pathé!, Appaloosa Films, M6 Films",False,6.318,fr,2011-10-05,95,5.4,284
409,Bound,0,0,Drama,United States of America,Wicked Pictures,True,0.623,en,2008-07-02,104,2.0,1
410,Åsa-Nisse i agentform,0,0,,,,False,0.921,sv,1967-08-25,,1.5,2
411,Hysteria,0,9504139,"Comedy, Romance","United Kingdom, Luxembourg, France, Germany, Switzerland","Forthcoming Productions, Beachfront Films, Chimera Films LLC, Informant Media, ARTE France Cinéma",False,8.501,en,2011-06-06,100,6.6,465
412,Catching Hell,0,0,Documentary,,,False,2.352,en,2011-09-27,105,6.7,14
413,The Toll of the Sea,0,0,"Family, Drama, Fantasy",United States of America,"Technicolor Motion Picture Corporation, Metro Pictures Corporation",False,3.923,en,1922-11-26,54,6.4,8
414,Red Bike Story,0,0,"Comedy, Romance",Thailand,Grammy Film Co. Ltd.,False,1.428,th,1997-03-04,111,0.0,0
415,Target,0,0,"Action, Thriller",United States of America,Westwind Group Inc.,False,2.858,en,2004-11-17,84,2.8,5
416,It's love,0,0,,,,False,0.6,zh,,,0.0,0
417,The Black Marble,0,0,"Comedy, Crime, Romance",,,False,1.05,en,1980-03-07,110,5.3,3
418,Crazy Wisdom Saves the World Again,0,0,,,,False,0.6,en,,75,0.0,0
419,The Perfect Roommate,0,0,"TV Movie, Crime, Mystery, Thriller",Canada,"Thrill Films, Capital Productions",False,3.48,en,2011-07-21,100,4.1,9
420,Most High,0,0,Drama,United States of America,,False,1.162,en,2006-11-28,95,5.0,2
421,Mural,0,0,Fantasy,China,,False,1.587,zh,2011-09-29,100,5.8,8
422,The Legacy,0,0,Drama,Canada,ACPAV,False,0.737,en,2009-11-06,94,6.5,2
423,Hercules and the Circle of Fire,0,0,"Action, Adventure, Fantasy, TV Movie","New Zealand, United States of America",Renaissance Pictures,False,3.322,en,1994-11-05,90,5.6,30
424,Zero,0,0,"Animation, Drama",Australia,"Zealous Creative, Screen NSW",False,3.126,en,2010-08-01,12,7.4,36
425,Hercules and the Lost Kingdom,0,0,"Action, Adventure, Fantasy, TV Movie","New Zealand, United States of America","Renaissance Pictures, Pacific Renaissance Pictures Ltd., Universal Television",False,4.463,en,1994-05-02,90,5.4,34
426,Entanglement,0,0,"Crime, Thriller",Poland,Studio Filmowe Zebra,False,2.399,pl,2011-06-03,123,5.8,8
427,Erratum,0,0,,,,False,1.334,en,2010-09-16,95,6.6,7
428,My Kung Fu 12 Kicks,0,0,Action,Hong Kong,Shin Shin Film Enterprise (H.K.) Corporation,False,2.127,cn,1979-05-05,87,5.0,4
429,Dance Marathon,0,0,"Comedy, Romance",Poland,"ATM Grupa S.A., Grupa Filmowa, Mediabrigade",False,1.1,pl,2011-06-17,97,0.0,0
430,The Speed Merchants,0,0,Documentary,,,False,0.908,en,1972-01-01,95,4.8,2
431,The New Shaolin Boxers,0,0,Action,"Hong Kong, Taiwan",Shaw Brothers,False,3.323,zh,1976-09-03,96,7.3,4
432,Lion vs. Lion,0,0,"Action, Comedy",Hong Kong,Shaw Brothers,False,1.512,cn,1981-02-19,108,4.1,4
433,Hercules in the Underworld,0,0,"Action, Adventure, Fantasy, TV Movie","New Zealand, United States of America",Renaissance Pictures,False,4.915,en,1994-11-07,91,5.2,46
434,Vampire Super,0,0,"Fantasy, Action, Horror",,,False,1.4,en,2007-01-01,91,0.0,0
435,Double Jeopardy,0,0,Thriller,United States of America,"Boxleitner/Bernstein Productions, CBS Productions",False,1.429,en,1992-11-21,,4.5,5
436,The Leg Fighters,0,0,"Action, Drama, Comedy",Taiwan,"Magnificent Tower Film Company, Wa Nam Films Company",False,1.383,cn,1980-01-01,90,0.0,0
437,The Nine Demons,0,0,Action,,,False,0.6,en,1984-01-01,95,0.0,0
438,Doctor Kong: Cutting Up the Competition,0,0,Documentary,,,False,1.4,en,2011-02-22,18,4.3,2
439,Escramble,0,0,,,,False,0.6,en,2006-01-01,40,0.0,0
440,The Happy Hooker,0,0,"Drama, Comedy, Romance",,Cannon Group,False,0.745,en,1975-01-01,98,5.3,3
441,Deray Davis:  Power Play,0,0,Comedy,United States of America,Codeblack Entertainment,False,1.4,en,2011-07-01,70,10.0,1
442,Disney Sing-Along-Songs: Honor To Us All,0,0,,,,False,0.6,en,1998-08-25,36,10.0,1
443,Disney Sing-Along-Songs: Let's Go to the Circus!,0,0,,,,False,0.6,en,1994-04-19,37,9.0,2
444,First Kiss,0,0,,,,False,1.53,en,2008-01-01,60,0.0,0
445,Everywhere And Nowhere,0,0,Drama,United Kingdom,"Arena Productions, Foton Films",False,0.989,en,2011-05-06,92,4.3,3
446,Baby Genius: Favorite Sing-A-Longs,0,0,Animation,,,False,0.6,en,2006-11-14,30,0.0,0
447,Baby Genius: Favorite Nursery Rhymes,0,0,"Animation, Family",,,False,0.6,en,2004-09-28,62,0.0,0
448,Baby Genius: Favorite Counting Songs,0,0,Animation,,,False,0.6,en,2006-11-14,30,0.0,0
449,Baby Genius: Baby Animals Favorite Sing-A-Longs,0,0,Animation,,,False,0.6,en,2008-02-05,30,0.0,0
450,Baby Genius: Favorite Children's Songs,0,0,"Animation, Family",,,False,0.6,en,2004-09-28,60,0.0,0
451,The Wall,0,0,"Drama, Action, Thriller",Hong Kong,,False,1.4,en,2002-08-15,91,0.0,0
452,Soul Kicking,0,0,Drama,Greece,,False,0.917,el,2006-11-13,117,7.0,2
453,Lucy Porter: The Good Life,0,0,Comedy,United Kingdom,Go Faster Stripe,False,0.6,en,2008-06-01,70,0.0,0
454,Elie Semoun - Merki,0,0,Comedy,France,,False,1.2,fr,2009-10-27,,6.0,2
455,Elie Semoun - Se prend pour qui ?,0,0,Comedy,France,,False,1.4,fr,2006-01-31,,5.3,3
456,Elie Semoun - Elie et Semoun au Palais des Glaces,0,0,"Family, Comedy",,,False,0.871,fr,1999-11-08,,10.0,1
457,Arthur en vrai !,0,0,,France,Sony BMG Music Entertainment,False,0.6,fr,2007-10-21,,0.0,0
458,Patton Oswalt: Finest Hour,0,0,Comedy,United States of America,"Dagonet, Degenerate Comedy",False,2.444,en,2011-09-05,59,7.6,7
459,América,0,0,"Drama, Comedy","Brazil, Portugal, Russia, Spain","2Plan2, Agência Nacional do Cinema (ANCINE), Nineteen Sound and Imaging Productions",False,0.916,pt,2011-05-26,111,6.0,1
460,Deep Anal Drilling 3,0,0,,United States of America,"Dynamite, Wicked Pictures",True,0.6,en,2015-09-03,145,0.0,0
461,The Holy Innocents,0,3149062,Drama,Spain,"Ganesh Pictures, Televisión Española",False,2.818,es,1984-04-04,107,8.2,41
462,Sacrificio: Who Betrayed Che Guevara,0,0,Documentary,,,False,1.21,en,2001-01-17,60,6.5,2
463,Mia fora kai ena moro,0,0,Comedy,Greece,,False,2.189,el,2011-03-17,86,6.1,6
464,Belle of the Nineties,0,0,"Drama, Comedy",United States of America,Paramount,False,1.393,en,1934-09-21,70,6.8,3
465,Padre Fábio de Melo - Iluminar,0,0,,,,False,0.6,pt,,,0.0,0
466,The Last Married Couple in America,0,0,Comedy,United States of America,Universal Pictures,False,1.623,en,1980-04-03,103,3.5,4
467,Blood and Sand,0,0,"Drama, Romance","Spain, United States of America",20th Century Fox,False,2.405,de,1989-09-22,113,4.1,7
468,Who?,0,0,Animation,Sweden,FilmTecknarna Fiction AB,False,0.885,sv,2010-09-24,32,0.0,0
469,Мартовские иды,0,0,,,,False,0.6,en,,101,0.0,0
470,Rascals,0,0,Comedy,India,,False,1.957,hi,2011-10-06,128,3.9,10
471,Sams in Gefahr,0,0,Family,Germany,Collina Film,False,2.059,de,2003-12-10,90,5.3,9
472,Ballistic,0,0,Action,United States of America,,False,1.024,en,1995-02-28,97,3.6,4
473,My Week with Marilyn,6400000,35057696,Drama,United Kingdom,"The Weinstein Company, BBC Films, Trademark Films, UK Film Council, Lipsync Productions",False,9.549,en,2011-11-23,99,6.7,749
474,The Conquest of Everest,0,0,"Documentary, Drama, History",United Kingdom,"Group 3, Countryman Films",False,0.6,en,1953-12-09,78,7.0,5
475,Lacie: Sexual Freak 9,0,0,,United States of America,Digital Playground,True,0.6,en,2008-11-04,96,9.0,1
476,The Uncanny,0,0,Horror,"Canada, United Kingdom","Cinévidéo, The Rank Organisation",False,2.722,en,1977-08-24,89,5.5,12
477,9 Months of Snow,0,0,,,,False,0.6,en,2009-10-15,25,0.0,0
478,Åsa-Nisse i Popform,0,0,Comedy,Sweden,AB Svensk Talfilm,False,1.45,sv,1964-08-28,,2.0,3
479,The Flintstones: On the Rocks,0,0,"Animation, Comedy, Family","Canada, United States of America","Cartoon Network Studios, Hanna-Barbera Productions",False,1.384,en,2001-11-03,85,7.0,2
480,Åsa-Nisse in Rocket Form,0,0,Comedy,Sweden,AB Filmcenter,False,1.057,sv,1966-08-26,76,2.3,3
481,Åsa-Nisse i Rekordform,0,0,Comedy,Sweden,AB Filmcenter,False,1.629,sv,1969-12-19,76,1.8,3
482,Playing for Change – Songs Around The World (Part 2),0,0,Music,,,False,0.6,en,2011-05-31,45,5.3,2
483,Åsa-Nisse ordnar allt,0,0,Comedy,Sweden,AB Svensk Talfilm,False,1.018,sv,1955-09-19,83,3.3,3
