,title,budget,revenue,genres,production_countries,production_companies,adult,popularity,original_language,release_date,runtime,vote_average,vote_count
672,The Assassination of Trotsky,2500000,0,"Drama, History, Thriller","France, United Kingdom, Italy",,False,2.728,en,1972-04-20,103,5.4,11
673,Daisy Miller,2000000,0,"Drama, Romance",United States of America,"Copa del Oro, The Directors Company",False,1.96,en,1974-05-22,91,5.7,7
674,At Long Last Love,6000000,1500000,"Comedy, Music, Romance",United States of America,"Copa del Oro, 20th Century Fox",False,2.67,en,1975-03-01,118,5.9,9
675,The Sensuous Nurse,0,0,Comedy,Italy,"New Gold Entertainment, Compagnia Cinematografica Champion",False,2.587,it,1975-12-19,90,5.8,9
676,The Lady Vanishes,0,0,"Mystery, Thriller",United Kingdom,Hammer Film Productions,False,2.904,en,1979-04-30,97,6.4,16
677,"Hurrah, the School Is Burning",0,0,Comedy,Germany,"Franz Seitz Filmproduktion, Terra-Filmkunst",False,1.538,de,1969-12-17,98,5.8,8
678,Is Paris Burning?,0,0,"War, Drama, History","France, United States of America","Paramount, Marianne Productions, Transcontinental Films",False,7.074,fr,1966-10-26,175,7.2,69
679,Holiday for Henrietta,0,0,Comedy,France,Regina Films,False,1.73,fr,1952-12-17,118,7.0,2
680,Masculin Féminin,0,0,"Drama, Romance","Sweden, France","Svensk Filmindustri, Sandrews, Anouchka Films, Argos Films",False,7.155,fr,1966-03-22,110,7.4,131
681,Arsène Lupin contre Arsène Lupin,0,0,Comedy,,,False,1.491,fr,1962-09-01,90,6.0,1
682,Body Snatchers,13000000,428868,"Horror, Science Fiction, Thriller",United States of America,"Dorset Productions, Robert H. Solo Productions, Warner Bros. Pictures",False,6.259,en,1993-06-09,87,5.9,152
683,Southland Tales,17000000,374743,"Comedy, Science Fiction, Thriller","France, Germany, United States of America","Wild Bunch, Universal Pictures, Cherry Road Films, Darko Entertainment, MHF Zweite Academy Film, Eden Roc Productions, Persistent Entertainment, Academy Film, Destination Films, Inferno Distribution",False,12.251,en,2006-05-15,144,5.1,262
684,The Gendarme of St. Tropez,0,0,Comedy,France,"Société Nouvelle de Cinématographie (SNC), Franca Films",False,10.362,fr,1964-09-08,89,7.1,381
685,The Gendarme in New York,0,0,Comedy,France,,False,7.932,fr,1965-10-28,95,6.4,212
686,The Gendarme Gets Married,0,0,Comedy,France,"Société Nouvelle de Cinématographie, Medusa Produzione",False,6.031,fr,1968-10-30,90,6.5,242
687,OSS 117 prend des vacances,0,0,Action,"Brazil, France, Italy","Companhia Cinematográfica Vera Cruz, Films Number One, Inducine",False,0.695,fr,1970-02-04,90,5.0,2
688,Sandokan the Great,0,0,Adventure,"Spain, France, Italy","Ocean Films, Filmes S.A., Comptoir Français du Film Production (CFFP)",False,1.156,it,1963-10-09,90,5.8,5
689,Captain Fracasse,0,0,Adventure,"France, Italy, Spain","Documento Films, Films Metzger et Woog, Hoche Productions, Paris Elysées Films",False,3.2,fr,1961-04-21,108,5.2,10
690,The Gardener of Argenteuil,0,0,"Crime, Comedy",France,"Films Vertried, Les Films Copernic",False,1.936,fr,1966-10-07,86,5.8,5
691,Van Gogh,0,138000,Drama,France,Cofimage 2,False,3.549,fr,1991-10-30,158,6.6,42
692,The Good and the Bad,0,0,Drama,France,Les Films 13,False,3.554,fr,1976-01-21,120,6.7,12
693,L'idiot,0,0,Drama,France,Films Sacha Gordine,False,2.448,en,1946-06-07,101,6.8,5
694,You're Not Alone,0,0,"Comedy, Drama",Germany,,False,0.6,de,2007-05-01,90,5.0,2
695,Raphael or the Debauched One,0,0,Drama,France,,False,2.454,fr,1971-04-02,100,6.3,9
696,Appointment in Bray,0,0,"Drama, Music, War","Belgium, France, Germany","Taurus Film, Ciné Mag Bodard, Parc Film, Office de Radiodiffusion Télévision Française (ORTF), Studios Arthur Mathonet, Ciné Vog Films",False,3.284,fr,1971-12-22,90,4.5,8
697,Nathalie Granger,0,0,Drama,France,Mouflet et Cie,False,2.014,fr,1972-10-06,83,5.8,8
698,Ça va pas être triste,0,0,Comedy,France,Le Goff Productions,False,0.661,en,1983-02-09,90,5.0,1
699,The Lost Honor of Katharina Blum,1000000,0,"Comedy, Drama",Germany,"Westdeutscher Rundfunk, Bioskop-Film GmbH, Paramount-Orion Filmproduktion",False,4.152,de,1975-01-10,104,7.2,38
700,L'horoscope,0,0,Comedy,France,Sphinx Films,False,0.6,en,1978-06-21,90,0.0,0
701,The Red Ibis,0,0,Comedy,France,"Les Films de l'Epée, M. Films",False,0.929,fr,1975-05-21,90,6.0,1
702,The House,0,0,Comedy,France,,False,1.09,fr,1970-01-01,90,0.0,0
703,"""Here We Come""",0,0,Documentary,Germany,Filmakademie Baden-Württemberg,False,0.6,en,2006-01-01,87,0.0,0
704,Gone Baby Gone,19000000,34619699,"Crime, Drama, Mystery",United States of America,"Miramax, The Ladd Company",False,13.397,en,2007-09-18,113,7.3,1966
705,Cul-de-sac,0,0,"Thriller, Comedy, Drama",United Kingdom,Tekli British Productions,False,7.611,en,1966-02-01,112,6.8,97
706,Obsession,0,0,"Drama, Thriller, Mystery",United States of America,"Yellowbird Productions, Columbia Pictures",False,6.349,en,1976-08-01,99,6.6,85
707,The War Is Over,0,0,"Drama, Thriller","Sweden, France","Sofracima, Europa Film",False,2.567,fr,1966-05-11,117,6.4,16
708,Heart of Darkness,0,0,Drama,United States of America,"Chris/Rose Productions, Turner Pictures",False,2.06,en,1994-03-13,100,5.9,17
709,When the City Awakes,0,0,Crime,France,Les Productions Belles Rives,False,1.4,fr,1975-06-05,90,4.0,1
710,Rudo & Cursi,0,0,"Comedy, Drama","Mexico, United States of America",Canana Films,False,3.707,es,2008-12-19,102,6.3,59
711,Cassandra's Dream,0,0,"Crime, Drama, Thriller, Comedy, Mystery","United Kingdom, United States of America","Iberville Productions, Virtual Studios, Wild Bunch",False,8.517,en,2007-06-18,108,6.2,404
712,Revolver,0,0,"Action, Crime, Thriller","Italy, France, Germany","Société Nouvelle de Cinématographie, Mega Film, Dieter Geissler Filmproduktion",False,2.985,it,1973-09-27,110,7.0,12
713,The Garden of the Finzi-Continis,0,0,Drama,Italy,"CCC-Filmkunst, Documento Film",False,5.775,it,1970-12-04,95,7.0,89
714,The Nada Gang,0,0,Thriller,"France, Italy","Verona Produzione, Italian International Film, Les Films de la Boétie",False,2.312,fr,1974-03-21,132,6.2,6
715,Blood Brothers,0,0,"Crime, Drama",Italy,Gianni Hecht Lucari,False,2.221,it,1974-02-23,130,7.0,5
716,Killer,0,0,"Thriller, Crime","Germany, France",Europa Films,False,1.851,fr,1972-03-01,87,5.3,6
717,"Je T'Aime, Je T'Aime",0,0,"Drama, Science Fiction",France,"Parc Film, Les Productions Fox Europa",False,3.281,fr,1968-04-24,94,6.6,26
718,Un grand patron,0,0,Drama,France,Éclair-Journal,False,0.84,en,1951-11-28,95,5.0,1
719,Charles et Lucie,0,0,Comedy,France,"Cythère Films, Tele Europa",False,0.664,fr,1979-09-05,90,0.0,0
720,Omagh,0,0,Drama,"Ireland, United Kingdom","Portman Film, Tiger Aspect Productions, Hell's Kitchen International, Channel 4 Television, Bord Scannán na hÉireann, RTÉ",False,2.061,en,2004-05-22,102,6.9,7
721,Monster Hunter,10000000,0,Horror,Italy,"Metaxa Corporation, Filmirage, Cinema 80",False,4.028,it,1981-10-11,96,5.4,33
722,Erotic Nights of the Living Dead,0,0,Horror,Italy,Stefano Film,True,1.693,it,1980-11-06,111,3.0,12
723,Antropophagus,0,0,"Horror, Thriller",Italy,"Filmirage, Produzioni Cinematografiche Massaccesi (PCM) International",False,5.017,it,1980-08-07,90,5.6,58
724,Beyond the Darkness,0,0,Horror,Italy,D.R. Comunicazioni di massa,False,8.001,it,1979-11-15,94,6.7,57
725,Death Smiles on a Murderer,0,0,Horror,Italy,Dany Film,False,1.881,it,1973-07-11,88,6.2,19
726,Va a ser que nadie es perfecto,0,0,Comedy,Spain,"Catalan films & tv, Diagonal TV",False,1.48,es,2006-10-27,105,5.8,6
727,Idiot Love,0,0,"Comedy, Drama","Spain, Andorra",Manga Film,False,1.287,ca,2004-11-12,104,3.5,2
728,Erlkönig,0,0,"Crime, Drama",Germany,ZDF,False,0.6,de,2007-11-19,90,4.0,1
729,Cruel Intentions 2,0,0,Drama,United States of America,"Newmarket Capital Group, Original Film, Columbia TriStar Television",False,7.858,en,2000-11-09,87,4.6,184
730,Folgeschäden,0,0,Drama,Germany,,False,0.655,de,2004-11-24,88,0.0,0
731,Cruel Intentions 3,0,0,Drama,United States of America,"Newmarket Capital Group, Columbia TriStar, Original Film",False,6.474,en,2004-05-25,85,4.5,100
732,Der Tote am Strand,0,0,"Drama, Thriller",Germany,"Relevant Film GmbH, ZDF/Arte",False,0.6,de,2006-12-01,90,0.0,0
733,Silberhochzeit,0,0,Drama,Germany,,False,0.636,de,2006-01-13,90,0.0,0
734,Papa und Mama,0,0,"Comedy, Drama",Germany,,False,0.84,de,2006-01-02,180,0.0,0
735,Raging Inferno,0,0,"Action, Thriller",Germany,Pro7,False,1.517,de,2007-05-21,95,3.0,2
736,The Million Game,0,0,"Action, Drama, Thriller",Germany,Westdeutscher Rundfunk,False,3.618,de,1970-10-18,96,6.8,16
737,Love Exchange,0,0,Drama,United States of America,"Surrender Cinema, Twilight Movies",False,1.767,en,2001-01-01,90,0.0,0
738,Beowulf,20000000,1531251,"Action, Science Fiction, Thriller, Adventure, Horror, Fantasy","France, United States of America","Dimension Films, CTV International",False,7.814,en,1999-04-01,95,4.5,98
739,Beowulf & Grendel,0,92076,"Action, Adventure, Drama, Fantasy","Australia, Canada, Iceland, United Kingdom, United States of America","The Film Works, Icelandic Film Corporation, Union Station Media, Movision, Endgame Entertainment, Téléfilm Canada, Spice Factory",False,6.821,en,2005-09-14,103,6.0,104
740,Animated Epics: Beowulf,0,0,Animation,"United Kingdom, Russia, United States of America",Christmas Films,False,0.841,en,1998-01-01,27,0.0,0
741,De Dominee,0,0,"Drama, Crime",Netherlands,,False,3.079,nl,2004-09-02,110,6.6,12
742,"Not Mozart: Letters, Riddles and Writs",0,0,,United Kingdom,,False,0.85,en,1991-01-01,30,0.0,0
743,Shock,0,0,"Horror, Thriller",Italy,Laser Films,False,5.598,it,1977-08-12,95,6.5,38
744,Rabid Dogs,0,0,"Crime, Drama, Thriller",Italy,"Spera Cinematografica, International Media Films",False,6.667,it,1974-01-01,96,7.7,89
745,Lisa and the Devil,1000000,0,"Fantasy, Horror, Science Fiction","Germany, Spain, Italy, United States of America","Leone International, Euro America Produzioni Cinematografiche, Roxy Film",False,3.906,it,1973-05-08,92,6.3,43
746,Four Times That Night,0,0,Comedy,"Germany, Italy",Delfino Film,False,2.703,it,1972-04-15,83,5.7,9
747,Baron Blood,0,0,Horror,"Germany, Italy","Dieter Geissler Filmproduktion, Euro America Produzioni Cinematografiche, American International Pictures (AIP)",False,4.414,it,1972-02-25,98,6.0,42
748,A Bay of Blood,0,0,"Horror, Thriller",Italy,Nuova Linea Cinematografica,False,6.842,it,1971-08-08,85,6.5,134
749,"I'm a Cyborg, But That's OK",0,4354510,"Drama, Comedy, Romance",South Korea,Moho Film,False,8.063,ko,2006-12-07,105,7.2,223
750,Neowolf,0,0,"Horror, Thriller",United States of America,,False,2.083,en,2010-04-19,90,1.8,6
751,Battlefield Earth,44000000,21400000,"Action, Science Fiction, War",United States of America,"Morgan Creek Productions, Franchise Pictures, JTP Films, Battlefield Productions, Warner Bros. Pictures",False,10.441,en,2000-05-10,118,3.0,403
752,Battlefield Earth: Evolution & Creation,0,0,Documentary,United States of America,,False,0.877,en,2000-05-01,16,6.0,1
753,Returner,0,0,"Action, Adventure, Science Fiction",Japan,"Fuji Television Network, Amuse Pictures, Shirogumi",False,5.229,ja,2002-08-31,116,6.8,69
754,George and the Dragon,32000000,0,Adventure,"Germany, United Kingdom, United States of America, Luxembourg","ApolloMedia Distribution, Carousel Picture Company, Ravenhouse Entertainment",False,4.348,en,2004-03-28,93,4.8,36
755,Bin ich sexy?,0,0,Comedy,Germany,,False,0.825,en,2005-06-23,89,8.0,1
756,Love Is All,0,0,"Comedy, Romance",Netherlands,"VARA, Fu Works, Motel Films",False,3.935,nl,2007-10-10,110,6.3,40
757,Intimate Nights,0,0,"Thriller, Crime, Mystery, Romance",United States of America,Have Two Productions,False,0.6,en,1998-01-01,98,0.0,0
758,The Fugitive,44000000,368875760,"Adventure, Action, Thriller, Crime, Mystery",United States of America,Warner Bros. Pictures,False,13.009,en,1993-08-06,131,7.4,2108
759,The Ladykillers,0,0,"Comedy, Crime",United Kingdom,"The Rank Organisation, Ealing Studios",False,6.532,en,1955-12-08,91,7.4,186
760,Finders Keepers,0,0,"Comedy, Music",United Kingdom,,False,0.961,en,1966-12-08,94,0.0,0
761,Finders Keepers,0,0,Comedy,United States of America,,False,2.029,en,1984-05-18,96,5.8,8
762,"Finders, Keepers",0,0,,United Kingdom,Darc Productions,False,0.826,en,1996-01-01,11,0.0,0
763,Finders Keepers,0,0,Comedy,United Kingdom,,False,0.6,en,1952-01-01,74,0.0,0
764,Le Samouraï,0,39481,"Crime, Drama, Thriller","France, Italy","TC Productions, Compagnie Industrielle et Commerciale Cinématographique (CICC), Fida Cinematografica, Filmel",False,12.0,fr,1967-10-25,105,8.0,378
765,Finders Keepers,0,0,"Action, Comedy",United States of America,,False,1.342,en,2005-01-01,90,0.0,0
766,Finders Keepers,0,0,Comedy,United States of America,,False,0.6,en,1921-01-01,35,0.0,0
767,Finders Keepers,0,0,"Comedy, Drama",United States of America,,False,0.6,en,1928-02-18,60,0.0,0
768,The Ladykillers,0,0,"Comedy, Crime, Thriller",United States of America,"Touchstone Pictures, The Jacobson Company, Mike Zoss Productions",False,8.011,en,2004-03-25,104,6.1,798
769,Finders Keepers,0,0,"Crime, Drama",United States of America,Warner Bros. Pictures,False,0.84,en,1929-12-27,20,0.0,0
770,"Finders Keepers, Lovers Weepers",0,0,"Crime, Drama",United States of America,Eve Productions,False,2.02,en,1968-05-08,71,5.0,6
771,Finders Killers,0,0,Western,Italy,"Minerva Film SpA, Rieti Film",False,0.62,it,1971-03-27,92,4.0,1
772,My Sister's Keeper,0,0,Drama,United States of America,Hallmark Hall of Fame Productions,False,1.361,en,2002-01-27,90,7.9,5
773,Finder's Fee,0,0,"Drama, Thriller","United States of America, Canada",,False,2.186,en,2001-01-01,100,6.1,19
774,Her Sister's Keeper,0,0,Drama,Hong Kong,Shaw Brothers,False,1.341,zh,1963-05-18,90,0.0,0
775,Her Sister's Keeper,0,0,"Drama, Thriller","Canada, United States of America",Front Street Pictures,False,1.372,en,2006-11-26,92,6.0,1
776,Sister's Keeper,0,0,"Action, Drama, Thriller",United States of America,Offset Filmworks,False,1.176,en,2007-06-06,101,0.0,0
777,Sister's Keeper,0,0,"Drama, Action, Thriller",United States of America,,False,0.6,en,2007-01-01,90,0.0,0
778,A Killing Affair,0,0,"Crime, Drama, TV Movie",United States of America,,False,0.876,en,1977-09-21,100,0.0,0
779,A Killing Affair,0,35000,"Drama, Thriller, Crime",United States of America,Tomorrow Entertainment Inc.,False,0.635,en,1986-02-09,100,6.0,1
780,The Chorus,0,0,Drama,"Switzerland, Germany, France","Galatée Films, Pathé Renn Productions, France 2 Cinéma, Novo Arturo Films, Vega Film",False,12.093,fr,2004-03-17,96,7.7,1239
781,Hiroshima Mon Amour,0,0,"Drama, History, Romance","France, Japan","Argos Films, Como Films, Daiei Motion Picture Co., Ltd., Pathé Overseas",False,7.563,fr,1959-06-10,92,8.0,279
782,Dead Weekend,0,0,"Comedy, Science Fiction",United States of America,IRS Media,False,2.527,en,1995-10-08,82,1.3,3
783,RoboCop,13000000,53000000,"Action, Thriller, Science Fiction",United States of America,Orion Pictures,False,16.696,en,1987-07-17,102,7.2,2485
784,RoboCop 2,35000000,45681173,"Action, Adventure, Crime, Science Fiction, Thriller",United States of America,Orion Pictures,False,17.486,en,1990-06-22,117,5.8,827
785,RoboCop 3,22000000,10696210,"Action, Adventure, Crime, Science Fiction, Thriller",United States of America,Orion Pictures,False,14.838,en,1993-04-17,104,4.5,537
786,Space Cowboys,65000000,128884132,"Action, Adventure, Thriller",United States of America,"Digital Image Associates, Village Roadshow Pictures, Malpaso Productions, Mad Chance, Clipsal Films, Warner Bros. Pictures",False,12.545,en,2000-07-31,130,6.3,668
787,Immortal,24665810,0,"Drama, Action, Science Fiction","United Kingdom, France, Italy","Sofica Valor 6, RF2K Productions, Force Majeure Productions, Medusa Film, TPS Star, Cofimage 13, Natexis Banques Populaires Images 2, TF1 Films Production, CiBy 2000",False,9.119,fr,2004-03-13,103,5.9,211
788,The Phantom of Liberty,0,0,"Comedy, Drama","France, Italy",Greenwich Film Productions,False,6.207,fr,1974-09-10,104,7.6,100
789,Bee Movie,150000000,287594577,"Family, Animation, Adventure, Comedy",United States of America,"Columbus 81 Productions, DreamWorks Animation",False,12.415,en,2007-10-28,91,5.9,2608
790,Le Beau Serge,0,0,Drama,France,"Ajym Films, Coopérative Générale du Cinéma Français",False,2.723,fr,1958-06-06,98,7.1,24
791,The Terribly Sad Princess,0,0,"Music, Comedy, Family",Czech Republic,Filmové Studio Barrandov,False,1.714,cs,1968-06-07,73,6.8,6
792,Donkey Skin,0,0,"Music, Fantasy, Drama, Comedy, Romance",France,Marianne Productions,False,6.443,fr,1970-12-20,90,7.3,178
793,Testosterone,0,0,"Drama, Comedy, Mystery","Argentina, United States of America","Blue Streak Films, Cinecolor, Videocolor",False,3.988,en,2003-09-11,103,5.7,13
794,A Girl Cut in Two,0,0,"Comedy, Drama, Thriller","France, Germany",Integral Film,False,3.124,fr,2007-08-08,115,6.5,30
795,Was lebst Du?,0,0,Documentary,Germany,Real Fiction,False,0.842,en,2004-11-13,85,0.0,0
796,Say I Do,0,0,Comedy,Spain,"Columbia Films Productions, Zebra Productions",False,1.228,en,2004-01-13,102,5.4,7
797,Fermat's Room,0,0,"Mystery, Thriller",Spain,"BocaBoca Producciones, Notro Films",False,8.92,es,2007-10-07,88,6.6,168
798,The Blue Light,0,0,Fantasy,Germany,DEFA,False,0.873,de,1976-03-14,82,6.0,1
799,Die klugen Dinge,0,0,Fantasy,Germany,,False,0.6,de,1973-12-30,90,0.0,0
800,Rotkäppchen,0,0,"Fantasy, Family",Germany,DEFA,False,1.4,de,1962-07-12,72,6.0,1
801,Bahnwärter Thiel,0,0,Drama,Germany,DEFA,False,0.6,de,1982-11-21,90,0.0,0
802,The Actress,0,0,Drama,Germany,DEFA,False,0.6,de,1988-10-12,87,0.0,0
803,Thri3ller,0,0,Thriller,Germany,,False,1.092,en,2003-06-02,12,0.0,0
804,The Rainbowmaker,0,0,Romance,"Germany, Finland, Italy, Netherlands, Russia",Revolver Film,False,0.903,en,2008-05-12,90,2.5,2
805,Bis dass dein Tod uns scheidet,0,0,Comedy,Germany,,False,0.655,en,2002-03-25,90,0.0,0
806,Duell in der Nacht,0,0,"Crime, Drama, Thriller",Germany,,False,1.023,de,2008-01-07,90,4.3,2
807,Krieg der Frauen,0,0,Comedy,Germany,,False,0.6,de,2006-10-30,90,0.0,0
808,Voll korrekte Jungs,0,0,Comedy,Germany,U5 Filmproduktion GmbH,False,0.6,en,2002-11-14,90,0.0,0
809,Es muss Liebe sein,0,0,Comedy,Germany,,False,0.6,de,2001-05-30,90,0.0,0
810,Späte Aussicht,0,0,Drama,Germany,,False,0.6,en,2007-12-05,90,0.0,0
811,Fürchte dich nicht,0,0,Thriller,Germany,TV-60 Filmproduktion,False,0.6,de,2007-01-22,90,0.0,0
812,Der Letzte macht das Licht aus,0,0,Drama,Germany,"MBB Medienboard Berlin-Brandenburg, Kaminski.Stiehm.Film GmbH",False,0.916,de,2007-01-16,84,0.0,0
813,Einmal noch die Heimat seh’n,0,0,Drama,Germany,Rex-Film Berlin,False,0.6,de,1958-11-06,99,4.0,2
814,Niete zieht Hauptgewinn,0,0,"TV Movie, Comedy, Romance",Germany,,False,0.674,de,2007-12-28,88,5.0,1
815,The Whore's Son,0,0,Drama,"Austria, Luxembourg","Aichholzer Film, Tarantula",False,1.803,de,2004-01-15,86,5.5,2
816,Cat People,18000000,0,"Fantasy, Horror, Thriller",United States of America,"Universal Pictures, RKO Radio Pictures",False,9.178,en,1982-04-02,118,5.9,176
817,The Crows,0,0,"Horror, Thriller",Germany,,False,0.7,de,2006-11-14,90,2.0,1
818,Bühne frei für Marika,0,0,"Music, Comedy",Germany,Real-Film GmbH,False,0.6,de,1958-08-14,93,10.0,1
819,Übermut im Salzkammergut,0,0,"Music, Comedy, Drama",Germany,Music House,False,0.705,de,1963-08-30,99,5.0,1
820,Mein Weg zu dir heißt Liebe,0,0,Drama,Germany,,False,0.6,en,2004-03-02,92,0.0,0
821,Pizza Colonia,0,0,"Comedy, Crime",Germany,,False,0.844,de,1991-12-05,90,0.0,0
822,Räuber und Gendarm,0,0,"Crime, Drama",Germany,,False,0.6,en,1978-01-01,90,0.0,0
823,Die Hochzeit meiner Töchter,0,0,Comedy,Germany,,False,0.826,de,2006-12-01,90,4.0,1
824,Ein Polterabend,0,0,Comedy,Germany,,False,0.841,de,1955-08-18,90,0.0,0
825,Polterabend,0,0,Comedy,Germany,Internationale Filmschule Köln,False,0.6,en,2006-01-24,22,0.0,0
826,Polterabend,0,0,Comedy,Germany,Astra-Film,False,0.6,de,1940-03-21,90,0.0,0
827,Prince Valiant,0,0,"Adventure, Fantasy","Germany, Ireland, United Kingdom","Celtridge, Constantin Film, Babelsberg Film, Hearst Entertainment Productions, Legacy Film Productions",False,3.662,en,1997-07-24,91,5.5,25
828,Crime Spree,0,0,"Comedy, Crime","Canada, France, United Kingdom, United States of America","GFT Entertainment, Studio Eight Productions, Vision View Entertainment, Bac Films",False,3.914,en,2003-04-16,98,5.8,39
829,Reign of Fire,60000000,82150183,"Adventure, Action, Fantasy","Ireland, United Kingdom, United States of America","The Zanuck Company, Spyglass Entertainment, World 2000 Entertainment, Touchstone Pictures, Tripod Entertainment",False,12.142,en,2002-07-12,101,6.0,1153
830,Sister Act 2: Back in the Habit,38000000,57319029,"Music, Comedy",United States of America,Touchstone Pictures,False,14.156,en,1993-12-09,107,6.3,858
831,Junior,60000000,108431355,"Comedy, Family, Romance",United States of America,"Northern Lights Entertainment, Universal Pictures",False,9.625,en,1994-11-22,109,4.9,719
832,Klein Erna auf dem Jungfernstieg,0,0,Comedy,Germany,,False,1.341,de,1969-10-31,87,0.0,0
833,Coyote Ugly,45000000,113916474,"Comedy, Drama, Music, Romance",United States of America,"Touchstone Pictures, Jerry Bruckheimer Films",False,11.152,en,2000-07-30,100,6.1,1069
834,MouseHunt,38000000,122417389,"Comedy, Family",United States of America,DreamWorks Pictures,False,10.077,en,1997-12-19,98,6.3,571
835,Who Killed Santa Claus?,0,0,Crime,France,Continental Film,False,2.376,fr,1941-10-16,105,7.0,7
836,Meine Tochter darf es nie erfahren,0,0,Drama,Germany,Fontana TV,False,0.6,de,2000-11-14,93,0.0,0
837,Flood,0,0,"Drama, Action, Thriller","Canada, South Africa, United Kingdom","Power, Moonlighting Films, Muse Entertainment",False,5.906,en,2007-08-24,110,5.5,65
838,Der Boss aus dem Westen,0,0,"Comedy, Drama",Germany,,False,0.84,en,1988-11-02,94,0.0,0
839,Brotherhood of the Wolf,29000000,70752904,"Adventure, Horror, Action, History",France,"Davis-Films, Eskwad, Natexis Banques Populaires Images, Studio Image Soficas, Canal+, TF1 Films Production",False,12.035,fr,2001-01-31,137,6.6,709
840,Rosenstrasse,0,0,"Drama, History","Germany, Netherlands","Studio Hamburg Letterbox Filmproduktion, Tele München Fernseh Produktionsgesellschaft (TMG)",False,2.293,de,2003-09-18,136,6.4,16
841,Vaya con Dios,0,0,Comedy,Germany,,False,1.171,de,2002-03-28,106,6.3,8
842,The Karate Killers,0,0,"Action, Adventure, Comedy, Crime, Thriller",United States of America,Arena Films,False,2.706,en,1967-04-07,90,5.4,4
843,Police,0,0,"Romance, Drama, Thriller, Crime",France,Gaumont,False,3.584,fr,1985-09-04,113,6.0,41
844,"Theo, Agnes, Bibi und die anderen",0,0,Comedy,Germany,,False,1.129,de,2007-08-29,89,0.0,0
845,Erbin mit Herz,0,0,"TV Movie, Comedy, Drama",Germany,"Österreichischer Rundfunk, ARD/Degeto Film",False,0.745,de,2004-10-22,89,5.0,1
846,Oh Tannenbaum,0,0,Comedy,Germany,Allmedia Pictures GmbH,False,1.251,de,2007-12-07,90,4.5,2
847,Blue Thunder,22000000,42313354,"Science Fiction, Action, Thriller, Crime, Drama",United States of America,"Rastar Pictures, Columbia Pictures",False,10.948,en,1983-02-05,109,6.1,190
848,The Chamber,50000000,22540359,"Crime, Drama",United States of America,"Universal Pictures, Imagine Entertainment, Davis Entertainment",False,7.917,en,1996-10-11,113,6.0,94
849,Der Ruf der Berge,0,0,Drama,Germany,Mecom Movie GmbH,False,0.6,en,2005-12-16,90,0.0,0
850,Actresses,0,0,"Comedy, Drama",France,"Wild Bunch, Fidélité Productions, Virtual Films, Centre National de la Cinématographie, Canal+",False,2.995,fr,2007-12-26,107,5.8,11
851,Ruf der Berge - Schatten der Vergangenheit,0,0,Drama,Germany,Bsmovie tv filmproduktion,False,0.636,en,2007-11-30,88,0.0,0
852,Die Geierwally,0,0,Drama,Germany,Gloria-Film GmbH,False,0.621,de,1922-09-10,120,3.5,1
853,Die Geierwally,0,0,Drama,Germany,Tobis Filmkunst,False,0.625,de,1940-08-13,104,6.0,1
854,Wally the Vulture,0,0,Drama,Germany,Peter Ostermayr Produktion,False,1.371,de,1956-08-29,90,5.0,1
855,Die Geierwally,0,0,Comedy,Germany,,False,1.639,de,1988-01-01,105,5.8,4
856,Die Geierwally,0,0,Drama,Germany,,False,0.673,de,2005-01-07,90,4.0,1
857,Holidays in Tyrol,0,0,"Drama, Family, Adventure",Germany,Sokal-Film GmbH,False,0.805,de,1956-03-07,100,0.0,0
858,Der Weihnachtsmörder,0,0,"Crime, Drama, Thriller",Germany,,False,1.4,en,1997-12-13,90,0.0,0
859,"Hilfe, ich liebe Zwillinge!",0,0,"Music, Comedy, Romance",Germany,Lisa Film GmbH (München),False,0.913,de,1969-11-21,84,3.0,1
860,The Very Thought of You,0,0,"Comedy, Romance",United Kingdom,"Channel Four Films, Banshee",False,2.354,en,1998-05-08,88,5.6,23
861,Fröhlich Geschieden,0,0,Comedy,Austria,,False,0.805,de,1997-01-01,84,0.0,0
862,The Nugget,0,0,Comedy,Australia,B.J. Films,False,1.771,en,2002-10-17,89,6.5,2
863,Podium,1000,0,Documentary,,,False,1.4,en,2007-02-23,20,0.0,0
864,Rounds,14000,0,Drama,Germany,,False,0.6,ab,2007-12-06,29,0.0,0
865,Meine beste Feindin,0,0,Drama,Germany,,False,1.091,de,1999-10-01,87,0.0,0
866,Ninotschka,0,0,,Germany,,False,0.6,en,1965-03-18,90,0.0,0
867,Jellyfish,1800000,0,"Drama, Comedy, Romance","France, Israel",Les Films du Poisson,False,3.091,he,2007-05-05,82,7.1,14
868,SLC Punk,0,299200,"Crime, Romance, Comedy, Drama, Music",United States of America,Beyond Films,False,7.337,en,1998-09-24,97,7.3,173
869,Xaver und sein außerirdischer Freund,0,0,"Science Fiction, Comedy",Germany,Calypso Filmproduktion,False,2.764,de,1986-10-30,90,5.3,6
870,Nebenwirkungen,0,0,Thriller,Switzerland,Maximage GmbH,False,1.4,de,2007-01-01,89,0.0,0
871,A Friend Is a Treasure,0,0,"Action, Adventure, Comedy","Italy, United States of America",Take 1 Productions,False,8.576,it,1981-12-09,102,6.9,292
872,Heute fängt mein Leben an,0,0,Drama,Germany,,False,0.84,de,2006-10-06,90,0.0,0
873,White Noise 2: The Light,0,0,"Thriller, Drama, Horror, Fantasy","Canada, United States of America","Brightlight Pictures, Gold Circle Films",False,7.246,en,2007-01-05,99,5.5,130
