,title,budget,revenue,genres,production_countries,production_companies,adult,popularity,original_language,release_date,runtime,vote_average,vote_count
0,Drama,0,0,Comedy,"India, United Kingdom","Varnachithra Good Line Productions, Lilypad Motion Pictures UK LTD",False,1.096,ml,2018-11-01,146,6.0,1
1,Peaceful Times (F02) Petit Film,0,0,"Animation, Music",Japan,Studio Khara,False,0.84,ja,2013-11-23,5,0.0,0
2,BRD,0,0,,,,False,0.6,en,2003-09-12,25,0.0,0
3,DDR,0,0,,,,False,0.6,en,2005-09-04,27,0.0,0
4,Pizza Hunt,0,0,"Comedy, Horror",,,False,0.6,en,2003-12-31,6,0.0,0
5,El Chevrolé,0,0,,,,False,0.6,es,,,0.0,0
6,Hollywood Premiere,0,0,Music,United States of America,Metro-Goldwyn-Mayer,False,0.6,en,1933-02-04,18,0.0,0
7,Pleasure Island,0,0,,United States of America,"Vitagraph, Warner Bros. Pictures",False,0.6,en,1933-02-24,18,0.0,0
8,Don't Come After Me,0,0,Thriller,Finland,Mangaani Motion Pictures,False,0.6,en,,,0.0,0
9,Abbai class ammayi mass,0,0,Drama,India,,False,0.658,te,2013-08-03,125,0.0,0
10,Mückenalarm - Invasion der Plagegeister,0,0,Documentary,Germany,"ECO Media TV-Produktion GmbH, ZDF, ARTE",False,0.6,de,2015-06-26,,10.0,1
11,Paul McCartney: Live at Grand Central Station,0,0,Music,United States of America,YouTube,False,0.6,en,2018-09-07,102,0.0,0
12,WD-40 - Né pour être sauvage,0,0,,,,False,0.6,fr,2008-07-29,,0.0,0
13,Mononc' Serge & Anonymus - Final Bâton,0,0,Music,,,False,0.6,fr,2011-03-29,,0.0,0
14,Under the Autumn Moon,0,0,"Romance, TV Movie",,Hallmark Entertainment,False,3.056,en,2018-10-13,84,6.0,7
15,"Love, Of Course",0,0,"Drama, Romance, TV Movie",,Hallmark Entertainment,False,2.727,en,2018-10-20,84,6.9,7
16,Under Suspicion for a Crime of Passion Aggravated by Triviality,0,0,,,,False,0.6,en,,15,0.0,0
17,UFC 228: Woodley vs. Till,0,0,Action,United States of America,Zuffa,False,0.69,en,2018-09-08,130,10.0,1
18,Ruhm in der Niederlage - John Ford und der Zweite Weltkrieg,0,0,Documentary,Germany,Spiegel TV,False,0.84,de,1998-01-01,,0.0,0
19,Sourires d'Asie,0,0,Comedy,,Universal Pictures France,False,0.6,fr,2005-02-04,,0.0,0
20,Exxxtra Small Chicks Fucking Huge Dicks 5,0,0,,United States of America,Team Skeet,True,0.6,en,2014-02-03,134,0.0,0
21,Këmishët me dyllë,0,0,"History, Drama, War",Albania,,False,0.6,en,1987-09-08,68,0.0,0
22,In the Name of Freedom,0,0,War,Albania,,False,0.6,sq,1987-09-09,76,0.0,0
23,Colonel Heeza Liar's African Hunt,0,0,"Animation, Comedy",,,False,1.165,en,1914-01-01,10,0.0,0
24,"Lino Ventura, la part intime",0,0,Documentary,France,ARTE,False,0.6,fr,2018-02-04,,0.0,0
25,As Divas Negras do Cinema Brasileiro,0,0,Documentary,Brazil,,False,0.626,pt,1989-01-01,,0.0,0
26,Along for the Ride,0,0,,United States of America,Wicked Pictures,True,0.6,en,2016-05-24,124,0.0,0
27,Shelter: Human Stories from Central America,0,0,Documentary,Mexico,Firpo Industries,False,0.6,en,,14,0.0,0
28,Tends-moi la main,0,0,Drama,France,"Les Films à Fleur de Peau, Côté Cour",False,1.756,fr,2019-05-29,,0.0,0
29,Barnstorm,0,0,,United States of America,Titan Media,True,0.6,en,2007-10-23,150,0.0,0
30,Play,0,0,Comedy,France,"Chapter 2, Moonshaker, Mars Film",False,0.932,fr,2019-10-30,,0.0,0
31,Il pugno di Gesù,0,0,Comedy,,handsUP! Film Production,False,0.602,it,2007-01-15,,0.0,0
32,Boom,0,0,,United States of America,Titan Media,True,0.6,en,2017-09-15,,0.0,0
33,Above All Things,0,0,"Comedy, Drama, Horror, Romance, Thriller",,,False,0.6,en,,94,0.0,0
34,If You Listen Carefully,0,0,Documentary,Chile,,False,1.105,es,2016-06-07,56,0.0,0
35,28 Noites ao Vivo nos Coliseus,0,0,Music,,,False,0.6,pt,,,0.0,0
36,Beastie Boys: Sabotage,0,0,"Music, Comedy, Action",,Geneon Entertainment,False,1.688,en,1997-12-10,59,7.9,7
37,Deadly Shores,0,0,Drama,,,False,0.84,en,2018-08-24,88,0.0,0
38,Seance,0,0,Horror,Czech Republic,,False,0.84,cs,2009-10-20,19,0.0,0
39,The Man Who Loves to Hurt Himself,0,0,Documentary,,,False,0.6,en,2018-09-07,92,0.0,0
40,Raw Heights,0,0,,Czech Republic,"Raw Films, AVI Production",True,0.843,cs,2007-12-28,106,0.0,0
41,Freddie Steps Out,0,0,"Comedy, Music",United States of America,Monogram Pictures,False,0.6,en,1946-06-29,72,0.0,0
42,Where Mermaids Go,0,0,"Drama, Family",,,False,0.601,ko,2015-10-07,27,0.0,0
43,A.I. Love You,0,0,Romance,Japan,Fuji Television Network,False,0.677,en,2016-12-10,92,8.0,2
44,When September Ends,0,0,Romance,,,False,0.847,ko,2013-11-07,23,0.0,0
45,Asylum,0,0,,,,False,0.6,en,,51,0.0,0
46,The autumn then comes,0,0,Romance,,,False,0.661,ko,2015-06-25,32,0.0,0
47,Raw Luck,0,0,,Czech Republic,"AVI Production, Raw Films",True,0.6,cs,2005-04-01,102,0.0,0
48,Sentiment,100,5000,Drama,United States of America,,False,0.6,en,,2,0.0,0
49,The Invasion of Johnson County,0,0,Western,United States of America,,False,0.6,en,1976-07-31,100,6.5,2
50,Navy Blue,0,0,Romance,,Hand in Hand Films,True,0.6,en,1979-08-01,65,0.0,0
51,Chuckle Boy,0,0,"Comedy, Science Fiction",United States of America,Mint 400 Productions,False,0.6,en,2009-01-16,18,7.0,1
52,Amateur Pajama Jam,0,0,,United States of America,Black Ice,True,0.6,en,2010-03-02,99,0.0,0
53,Ass Vs. Pussy 4,0,0,,United States of America,Skow for Girlfriends Films,True,0.6,en,2017-01-13,259,0.0,0
54,Bad Ass Barbies,0,0,,United States of America,AMK Empire,True,0.6,en,2017-07-18,120,0.0,0
55,Bangin' Blondies,0,0,,Canada,Mofos,True,0.6,en,2016-09-06,182,0.0,0
56,Six Characters In Search Of An Author,0,0,"TV Movie, Drama",,,False,0.6,it,1965-09-25,133,0.0,0
57,Survive or Die,0,0,Action,Australia,Scrim Entertainment,False,1.151,en,2018-09-08,83,0.0,0
58,Acts of Gang,0,0,Action,Hong Kong,Filmark International Ltd,False,0.6,en,,85,0.5,1
59,Art of Love,0,0,,,,True,0.6,fr,1998-01-01,87,7.0,1
60,Sathyam,0,0,"Action, Thriller",India,,False,0.902,ml,2004-08-27,134,5.5,2
61,Indigo Lake,0,0,Thriller,,,False,0.6,en,2017-04-23,92,0.0,0
62,Bück Fotzen über 40,0,0,,Germany,BB Video,True,0.6,de,2012-02-10,,0.0,0
63,Akale,0,0,Drama,India,"Kolath Films, INC.",False,0.6,ml,2004-12-09,84,0.0,0
64,Krithyam,0,0,"Action, Thriller",India,Sree Uthrattathi Films (PVT) LTD,False,0.6,ml,2005-05-06,128,3.5,2
65,Too Small to Take It All 9,0,0,,United States of America,Third Degree Films,True,0.6,en,2017-02-28,124,0.0,0
66,My Mom's Dark Secret,0,0,,United States of America,Third Degree Films,True,0.6,en,2017-02-22,92,0.0,0
67,Young Interracial Addicts,0,0,,United States of America,Third Degree Films,True,0.6,en,2017-01-10,103,0.0,0
68,Decades Apart,0,0,"War, Drama, Thriller, Action",South Korea,Moho Film,False,0.611,ko,2017-05-30,18,0.0,0
69,The King of the Drift,0,0,"Drama, Action",China,Transcomedia Pictures,False,0.84,zh,,92,0.0,0
70,Pimp My Wife 3,0,0,,United States of America,Third Degree Films,True,0.6,en,2017-01-06,100,0.0,0
71,Petite Girls Taking Massive Cock,0,0,,United States of America,Third Degree Films,True,0.6,en,2016-12-13,100,0.0,0
72,Romeo & Juliet,0,0,Music,France,Pathé Live,False,0.6,ru,2018-07-19,,0.0,0
73,Das Frauengefängnis,0,0,,,,True,0.6,de,,,0.0,0
74,Spider Murphy Gang - 30 Jahre Rock'n'Roll,0,0,,,,False,0.6,de,2007-11-03,,8.0,1
75,Moonrise Over Egypt,0,0,"Drama, History",Indonesia,TVS Films,False,0.84,id,2018-03-22,,0.0,0
76,Zirkuskinder,0,0,Family,Germany,,False,0.6,de,1985-01-01,,0.0,0
77,Die Baronin - Fontane machte sie unsterblich,0,0,Drama,Germany,,False,0.84,de,1981-01-13,,0.0,0
78,Drei Bürger zum Geburtstag,0,0,Drama,Germany,,False,0.6,de,1979-05-13,,0.0,0
79,Nicht von gestern,0,0,Comedy,Germany,,False,0.6,de,1977-01-01,,0.0,0
80,When Love Comes Around,0,0,Romance,,,False,0.6,en,,139,0.0,0
81,"Love Reborn: Komik, Musik & Kisah Masa Lalu",0,0,"Drama, Romance",Indonesia,Darihati Films,False,0.708,id,2018-05-31,,0.0,0
82,Wurm im Bau,0,0,Comedy,Germany,,False,0.84,de,1973-09-22,,0.0,0
83,Eine Krankheit genannt Leben,0,0,Drama,Germany,,False,0.6,de,1968-03-31,,0.0,0
84,Die Gefährtin,0,0,Comedy,Germany,,False,0.6,de,1967-03-01,,0.0,0
85,Alphonse s'égare,0,0,Animation,France,,False,0.608,fr,2017-02-04,,0.0,0
86,Die Nacht zum Vierten,0,0,Drama,Germany,,False,1.127,de,1966-06-08,,0.0,0
87,Nju,0,0,Drama,Germany,,False,0.6,de,1965-05-20,,0.0,0
88,Das Band,0,0,Drama,Germany,,False,0.6,de,1963-12-04,,0.0,0
89,Der Mann aus England,0,0,Drama,Germany,,False,0.849,de,1963-06-04,,0.0,0
90,Jahre danach,0,0,Drama,Germany,,False,0.6,de,1963-02-07,,0.0,0
91,Believe It or Not,0,0,"Drama, Thriller, Action",South Korea,"Moho Film, Asia Culture Center",False,0.6,ko,2018-03-09,31,0.0,0
92,Amores perros,0,0,"Comedy, Romance",Spain,,False,0.6,es,2016-01-01,3,0.0,0
93,Ich rufe Dresden,0,0,Drama,Germany,,False,0.805,de,1960-06-17,,0.0,0
94,Pursuit of a Legend,0,0,Horror,United States of America,CK Pictures,False,0.6,en,2013-12-10,84,0.0,0
95,Viktoria,0,0,Drama,Germany,,False,0.6,de,1957-07-02,,0.0,0
96,Gericht bei Nacht,0,0,Drama,Germany,,False,0.6,de,1957-04-15,,0.0,0
97,Al final del túnel,0,0,,,,False,0.6,es,2011-09-22,,0.0,0
98,IMAX: 4K Extreme Adventure Collection,0,0,,,,False,0.6,de,,,0.0,0
99,Don Floripondio,0,0,Comedy,,,False,0.6,es,1939-11-16,,0.0,0
100,Police Precinct Soul,0,0,,Japan,"tv asahi, Toei Company, Ltd.",False,0.6,ja,2015-09-20,,0.0,0
101,Fluffy Girls 2,0,0,,United States of America,New Sensations,True,0.878,en,2018-04-30,294,0.0,0
102,Chocolate Creampie,0,0,Fantasy,United States of America,Robert Hill Entertainment,True,0.6,en,2016-05-17,121,0.0,0
103,When Grandmother is away,0,0,Drama,Vietnam,Hang Phim Truyen,False,0.6,vi,1985-01-01,63,0.0,0
104,Backdoor BBWs 2,0,0,Fantasy,United States of America,Sensational Video,True,0.6,en,2013-03-07,116,0.0,0
105,The Everything,0,0,"Fantasy, Romance, Family, Drama",,,False,1.242,en,2018-08-30,30,8.0,1
106,Tremble,0,0,,,,False,1.014,en,2018-09-08,35,0.0,0
107,Hope in a Box,2000,0,Comedy,United Kingdom,,False,0.6,en,2017-04-07,9,0.0,0
108,Please Fuck My Fat Daughter,0,0,,United States of America,Robert Hill Entertainment,True,0.6,en,2015-06-03,164,0.0,0
109,Big Beautiful Women 2,0,0,Fantasy,United States of America,New Sensations,True,0.6,en,2018-04-03,301,0.0,0
110,Dr Tatya Lahane Angaar Power is within,0,0,,,,False,0.6,en,,170,0.0,0
111,Muppet Video: The Kermit and Piggy Story,0,0,,,,False,0.6,en,,57,0.0,0
112,MC Jess,0,0,,Brazil,,False,0.6,pt,2018-07-01,20,0.0,0
113,Safe Space,0,0,Drama,,,False,0.644,en,2018-09-09,6,0.0,0
114,Bush Club 2,0,0,,United States of America,New Sensations,True,0.6,en,2018-06-02,297,0.0,0
115,Johny Johny Yes Appa,0,0,"Comedy, Drama",India,Vaishaka Movies,False,1.146,ml,2018-10-26,143,5.0,3
116,Pick a Flap and Fuck It 5,0,0,Fantasy,United States of America,Robert Hill Entertainment,True,0.6,en,2014-07-15,164,0.0,0
117,BBW Anal Fever 3,0,0,,United States of America,Sensational Video,True,0.6,en,2013-06-07,119,0.0,0
118,Fat Juggs Anal Love 3,0,0,Fantasy,United States of America,Sensational Video,True,0.6,en,2016-09-13,120,0.0,0
119,"On the Road, Two",0,0,"Documentary, Music",South Korea,Sponge Ent.,False,0.6,ko,2006-01-05,107,6.0,1
120,R.E.M. Live In Milan,0,0,,,,False,0.6,en,2008-01-01,,0.0,0
121,R.E.M. Road Movie,0,0,,,,False,0.6,es,1995-01-01,,0.0,0
122,Az Árpád-vonal,0,0,Documentary,,,False,0.84,hu,2018-09-05,,9.0,1
123,Mister Paper Goes Out for a Walk,0,0,Animation,Netherlands,"Viking Film, Beast Animation",False,0.804,nl,,8,0.0,0
124,When Did You See Sahar Last Time?,0,0,"Drama, Crime",Iran,,False,0.6,fa,2018-08-29,102,0.0,0
125,The Kin,0,0,Horror,Finland,"SubTV, BMG Finland Oy, Monstereo Management, Kinoproduction",False,0.6,en,2004-04-16,33,0.0,0
126,Дом на дюнах,0,0,,,,False,0.6,ru,1984-09-01,,0.0,0
127,Being Good,0,0,Animation,,,False,0.84,en,2017-11-18,,0.0,0
128,Południe-Północ,0,0,Drama,Poland,,False,1.342,pl,2006-01-26,,0.0,0
129,The Lord of Amusement,0,0,,,,False,0.6,zh,1999-04-10,,0.0,0
130,New York City Opera: The Merry Widow,0,0,"Music, Romance, Drama, Comedy",United States of America,Lincoln Center for the Performing Arts,False,0.6,en,1996-03-27,133,0.0,0
131,Casulo,0,0,Documentary,,,False,0.6,pt,2015-12-02,,0.0,0
132,Epicentro,0,0,Drama,Italy,Playmaker Produzioni,False,1.149,it,2018-09-01,,0.0,0
133,"Will Tura, hoop doet leven",0,0,Documentary,,,False,0.6,nl,2018-09-12,,0.0,0
134,Awaker,0,0,Animation,Czech Republic,Tomas Bata University in Zlin,False,0.6,cs,2017-05-04,10,0.0,0
135,Her Boyfriend's Secret,0,0,"Thriller, TV Movie",,,False,0.877,en,2018-09-08,85,8.0,1
136,Candide,0,0,"Music, Drama, Comedy",,VMP,False,0.6,es,1991-10-15,,7.0,1
137,Daughter Swap 4,0,0,,,Team Skeet,True,0.6,en,2018-09-18,183,0.0,0
138,Reflecting Memory,0,0,,,,False,0.6,en,,48,0.0,0
139,Beauty,0,0,Documentary,Canada,National Film Board of Canada,False,1.4,en,2018-03-17,23,0.0,0
140,Hallowe'en Party,0,0,Mystery,United Kingdom,,False,0.704,en,2011-11-26,89,8.0,1
141,Escoria Humana,0,0,"Action, Crime",Mexico,Flores Films,False,0.673,es,1999-01-01,84,5.0,1
142,Belly Flop,0,0,Animation,,,False,1.4,en,2018-03-04,5,5.0,1
143,Breath of Life,0,0,Drama,France,"ElianeAntoinette, Reboot Films",False,3.306,fr,2018-12-03,,6.7,22
144,Le désir mène les hommes,0,0,Drama,,,False,0.699,en,1957-10-23,,0.0,0
145,Jusqu'ici tout va bien,9598644,0,"Comedy, Drama",France,"Quad Films, Kiss Films, Ten Films, TF1 Studio, TF1 Films Production, 14ème Art Production, Panache Productions, La Compagnie Cinématographique Européenne",False,9.782,fr,2019-02-27,,6.2,78
146,Bi-Polaroid,0,0,Animation,United States of America,,False,0.6,en,2018-09-27,1,0.0,0
147,Bike Bird,0,0,,Norway,,False,1.09,no,,15,0.0,0
148,Dead Island,0,0,Horror,,,False,0.6,en,2010-10-31,70,2.0,1
149,The Boy Who Wouldn't Kill,0,0,,Germany,"German Film and Television Academy Berlin, Schattenkante, Hochschule für Film und Fernsehen 'Konrad Wolf'",False,0.6,de,,24,0.0,0
150,The Bird & The Whale,0,0,Animation,,,False,0.84,en,,7,0.0,0
151,Bubble Guppies On The Job,0,0,,,,False,0.6,en,,,0.0,0
152,Clean Up,0,0,,South Korea,Korean Academy of Film Arts (KAFA),False,0.6,ko,2018-10-06,104,0.0,0
153,Bulimia Purpura,0,0,,,,False,0.6,de,,,0.0,0
154,Make It Happen,0,0,Documentary,Serbia,Ministarstvo Odbrane Republike Srbije,False,0.84,sr,2013-11-19,35,0.0,0
155,Pilz,0,0,,,,False,0.84,de,,,0.0,0
156,Rise: Ini Kalilah,0,0,Drama,Malaysia,MM2 ENTERTAINMENT SDN BHD,False,0.605,en,2018-09-13,102,7.5,2
157,Raw Times,0,0,,Czech Republic,"Raw Films, AVI Production",True,0.6,cs,2006-04-15,117,0.0,0
158,The Doghouse,5000,0,Drama,United States of America,,False,1.09,en,,,0.0,0
159,1957,0,0,Drama,Philippines,,False,0.84,tl,2018-09-12,,0.0,0
160,Convívio,0,0,,,,False,0.6,pt,,,0.0,0
161,If Disney Cartoons Were Historically Accurate,0,0,,,,False,0.6,en,,3,0.0,0
162,Confession of a Misanthrope,0,0,Drama,Russia,VKSR,False,0.6,ru,2017-07-20,26,0.0,0
163,7 Days,0,0,"Romance, Romance, Comedy",,Nation Pictures,False,0.853,th,2018-09-12,118,0.0,0
164,Raw Tricks,0,0,,Czech Republic,"Raw Films, AVI Production",True,0.6,cs,2005-09-12,110,0.0,0
165,Baader-Meinhof Gang,0,0,Documentary,United States of America,A&E Television Networks,False,0.656,en,2007-10-19,45,0.0,0
166,Gudrun Ensslin - the early years,0,0,Documentary,Germany,NDR,False,0.823,de,1968-11-25,10,7.0,1
167,Paywall: The Business of Scholarship,0,0,Documentary,,,False,0.6,en,,64,0.0,0
168,Lordi: Market Square Massacre,0,0,,,,False,1.128,en,2006-11-01,,0.0,0
169,Thorsten Havener: Der Körpersprache Code,0,0,,,,False,0.6,de,,,0.0,0
170,T.I.T.S,0,0,,United States of America,Digital Playground,True,0.6,en,2018-09-12,117,7.8,2
171,The Book of Everything,0,0,,Portugal,Escola das Artes - Universidade Católica,False,1.103,en,2016-03-03,16,0.0,0
172,Двое в пути,0,0,,,,False,0.6,ru,1973-03-11,,0.0,0
173,La Clemenza di Tito,0,0,,,,False,1.4,en,2012-12-01,,0.0,0
174,Casas Caiadas,0,0,,Portugal,Escola das Artes - Universidade Católica,False,0.6,pt,2017-08-01,16,0.0,0
175,Way of Life,0,0,Drama,Philippines,,False,0.6,tl,2018-09-12,90,0.0,0
176,The Passage of the Bride,0,0,,United States of America,,False,0.6,en,1980-12-18,6,0.0,0
177,おたくのビデオ,0,0,,,,False,0.6,ja,1991-09-27,,0.0,0
178,My Sister's Hot Friend 48,0,0,,United States of America,Naughty America,True,0.854,en,2016-06-23,144,0.0,0
179,Exact Time,0,0,Documentary,Russia,Marina Razbezhkina and Mikhail Ugarov Academy,False,0.6,ru,2018-04-14,26,0.0,0
180,The Three Crow Boys,0,0,"Animation, Horror",United Kingdom,"Animation 2018, British Film Institute, BBC, Wingspan Productions",False,1.28,en,2018-11-19,9,0.0,0
181,//_sleeper,0,0,"Animation, Science Fiction",United Kingdom,"Animation 2018, British Film Institute, BBC, Wingspan Productions",False,0.66,en,2018-11-19,7,0.0,0
182,Frank's Joke,0,0,"Animation, Comedy",United Kingdom,"Animation 2018, British Film Institute, BBC, Wingspan Productions",False,0.6,en,2018-11-19,6,0.0,0
183,Meteorlight,0,0,"Animation, Science Fiction",United Kingdom,"Animation 2018, British Film Institute, BBC, Wingspan Productions",False,0.6,en,2018-11-19,10,0.0,0
184,Celia - la más hermosa flor,0,0,Documentary,Cuba,Estudios Mundo Latino,False,0.677,es,2015-10-10,57,0.0,0
185,Slug Life,0,0,"Animation, Comedy, Romance",United Kingdom,"Animation 2018, British Film Institute, BBC, Wingspan Productions",False,0.676,en,2018-11-19,7,0.0,0
186,"The Rimet Trophy, the Incredible Story of the World Cup",0,0,Documentary,,,False,1.131,it,2010-06-16,,0.0,0
187,Quarantine,0,0,Animation,United Kingdom,"Animation 2018, British Film Institute, BBC, Mock Duck Studios, Wingspan Productions",False,0.6,en,2018-11-19,13,9.0,1
188,Outside the Box,0,0,Animation,United Kingdom,"Animation 2018, Arts Council of England, British Film Institute, BBC, Wingspan Productions",False,0.6,en,2018-11-19,4,0.0,0
189,"Rambito y Rambón, primera misión",0,0,Comedy,Argentina,Aries Cinematográfica Argentina,False,0.6,es,1986-07-10,,0.0,0
190,Junk in the Trunk,0,0,,United States of America,Third Degree Films,True,0.854,en,2016-05-11,105,0.0,0
191,Uki,0,0,"Animation, Drama",United Kingdom,"Animation 2018, British Film Institute, BBC, Wingspan Productions",False,0.6,en,2018-11-19,6,0.0,0
192,ENO - The Barber of Seville,0,0,,,,False,0.6,en,2015-07-01,,0.0,0
193,"O, Hunter Heart",0,0,"Animation, Fantasy, Romance",United Kingdom,"Animation 2018, British Film Institute, BBC, Mackinnonworks, Wingspan Productions",False,0.6,en,2018-11-19,7,0.0,0
194,Tailpiece,0,0,Drama,Lebanon,,False,0.6,en,2018-09-06,6,0.0,0
195,Childhood Memories,0,0,"Animation, Documentary",United Kingdom,"Animation 2018, British Film Institute, BBC, Wingspan Productions",False,0.865,en,2018-11-19,4,0.0,0
196,The Penguin Who Couldn’t Swim,0,0,Animation,United Kingdom,"Animation 2018, British Film Institute, BBC, Wingspan Productions",False,0.6,en,2018-11-19,6,0.0,0
197,Maid in the USA,0,0,,United States of America,Third Degree Films,True,0.6,en,2016-04-28,132,0.0,0
198,Dogada,0,0,Animation,,,False,0.6,ru,1977-09-01,,0.0,0
199,Hair,0,0,"Animation, Comedy",United Kingdom,"Animation 2018, British Film Institute, BBC, Wingspan Productions, Black Eye Films",False,0.958,en,2018-11-19,10,0.0,0
200,Ladder to You,0,0,"Animation, Drama",United Kingdom,"Animation 2018, British Film Institute, BBC, Eyebolls, Wingspan Productions",False,0.6,en,2018-11-19,4,0.0,0
201,Interracial Girlfriends,0,0,,United States of America,Third Degree Films,True,0.6,en,2016-04-12,102,0.0,0
202,Secrets of British Animation,0,0,Documentary,United Kingdom,"Academy 7, BBC",False,0.669,en,2018-11-19,60,0.0,0
203,Colorcommotion,0,0,,,,False,0.6,en,,7,0.0,0
204,Silenciados (Cuando los maltratados son ellos),0,0,Documentary,,,False,0.723,es,2018-09-08,,8.0,1
205,Sweet Potatoes,0,0,Drama,Philippines,,False,0.84,tl,2018-09-12,80,0.0,0
206,Time of Day,0,0,Drama,United States of America,Rag & Bone Films,False,1.283,en,2018-09-12,10,4.0,2
207,Amma I Love You,0,0,,,,False,0.6,kn,2018-05-13,,0.0,0
208,A Splinter of Ice,0,0,,,,False,0.654,en,1972-05-29,60,0.0,0
209,Toulouse,0,0,Drama,Germany,,False,0.886,de,2018-09-12,85,6.0,1
210,The Secret History of Eurovision,0,0,"Documentary, History",,,False,0.6,en,2011-04-30,,10.0,1
211,Puccini: La Bohème,0,0,Music,United States of America,The Metropolitan Opera,False,1.044,it,2018-02-24,140,0.0,0
212,Living Forever,0,0,,,,False,0.6,en,,,0.0,0
213,Runner,0,0,Drama,,,False,0.84,en,2018-08-21,93,10.0,1
214,You Might Be the Killer,0,0,"Horror, Comedy, Mystery",United States of America,Curmudgeon Films,False,4.747,en,2018-09-21,92,6.2,37
215,Soapy Anal Babes,0,0,,United States of America,Evil Angel,True,0.6,en,2018-09-11,242,0.0,0
216,Level 16,0,0,"Science Fiction, Thriller",Canada,Markham Street Films,False,7.967,en,2018-02-20,102,5.1,58
217,Star 34,0,0,,United States of America,,False,0.6,en,1954-06-03,13,0.0,0
218,Outcall,3000,0,Thriller,,,False,1.4,en,,10,0.0,0
219,Signals: Read 'Em or Weep,0,0,Documentary,,Centron Corporation,False,0.6,en,1981-01-01,6,0.0,0
220,To Touch a Child,0,0,,,Centron Corporation,False,0.6,en,1962-01-01,12,0.0,0
221,Die blaue Distanz,0,0,,,Oh Movie Film,False,0.6,de,1983-02-22,25,0.0,0
222,Married to a Paedophile,0,0,Documentary,,,False,0.84,en,2018-09-03,70,7.0,1
223,Death Certificate,0,0,Drama,India,Backbenchers Films,False,0.698,bn,,75,4.0,1
224,Marocain,0,0,TV Movie,,,False,0.6,de,1989-02-15,85,0.0,0
225,Rick Springfield: Video Vault - A 30-Year Career Music Video Compilation,0,0,Music,,,False,0.844,en,2010-01-01,127,0.0,0
226,Lua,0,0,Documentary,Brazil,,False,1.4,en,2017-07-01,8,0.0,0
227,Jaan Ki Baazi,0,0,,,,False,0.6,en,,,0.0,0
228,Rootwood,0,0,Horror,,,False,1.035,en,2018-12-08,83,0.0,0
229,Bhangover,0,0,Comedy,India,,False,0.619,hi,2017-12-15,110,0.0,0
230,Everyone I Knew and Loved,0,0,,,,False,0.6,en,,,0.0,0
231,Luv Shuv Pyar Vyar,0,0,Romance,India,,False,0.6,hi,2017-03-03,114,0.0,0
232,Making Coco: The Grant Fuhr Story,600000,0,Documentary,Canada,Score G Productions,False,0.84,en,2018-09-11,90,0.0,0
233,The Perfect Murder,0,0,Thriller,Norway,"MovieMakers, Norsk Film",False,0.804,no,1992-08-20,110,0.0,0
234,Arrows of Outrageous Fortune,0,0,Comedy,United States of America,,False,0.6,en,,,0.0,0
235,Collector,0,0,,China,,False,0.6,zh,2012-01-01,20,0.0,0
236,Mono,0,0,Drama,United States of America,,False,0.946,en,2017-12-01,,0.0,0
237,End of Daylight,0,0,,,,False,0.664,en,,4,0.0,0
238,Judith: Shoulda Seen the Other Guy,0,0,,United States of America,,False,0.613,en,2017-07-17,4,0.0,0
239,My Black Boss 3,0,0,,United States of America,Third Degree Films,True,0.6,en,2016-04-07,102,0.0,0
240,Lifter,0,0,Crime,United States of America,,False,0.6,en,2016-10-21,15,0.0,0
241,A Youth Called Ties,0,0,Fantasy,United States of America,,False,0.6,en,2016-08-07,7,0.0,0
242,Space,0,0,,,,False,0.6,en,,6,0.0,0
243,Made In France,0,0,,France,Studio des Aviateurs,False,1.09,fr,,6,0.0,0
244,In Bloom,0,0,,,,False,1.4,en,2018-06-07,9,0.0,0
245,The Black,0,0,Documentary,South Korea,,False,0.6,ko,2018-09-13,68,0.0,0
246,I Banged My Son's Girlfriend,0,0,,United States of America,Third Degree Films,True,0.6,en,2016-03-02,105,0.0,0
247,Mecanic,0,0,"Animation, Science Fiction",France,ESMA,False,0.989,en,2018-09-12,7,8.0,1
248,Broadcast,0,0,"Comedy, Drama",United States of America,,False,0.604,en,2016-06-04,80,0.0,0
249,Affirmative Action,0,0,,United States of America,Third Degree Films,True,0.6,en,2016-02-25,118,0.0,0
250,Trubs,0,25,Comedy,United States of America,,False,1.354,en,2016-06-04,2,0.0,0
251,Suedehead,4500,0,Drama,United States of America,,False,0.6,en,2015-12-19,70,0.0,0
252,Judges Creed,0,0,"Comedy, Drama",United States of America,,False,0.6,en,2014-02-08,86,0.0,0
253,Я - Шаповалов Т.П.,0,0,Drama,Russia,Mosfilm,False,0.6,ru,1973-11-12,,0.0,0
254,Queerbait,100,0,Comedy,United States of America,,False,0.847,en,2013-10-25,50,0.0,0
255,México de mis amores,0,0,,,,False,0.6,es,1979-10-12,105,0.0,0
256,Wyeth,0,0,Documentary,United States of America,"WNET / THIRTEEN, Public Broadcasting Service (PBS)",False,0.726,en,2018-09-08,53,0.0,0
257,México nunca duerme,0,0,,,,False,0.6,es,1959-03-26,81,0.0,0
258,Ради жизни на земле,0,0,Drama,Russia,Mosfilm,False,0.6,ru,1974-05-06,,0.0,0
259,Homology,0,0,,,,False,0.627,ja,1964-12-16,2,0.0,0
260,An Event,0,0,,,,False,0.6,ja,1964-12-16,3,0.0,0
261,"2,880K=120”",0,0,,,,False,1.341,ja,1964-12-16,3,0.0,0
262,Big Booty Twerkout 2,0,0,,,Lethal Hardcore,True,0.6,en,2018-02-27,138,0.0,0
263,Inside & Outside,0,0,,,,False,0.6,ja,1964-12-16,2,0.0,0
264,Great Announcement,0,0,,,,False,0.6,ja,1964-12-16,2,0.0,0
265,Untitled,0,0,,,,False,0.6,ja,1964-12-16,2,0.0,0
266,Banquet of Torumarukiyo,0,0,,,,False,0.6,ja,1964-12-16,3,0.0,0
267,Flow,0,0,,,,False,0.6,ja,1964-12-16,3,0.0,0
268,My Documentary,0,0,,,,False,0.841,ja,1964-12-16,4,0.0,0
269,Sexual Space,0,0,,,,False,0.6,ja,1964-12-16,2,0.0,0
270,Krysztalowa dziewczyna,0,0,Drama,Poland,"Państwowa Wyższa Szkoła Filmowa, Telewizyjna i Teatralna",False,0.6,pl,2016-09-19,,5.0,1
271,Samsara,0,0,,,,False,0.6,ja,1964-12-16,2,0.0,0
272,A Study of Katoran - 4 Lines Poem,0,0,,,,False,0.6,ja,1964-12-16,4,0.0,0
273,Blonde's First Butt,0,0,,Canada,Girlsway Productions,True,0.6,en,2015-07-07,150,0.0,0
274,I Have a Wife 25,0,0,,United States of America,Naughty America,True,0.6,en,2013-10-25,130,0.0,0
275,Untitled,0,0,,,,False,0.6,ja,1964-12-16,1,0.0,0
276,Life,0,0,,,,False,0.6,ja,1964-12-16,3,0.0,0
277,Garbage,0,0,,,,False,0.6,ja,1964-12-16,2,0.0,0
278,Bridal Party Orgy,0,0,,,Zero Tolerance,True,0.6,en,2016-07-26,94,0.0,0
279,I Have a Wife 44,0,0,,United States of America,Naughty America,True,0.6,en,2017-05-24,125,0.0,0
280,The LeWood Anal Hazing Crew 3,0,0,,United States of America,Evil Angel,True,0.6,en,2013-04-22,151,0.0,0
281,Bolo,1000,0,"Comedy, Drama",United States of America,,False,0.6,en,2013-01-19,70,0.0,0
282,A Day In The Life of Dictator,0,0,,,,False,0.6,pt,,,0.0,0
283,Mickey and Me,500,0,"Comedy, Romance",United States of America,,False,0.6,en,2012-08-25,57,0.0,0
284,Pour It On! 2,0,0,,United States of America,ArchAngel Productions,True,0.6,en,2017-03-10,122,0.0,0
285,Margaret Mitchell: American Rebel,0,0,"Documentary, History",United States of America,Georgia Public Broadcasting,False,1.387,en,2012-04-01,55,0.0,0
286,Mein Germany: US Soldaten im Trümmerland,0,0,,,,False,0.6,pt,,,0.0,0
