,title,budget,revenue,genres,production_countries,production_companies,adult,popularity,original_language,release_date,runtime,vote_average,vote_count
422,Pilkarski poker,0,0,"Comedy, Action, Drama",,,False,0.677,en,1989-03-31,99,8.0,1
423,Popieluszko: Freedom Is Within Us,0,0,History,Poland,,False,1.4,pl,2009-02-27,180,4.2,3
424,Bumfights 1: Cause for Concern,0,0,,United States of America,Indecline Films,False,1.454,en,2002-04-08,56,3.0,5
425,Papelucho y el marciano,0,0,"Adventure, Animation, Family",Chile,Cineanimadores,False,0.6,es,2007-05-17,77,10.0,1
426,U2 3D,15000000,22730842,"Music, Documentary",United States of America,"3ality Digital Entertainment, National Geographic",False,1.098,en,2007-05-19,85,7.1,14
427,Fuga,0,0,"Thriller, Drama, Music","Argentina, Chile",Fabula,False,0.778,es,2006-03-27,110,6.7,6
428,All Souls Day: Dia de los Muertos,0,0,Horror,United States of America,"All Souls Day Inc., CFQ Films",False,2.825,en,2005-01-22,88,5.0,14
429,Mi mejor enemigo,0,0,"Comedy, Drama",Chile,Alce Producciones LTDA.,False,0.952,es,2005-01-01,100,7.0,3
430,So Different,0,0,"Comedy, Drama",Sweden,"Sweetwater Production, Svensk Filmindustri, TV4, Cinema Art, Succéfilm, Europa Sound Production, Filminvestering i Örebro, Film Capital Stockholm",False,0.916,sv,2009-11-06,104,5.5,1
431,For Rent,0,0,Drama,Chile,Cinépata,False,0.631,es,2005-10-13,109,5.0,1
432,Unfaithful Women,0,0,"Drama, Comedy",Chile,"Jazz Films, Chile Films",False,0.706,en,2004-01-01,107,0.0,0
433,Promedio rojo,0,0,"Comedy, Romance","Spain, Chile",,False,1.099,es,2004-11-04,104,5.5,7
434,Eroica,0,0,"Drama, Music, TV Movie",United Kingdom,,False,1.271,en,2003-01-01,89,7.0,2
435,XS - la peor talla,0,0,Comedy,Chile,JL Producciones de Cine y TV LTDA.,False,0.769,es,2003-11-27,84,3.3,3
436,Absolute Evil,0,0,"Mystery, Thriller",United States of America,Ulli Lommel Productions,False,0.633,en,2009-02-08,90,6.0,1
437,The Sentimental Teaser,0,0,"Comedy, Drama",Chile,,False,0.617,es,1999-10-28,87,8.0,3
438,Lookin' Italian,0,0,"Crime, Drama, Romance",United States of America,,False,0.6,en,1994-01-01,97,2.0,1
439,Deadly Invasion: The Killer Bee Nightmare,0,0,"Horror, Science Fiction, Thriller",United States of America,,False,2.132,en,1995-02-28,85,4.5,16
440,Retribution Road,0,0,"Action, Adventure, Thriller, Western",,,False,0.6,en,,85,0.0,0
441,Dr. Jekyll and Ms. Hyde,8000000,0,Comedy,"United Kingdom, United States of America","Rastar/Leider-Shapiro, The Rank Organisation, PVM Entertainment, Savoy Pictures",False,3.543,en,1995-08-25,90,5.3,23
442,Saved by the Bell: Wedding in Las Vegas,0,0,,United States of America,,False,2.437,en,1994-10-07,90,5.5,17
443,"Ranma ½: The Movie 2—Nihao, My Concubine",0,0,"Action, Comedy, Animation",Japan,,False,2.323,ja,1992-08-02,63,6.3,14
444,Saved by the Bell: Hawaiian Style,0,0,Comedy,United States of America,,False,3.02,en,1992-11-27,92,6.0,24
445,Blue Tiger,0,0,"Drama, Action, Thriller",,,False,1.214,en,1994-04-03,88,4.7,9
446,"Ranma ½: The Movie—Big Trouble in Nekonron, China",0,0,Animation,"Japan, United States of America",,False,1.878,ja,1991-11-02,74,6.1,14
447,The Prince and the Pauper,0,0,"Adventure, Drama, Family, Fantasy",United States of America,"First National Pictures, Warner Bros. Pictures",False,2.829,en,1937-05-08,118,6.5,15
448,Mrs Caldicot's Cabbage War,0,0,"Drama, Comedy",United Kingdom,Evolution Films,False,0.6,en,2003-01-30,110,6.5,2
449,Going Where I've Never Been: The Photography of Diane Arbus,0,0,"TV Movie, Documentary",United States of America,Camera Three Productions,False,1.71,en,1972-11-21,28,0.0,0
450,The Magic Flute,0,0,"Comedy, Drama, Music",United Kingdom,Walt deFaria,False,1.176,en,2006-09-07,133,7.2,11
451,Shaolin Temple 2: Kids from Shaolin,0,3554460,"Action, Comedy",Hong Kong,,False,2.472,cn,1984-01-26,103,6.3,10
452,Doug Anthony All Stars,0,0,Comedy,,,False,0.84,en,2009-01-27,229,6.5,1
453,Martial Arts of Shaolin,10000000,0,"Action, Comedy","Hong Kong, China",Shaw Brothers,False,2.607,zh,1986-03-01,90,7.0,22
454,True Legend,20000000,0,"Action, Fantasy",China,"Shanghai Film Group, EDKO Film, Edko Management and Consulting, Focus Features",False,8.584,zh,2010-02-09,115,6.4,79
455,Swarmed,0,0,"Action, Horror, Thriller, TV Movie",Canada,,False,2.984,de,2005-04-06,88,4.5,13
456,All Through the Night,0,0,"Comedy, Crime, Drama, Thriller, War",United States of America,Warner Bros. Pictures,False,2.108,en,1942-01-10,107,6.8,14
457,"Dr. Syn, Alias the Scarecrow",0,0,"Adventure, Family",United Kingdom,Walt Disney Productions,False,1.767,en,1963-12-06,98,7.5,4
458,All Night Long,0,0,"Drama, Music",United Kingdom,The Rank Organisation,False,1.939,en,1962-02-06,91,7.1,13
459,Among the Living,0,0,"Mystery, Drama",United States of America,Paramount,False,2.257,en,1941-12-19,67,5.8,8
460,Why We Laugh: Black Comedians on Black Comedy,0,0,"Comedy, Documentary",,,False,0.6,en,2009-01-01,95,0.0,0
461,The Woman on the Beach,0,0,"Drama, Romance",Germany,RKO Radio Pictures,False,2.62,en,1947-06-02,71,5.8,20
462,Satan's Sadists,0,0,"Drama, Action, Thriller",United States of America,Independent International Pictures (I-I),False,1.103,en,1969-06-01,86,3.5,10
463,Double Agent 73,0,0,Comedy,United States of America,Juri Productions,False,1.554,en,1974-01-01,73,3.6,5
464,Wisconsin Death Trip,0,0,Documentary,,,False,1.828,en,1999-09-05,76,5.6,9
465,Love Hina Christmas Special: Silent Eve,0,0,"Animation, Comedy, Romance",Japan,"TV Tokyo, XEBEC",False,0.906,ja,2000-12-24,46,6.0,8
466,Mobile Suit Gundam 00: A Wakening of the Trailblazer,0,0,"Action, Science Fiction, Animation, Drama",Japan,SUNRISE,False,3.156,ja,2010-09-18,123,6.8,13
467,The Mouse and His Child,0,0,"Animation, Drama, Family","Japan, United States of America","Murakami-Wolf Productions, Walt deFaria, Sanrio",False,1.95,en,1977-11-18,83,5.9,7
468,Os Normais: O Filme,0,0,Comedy,Brazil,"Lumière, Globo Filmes",False,4.899,pt,2003-10-24,93,6.7,79
469,K-1 World Grand Prix 2009 Final,0,0,,,,False,0.65,en,,,4.8,2
470,Reel Big Fish: Live at the House of Blues,0,0,Music,,,False,1.229,en,2003-12-07,105,6.5,4
471,Tenchu!,0,0,"History, Action, Drama",Japan,"Fuji Television Network, Katsu Production Co. Ltd., Daiei Motion Picture Co., Ltd.",False,2.713,ja,1969-08-09,140,6.9,10
472,Always Will,0,0,"Drama, Science Fiction, Family",,,False,0.6,en,2006-03-22,95,5.5,2
473,Elephant,0,0,"Crime, Drama, History, TV Movie",United Kingdom,BBC Northern Ireland,False,3.158,en,1989-02-13,39,6.6,43
474,Letters to Juliet,30000000,82148538,"Comedy, Drama, Romance",United States of America,"Applehead Pictures, Summit Entertainment",False,6.778,en,2010-05-14,105,6.9,1753
475,I'm Here,0,0,Drama,United States of America,,False,3.81,en,2010-03-01,30,7.2,83
476,2012: Supernova,0,0,"Action, Adventure, Science Fiction, Thriller",United States of America,The Asylum,False,3.232,en,2009-10-27,87,3.2,32
477,Rocks,0,0,"Animation, Comedy, Fantasy",Germany,Filmakademie Baden-Württemberg,False,1.664,de,2003-06-05,8,7.3,21
478,Gatica 'El mono',0,0,Drama,Argentina,Choila Producciones Cinematográficas,False,0.886,es,1993-05-13,136,5.0,1
479,The Passion of Darkly Noon,0,0,"Mystery, Drama, Thriller","Germany, United Kingdom, Belgium","hauskunst Filmproduktions, Fugitive Features, Alain Keytsman Production, Fugitive Darkly Noon",False,1.753,en,1995-01-02,99,6.0,28
480,Race Across the Sky: The Leadville Trail 100,250,0,Documentary,United States of America,Citizen Pictures,False,0.764,en,2009-04-15,73,3.0,2
481,Plop in de Stad,0,0,"Adventure, Comedy",Belgium,Studio 100,False,0.84,nl,2006-12-13,65,1.0,1
482,Hornblower: The Duchess and the Devil,0,0,"Action, Adventure, Drama, War, TV Movie",United Kingdom,Meridian Broadcasting Ltd,False,2.551,en,1999-02-24,93,7.1,16
483,The Beat Generation,0,0,Crime,United States of America,"Albert Zugsmith Productions, Metro-Goldwyn-Mayer",False,1.297,en,1959-07-03,95,5.6,4
484,Hornblower: The Frogs and the Lobsters,0,0,"Action, Adventure, Drama, TV Movie",United Kingdom,Meridian Broadcasting Ltd,False,2.668,en,1999-04-02,100,7.2,16
485,Hornblower: Mutiny,0,0,"Adventure, Drama, War, TV Movie",United Kingdom,Meridian Broadcasting Ltd,False,1.267,en,2001-04-07,98,7.5,17
486,God's Little Acre,0,0,"Romance, Drama, Comedy",United States of America,Security Pictures,False,2.132,en,1958-09-23,118,6.2,10
487,Mother and Child,7000000,0,"Drama, Romance","Spain, United States of America","Mockingbird Pictures, Everest Entertainment",False,5.564,en,2009-11-07,125,6.9,66
488,Sounds Like Teen Spirit,0,0,"Documentary, Music",,,False,1.4,en,2008-09-09,100,6.7,3
489,After Stonewall,0,0,Documentary,United States of America,First Run Features,False,1.127,en,1999-06-06,88,7.3,4
490,Pay or Die!,0,0,Crime,United States of America,Allied Artists Pictures,False,0.681,en,1960-07-27,111,6.8,3
491,The Big Night,0,0,"Drama, Thriller",United States of America,Philip A. Waxman Productions Inc.,False,1.962,en,1951-11-13,75,7.5,8
492,Bury Me Dead,0,0,"Mystery, Crime",United States of America,Producers Releasing Corporation (PRC),False,0.6,en,1947-10-18,68,5.0,3
493,A Hatful of Rain,0,0,Drama,United States of America,20th Century Fox,False,1.694,en,1957-07-17,109,6.7,7
494,711 Ocean Drive,0,0,"Drama, Crime",United States of America,"Essaness Productions, Frank Seltzer Productions",False,2.016,en,1950-07-01,102,6.1,14
495,Aileen: Life and Death of a Serial Killer,0,0,Documentary,"United Kingdom, United States of America",Lafayette Films,False,2.807,en,2003-09-09,89,7.1,60
496,The Scoundrel,0,0,Drama,,,False,2.607,en,1935-04-30,76,6.1,5
497,The Burning Times,0,0,Documentary,Canada,National Film Board of Canada,False,0.6,en,1990-01-01,57,8.0,2
498,FAQs,0,0,Drama,,TLA Releasing,False,1.767,en,2005-07-16,90,5.7,6
499,A Jihad for Love,0,0,Documentary,"United Kingdom, United States of America, France, Germany, Australia",,False,1.679,en,2007-09-09,81,5.9,7
500,Red Without Blue,0,0,Documentary,United States of America,Red Without Blue,False,0.815,en,2007-01-19,74,6.2,5
501,Falling Down,25000000,40903593,"Crime, Drama, Thriller",United States of America,"Regency Enterprises, Alcor Films, Warner Bros. Pictures, Canal+",False,9.826,en,1993-02-26,113,7.3,1578
502,Drugstore Girl,0,0,"Romance, Comedy",Japan,"Shochiku Co., Ltd.",False,0.712,ja,2004-02-07,105,5.0,4
503,Boxboarders!,0,0,Comedy,,,False,1.519,en,2007-04-25,90,2.8,3
504,The Last Truck: Closing of a GM Plant,0,0,Documentary,United States of America,,False,0.6,en,2009-09-07,40,6.0,1
505,Sailor Moon R: The Movie,0,0,"Animation, Comedy, Drama, Romance",Japan,"Toei Animation, Pioneer Entertainment",False,2.52,ja,1993-12-05,61,7.4,33
506,"Heaven Knows, Mr. Allison",0,0,"Adventure, Drama, War",United States of America,20th Century Fox,False,3.264,en,1957-03-13,108,6.9,46
507,Jack Dee Live Again,0,0,Comedy,United Kingdom,,False,0.84,en,2005-10-01,104,6.0,3
508,A Kid in King Arthur's Court,0,0,"Adventure, Fantasy, Comedy, Science Fiction, Family",,"Trimark Pictures, Walt Disney Pictures",False,5.28,en,1995-08-11,89,4.5,77
509,The Shouting Men,0,0,Comedy,,,False,1.317,en,2010-03-05,92,6.5,4
510,NightWalker - Eternal Darkness,0,0,"Horror, Mystery, Animation",,"Central Park Media, U.S. Manga Corps",False,0.6,en,2001-06-12,180,0.0,0
511,The Great Locomotive Chase,0,0,"Action, Adventure, Drama, Family",United States of America,Walt Disney Productions,False,1.801,en,1956-06-08,85,5.8,10
512,David Knight: Iron Man of Enduro,0,0,Documentary,,,False,0.667,en,2004-01-01,128,5.3,2
513,We're People Too,0,0,Documentary,,Mack Dawg Productions,False,0.677,en,2007-08-07,,0.0,0
514,Optimistic?,0,0,,Switzerland,Absinthe Films,False,0.6,en,2007-08-07,,0.0,0
515,Pop,0,0,,Switzerland,Absinthe Films,False,0.6,en,2004-01-30,,0.0,0
516,DC MTN LAB,0,0,"Drama, Romance",United States of America,,False,0.6,en,2005-11-29,,0.0,0
517,Jumping With Jussi,0,0,Documentary,,Mack Dawg Productions,False,1.342,en,2006-12-01,,0.0,0
518,Cold World,0,0,,,,False,0.6,en,2007-04-25,,0.0,0
519,Last Stand of the 300,0,0,"Documentary, History, War",United States of America,,False,0.6,en,2007-05-27,90,6.9,4
520,The Sheriff of Fractured Jaw,0,0,"Western, Comedy","United Kingdom, United States of America","Angel Productions, 20th Century Fox",False,1.688,en,1958-10-28,103,6.9,11
521,Will Success Spoil Rock Hunter?,0,0,"Comedy, Drama, Romance",United States of America,20th Century Fox,False,2.847,en,1957-07-29,93,6.5,25
522,Impulse,0,0,"Crime, Drama",United Kingdom,Tempean Films,False,1.113,en,1954-01-01,80,5.4,4
523,Sesame Street: CinderElmo,0,0,Family,,,False,0.745,en,1999-01-01,45,6.0,1
524,Jolly Fellows,0,0,"Music, Comedy",Russia,Moscow kinokombinat,False,1.714,ru,1934-12-09,96,6.5,6
525,Only Old Men Are Going to Battle,0,0,"War, Drama, Comedy",Ukraine,Dovzhenko Film Studios,False,3.478,ru,1973-06-06,92,8.0,45
526,Impulse,0,0,"Horror, Mystery, Thriller",United States of America,Conquerer Films Inc.,False,1.307,en,1974-10-01,82,4.7,5
527,Impulse,0,2544504,"Thriller, Crime",United States of America,Warner Bros. Pictures,False,1.32,en,1990-04-06,109,5.7,9
528,I Am Virgin,100000,0,"Comedy, Horror",United States of America,,False,1.3,en,2010-01-28,94,1.8,8
529,Volga - Volga,0,0,"Comedy, Music",Russia,Mosfilm,False,0.899,ru,1938-04-24,104,6.8,8
530,Street Warrior,0,0,Action,United States of America,,False,1.247,en,2008-11-01,87,4.3,8
531,Tarzan,150000000,448000000,"Adventure, Animation, Drama, Family",United States of America,"Walt Disney Animation Studios, Walt Disney Pictures, Edgar Rice Burroughs Inc.",False,14.076,en,1999-06-18,88,7.4,3728
532,The Naked Gun: From the Files of Police Squad!,12000000,78756177,"Comedy, Crime",United States of America,Paramount,False,11.816,en,1988-12-02,85,7.2,1813
533,The Naked Gun 2½: The Smell of Fear,23000000,86930411,"Comedy, Crime",United States of America,Paramount,False,8.072,en,1991-06-28,85,6.8,996
534,Lilla Spöket Laban: Bullar och Bång,0,0,"Animation, Family",Sweden,"Filmlance International, BOB Film Sweden",False,0.6,en,2009-10-23,44,3.3,2
535,Naked Beneath the Water,0,0,Horror,,,False,0.782,en,2006-06-02,83,5.0,2
536,The Babysitter,0,0,"Drama, Thriller",United States of America,Spelling Films International,False,4.729,en,1995-10-17,90,4.5,54
537,Garbage Dreams,0,0,Documentary,,,False,1.053,en,2009-07-31,79,6.7,3
538,Kiss Daddy Goodnight,0,0,"Drama, Mystery, Thriller",,,False,1.023,en,1987-10-29,90,5.3,5
539,True Crime,0,0,"Crime, Mystery, Thriller",,,False,2.147,en,1996-03-12,94,4.9,18
540,The Catholics,2,2,Drama,"Ireland, United Kingdom, United States of America","Sidney Glazier Productions, Harlech Television (HTV)",False,0.6,en,1973-11-29,78,6.0,3
541,Penn & Teller Get Killed,0,0,"Comedy, Adventure",United States of America,Lorimar Film Entertainment,False,2.559,en,1989-09-22,89,5.5,15
542,Van Halen: Video Hits Vol. 1,0,0,Music,,,False,0.932,en,1996-01-01,65,0.0,0
543,Cocorico: Especial de Natal,0,0,,,,False,0.6,pt,,,5.3,2
544,Cocoricó: Baú do Faz-de-Conta,0,0,"Family, Music",,,False,0.6,pt,2007-01-01,124,0.0,0
545,Bebe Mais: Bichos,0,0,,,,False,0.6,pt,2005-01-01,35,7.8,2
546,Bebe Mais: Musica,0,0,,,,False,0.6,pt,,,0.0,0
547,Bebe Mais: Natureza,0,0,,,,False,0.6,pt,,,7.5,1
548,Caroneiros,0,0,,,,False,0.6,pt,2007-04-27,,0.0,0
549,Cocorico: Aventuras no Campo,0,0,"Drama, Action",,,False,1.098,pt,,,0.0,0
550,Cocorico: Nos Dias Quentes de Verao,0,0,,,,False,0.6,pt,,,0.0,0
551,Cocorico Paiol,0,0,,,,False,0.6,pt,,,2.0,1
552,Vila Sésamo - outro,0,0,,,,False,0.6,pt,,,0.0,0
553,Let the Game Begin,0,0,"Comedy, Romance",United States of America,"Blue Marlin Productions, Twisted Light Productions, Paradox Pictures",False,0.863,en,2010-05-05,111,5.0,3
554,Vila Sesamo - Brincando com Enio e Beto,0,0,,,,False,0.6,pt,,,0.0,0
555,L.A.P.A.,0,0,,Brazil,,False,1.093,pt,2008-08-08,,0.0,0
556,Palavra Cantada - Clipes,0,0,Animation,Brazil,Palvra Cantada,False,0.6,pt,2000-10-26,,0.0,0
557,The Truman Show,60000000,264118201,"Comedy, Drama",United States of America,Paramount,False,16.567,en,1998-06-04,103,8.0,9567
558,White Tuft the Little Beaver,0,0,"Documentary, Family, Adventure",France,,False,1.333,fr,2008-04-30,77,6.8,4
559,The Dog Who Stopped the War,1340000,0,"Adventure, Drama, Comedy, Family",Canada,Les Productions La Fête Inc.,False,2.176,fr,1984-10-03,92,7.2,20
560,The Human Centipede (First Sequence),2011799,0,Horror,"Netherlands, United Kingdom",Six Entertainment,False,12.385,en,2009-04-26,92,4.9,967
561,This Is Otakudom,0,0,Drama,,,False,0.6,en,,,0.0,0
562,Diary of a Teenage Nudist,0,0,Documentary,United Kingdom,,False,1.456,en,2004-12-29,60,0.5,1
563,Athadu,0,27,"Action, Thriller",India,Sri Jayabheri Art Productions,False,1.787,te,2005-08-10,173,6.9,15
564,"Ah, Vaudeville, Vaudeville...",0,0,"Romance, Comedy","Russia, Soviet Union",Mosfilm,False,2.103,ru,1979-01-01,67,6.4,5
565,Carnival,0,0,"Comedy, Drama, Romance",Russia,Gorky Film Studios,False,3.71,ru,1982-02-17,151,7.8,10
566,Say a Word for the Poor Hussar,0,0,"Comedy, Drama, History","Russia, Soviet Union",Mosfilm,False,5.233,ru,1980-01-01,161,7.0,17
567,The Pokrovsky Gates,0,0,"Comedy, Drama, Romance",Russia,Mosfilm,False,5.602,ru,1982-02-02,140,7.4,25
568,The Dog in the Manger,0,0,Comedy,"Russia, Soviet Union",Lenfilm,False,2.701,ru,1977-01-01,138,6.3,9
569,Virtuality,0,0,Science Fiction,"Canada, United States of America","Film 44, NBC Studios, Look Ma! No Hands, Tall Ships Productions, BermanBraun, Universal Pictures",False,4.352,en,2009-06-26,87,5.0,48
570,Sweat,0,0,"Action, Adventure, Thriller",France,Davis-Films,False,1.127,en,2002-07-24,103,5.8,12
571,The Yellow Squadron,0,0,"Action, Drama",Sweden,Terrafilm,False,0.84,sv,1954-11-29,86,5.5,4
572,About Elly,0,0,Drama,"Iran, France",Dreamlab,False,6.065,fa,2009-02-10,119,7.5,195
573,The Human Jungle,0,0,Crime,United States of America,Allied Artists,False,1.4,en,1954-10-03,82,6.2,3
574,The Glass Web,0,0,"Crime, Drama, Thriller",United States of America,Universal International Pictures,False,1.752,en,1953-11-11,81,6.8,7
575,"I, the Jury",0,0,"Mystery, Crime",United States of America,Parklane Pictures Inc.,False,1.255,en,1953-08-14,87,4.5,4
576,Comrades: Almost a Love Story,0,0,"Drama, Romance",Hong Kong,Orange Sky Golden Harvest,False,2.972,cn,1996-11-02,118,7.2,34
577,Antonieta,0,0,"War, Drama","France, Mexico, Spain","Nuevo Cine, Corporación Nacional Cinematográfica (CONACINE), Gaumont International, France 3 Cinéma",False,1.152,fr,1982-10-21,108,5.0,2
578,Four Adventures of Reinette and Mirabelle,0,0,"Comedy, Drama, Romance",France,Compagnie Eric Rohmer,False,2.301,fr,1987-02-04,95,7.4,14
579,Transylmania,0,263941,"Comedy, Horror",United States of America,"Film Rock, Hill & Brand Entertainment",False,2.3,en,2009-12-04,92,4.4,25
580,"I, the Jury",0,0,"Crime, Thriller",United States of America,,False,1.742,en,1982-04-22,111,5.4,8
581,Hue and Cry,0,0,"Crime, Comedy, Adventure",United Kingdom,Ealing Studios,False,1.681,en,1947-02-01,82,6.3,18
582,Penny and the Pownall Case,0,0,"Drama, Mystery",United Kingdom,"Production Facilities, Highbury Productions",False,0.634,en,1948-06-26,47,5.7,1
583,The Long Wait,0,0,"Crime, Drama",United States of America,Parklane Pictures Inc.,False,1.829,en,1954-05-26,94,5.0,5
584,The Daisy Chain,0,0,"Horror, Thriller","United Kingdom, Ireland",ContentFilm International,False,3.27,en,2008-11-09,89,5.5,38
585,Konrad Zuse,0,0,,Switzerland,,False,0.6,en,,73,0.0,0
586,Inferno,1055000,0,"Romance, Thriller, Crime, Drama",United States of America,20th Century Fox,False,2.319,en,1953-08-12,83,5.8,12
587,Gordon B. Hinckley: A Giant Among Men,0,0,"History, Drama, Family",United States of America,,False,0.684,en,2015-11-25,53,0.0,0
588,Toby Tyler,0,0,"Drama, Family",United States of America,Walt Disney Productions,False,1.607,en,1960-01-01,95,6.1,12
589,Lewis Black:  Black on Broadway,0,0,Comedy,United States of America,,False,2.197,en,2004-05-14,58,6.3,18
590,Tokyo Friends: The Movie,0,0,"Comedy, Drama, Music, Romance",Japan,"Kodansha, Fuji Television Network",False,0.913,ja,2006-08-12,116,8.0,1
591,No Sleep 'til Madison,0,0,Comedy,,,False,0.805,en,2002-04-04,85,0.0,0
592,Piet Piraat en het Schotse Spook,0,0,Family,,Studio 100,False,0.706,nl,2009-10-07,,2.7,3
593,Plop en de Kabouterbaby,0,0,"Comedy, Adventure, Family",Belgium,Studio 100,False,0.742,nl,2009-12-16,,3.0,2
594,Attack of the Super Monsters,0,0,Animation,,,False,0.84,en,1983-01-01,83,6.3,2
595,Eyes Wide Open,0,0,"Romance, Drama","France, Germany, Israel","Israel Fund for Film Production, Pimpa Film Productions, Riva Filmproduktion, Totally, ARTE, Yes, Keshet Broadcasting, The Ministry of Education, Culture and Sports, Israel Film Council, Das Kleine Fernsehspiel",False,2.217,he,2009-05-20,90,6.1,35
596,Old Testament Video Presentations,0,0,,,,False,0.622,en,2006-01-01,67,10.0,1
597,Peter Kay: Live at the Manchester Arena,0,0,Comedy,,,False,1.885,en,2005-11-15,47,5.8,8
598,Shadow,0,0,"Horror, Thriller",Italy,Blu Cinematografica,False,2.222,en,2010-05-14,77,5.4,39
599,Sasirekha Parinayam,0,0,,,,False,0.986,te,2009-01-01,152,5.0,2
600,Dark Island,0,0,"Action, Science Fiction, Thriller",Canada,"E&E Films, Epic Productions",False,2.475,en,2010-05-22,87,3.8,13
601,Oh My God!,0,0,"Music, Comedy",Brazil,"Globo Filmes, Dueto Filmes",False,5.842,pt,2007-03-30,96,6.9,102
602,The Allnighter,0,0,"Comedy, Romance",,,False,1.609,en,1987-05-01,108,3.6,5
603,Reel Big Fish - You're All in this Together,0,0,Music,,"Music Inc Studios, CDBABY, Rykodisc, The Vault",False,1.4,en,2006-08-22,85,4.8,2
604,Death in Brunswick,0,0,Drama,Australia,"Meridian Films, Film Victoria, Australian Film Finance Corporation",False,1.874,en,1990-11-08,109,6.6,8
605,Killers,75000000,98159963,"Action, Comedy, Thriller, Romance",United States of America,"Katalyst Films, Lionsgate, Aversano Films",False,8.385,en,2010-06-04,100,5.8,1349
606,Badmaash Company,1900000,5100000,"Comedy, Crime, Drama",India,Yash Raj Films,False,3.435,hi,2010-05-07,144,5.6,30
607,Gilbert Gottfried: Dirty Jokes,0,0,Comedy,United States of America,Flycollar Films,False,1.113,en,2005-12-06,50,8.6,5
608,De Punt,810000,0,"Documentary, Drama",,,False,0.6,en,2009-05-03,81,0.0,0
609,Bruce Springsteen and the E Street Band: Live in New York City,0,0,"Documentary, Music",United States of America,,False,1.913,en,2000-06-29,180,8.1,9
610,My Ex,0,0,Horror,Thailand,,False,1.156,th,2009-08-26,90,5.2,6
611,Armadillo,1500000,0,"Documentary, War",Denmark,Fridthjof Film,False,2.894,da,2010-05-27,105,7.2,62
612,Mammuth,0,0,Comedy,France,GMT Productions,False,4.422,fr,2010-04-21,92,6.0,70
613,Tell Your Children,100000,0,"Drama, Thriller",United States of America,George A. Hirliman Productions,False,2.752,en,1936-01-15,66,4.2,52
614,Knight and Day,117000000,261930431,"Action, Comedy",United States of America,"Pink Machine, Tree Line Films, Dune Entertainment, Regency Enterprises, 20th Century Fox",False,11.961,en,2010-06-15,109,6.0,2548
615,The Exterminator,0,0,"Action, Thriller, Crime, Drama",United States of America,"AVCO Embassy Pictures, Interstar",False,2.539,en,1980-09-10,101,5.7,49
616,Judgement,0,0,Drama,South Korea,Studio Box,False,1.867,ko,1999-09-09,26,5.8,11
617,The Wonder Years,0,0,,South Korea,Soo Film,False,0.647,ko,2007-07-26,95,0.0,0
618,Desert Dream,0,0,Drama,"South Korea, France","G21M, Arizona Films, Centre National de la Cinématographie, Korean Film Council",False,1.139,mn,2007-10-20,123,5.0,1
619,Bunker Palace Hotel,0,0,Science Fiction,France,"France 3 Cinéma, AFC, Charles Gassot",False,1.972,fr,1989-01-01,95,6.7,22
620,Love Me Not,0,0,Drama,South Korea,,False,2.736,ko,2006-11-09,119,6.8,14
621,Mr. Tadano's Secret Mission: From Japan With Love,0,0,,Japan,,False,0.6,ja,2008-12-06,116,0.0,0
622,Wild Grass,0,0,"Drama, Romance","France, Italy","F Comme Film, France 2 Cinéma, BIM Distribuzione, TPS Star, Eurimages, Cinémage 3, Centre National de la Cinématographie, Région Ile-de-France, Canal+, StudioCanal",False,1.925,fr,2009-05-20,104,5.8,33
623,Blood Beach,2000000,0,"Science Fiction, Horror, Comedy",United States of America,"Empress Film Production Corporation, Compass International Pictures",False,3.391,en,1980-09-01,92,4.7,29
624,Call For Love,0,0,Comedy,China,,False,2.045,zh,2007-02-08,95,5.4,5
625,French Roast,0,0,Animation,France,The Pumpkin Factory,False,3.272,en,2008-09-30,8,6.7,27
626,Vorvik,0,0,"Action, Adventure, Horror, Science Fiction",,,False,0.766,es,2005-08-12,100,5.0,2
627,Oollala Sisters,0,0,Drama,South Korea,,False,0.6,ko,2002-04-26,110,4.0,2
628,The Treasure Hunter,0,0,"Action, Adventure, Fantasy, Science Fiction",Taiwan,,False,3.367,zh,2009-12-09,105,3.5,13
629,The Robbers,0,0,"Drama, Action, Thriller",China,,False,3.6,zh,2009-11-20,93,5.8,10
630,Rebellion,0,0,"Thriller, Action, Crime",Hong Kong,,False,4.95,cn,2009-10-08,100,6.1,10
631,Hooked on the Game 2. The Next Level,3500000,2294357,"Action, Science Fiction",Russia,,False,3.545,ru,2010-04-15,,5.3,22
632,Princess Chang-Ping,0,0,"Drama, Romance",Hong Kong,"Orange Sky Golden Harvest, Golden Phoenix",False,0.676,cn,1976-01-30,102,0.0,0
633,Mister Roberts,0,0,"Comedy, Drama, Family, War",United States of America,Warner Bros. Pictures,False,4.091,en,1955-07-13,123,7.2,60
634,Life on Earth,0,0,"Comedy, Drama","Mali, France, Mauritania","PROCIREP, Haut et Court, La Sept-Arte, Centre National de la Cinématographie",False,0.885,fr,1998-07-01,61,5.3,6
635,Don's Plum,0,6297,"Drama, Comedy","Denmark, Sweden, United States of America",,False,3.27,en,2001-02-10,89,5.9,34
636,Bandaged,0,0,"Action, Drama, Thriller",Germany,"Jürgen Brüning Filmproduktion, Productions Bleu Blanc Rouge",False,0.818,en,2009-04-03,92,5.0,5
637,MXP: Most Xtreme Primate,0,0,Comedy,,,False,1.088,en,2004-01-20,87,5.3,7
638,D.C. Sniper,0,0,"Action, Crime, Thriller",,Hollywood House of Horror,False,1.108,en,2010-01-01,92,2.1,5
639,Valhalla Rising,5641880,30638,"Adventure, Drama, Action, Fantasy","Denmark, United Kingdom","BBC Films, La Belle Allee Productions, NWR Film Productions, One Eye Production, Savalas Audio Post-Production, Nimbus Film",False,7.549,en,2009-09-04,93,6.0,592
