,title,budget,revenue,genres,production_countries,production_companies,adult,popularity,original_language,release_date,runtime,vote_average,vote_count
0,Los Caraduros,0,0,Comedy,Spain,"X Y Z DESARROLLOS, S.A.",False,1.123,es,1983-10-20,85,6.0,1
1,Queens of Country,0,0,,,,False,1.1,en,2012-03-31,,0.0,0
2,Sewer,0,0,Drama,Philippines,"Salida Productions, Cinema One Originals",False,0.84,tl,2008-10-20,212,7.3,3
3,Sons of Ingmar,0,0,Drama,Sweden,Svenska Biografteatern AB,False,0.6,sv,1919-01-01,207,0.0,0
4,James Benning: Circling the Image,0,0,,Germany,,False,1.128,en,2003-11-30,84,0.0,0
5,A Promise to the Dead: The Exile Journey of Ariel Dorfman,0,0,Documentary,Canada,White Pine Pictures,False,0.874,en,2007-09-08,91,0.0,0
6,The Brick and the Mirror,0,0,Drama,Iran,Studio Golestan,False,0.6,fa,1965-11-30,131,8.5,4
7,Landscape After Battle,0,0,"Romance, Drama, History",Poland,"Polish Corporation for Film Production, Film Polski",False,1.854,pl,1970-09-08,109,5.2,5
8,Lost Song,0,0,Drama,Canada,,False,0.719,en,2008-09-06,102,6.0,2
9,At River's Edge,0,0,"Drama, History",Japan,,False,0.6,ja,2011-08-02,104,7.0,1
10,"Lemmings, Part 1 – Arcades",0,0,,"Germany, Austria","Österreichischer Rundfunk, Schönbrunn-Film, Sender Freies Berlin",False,0.879,de,1979-05-02,113,5.0,1
11,"Lemmings, Part 2 – Injuries",0,0,,"Germany, Austria","Österreichischer Rundfunk, Schönbrunn-Film, Sender Freies Berlin",False,1.123,de,1979-05-03,107,5.0,1
12,Les Hautes Solitudes,0,0,Documentary,France,,False,1.598,fr,1974-12-15,83,7.4,10
13,Mourning for Anna,0,0,Drama,Canada,"Coop Vidéo de Montréal, ACPAV",False,0.605,en,2010-08-13,,7.0,1
14,Dead Inside,0,0,Horror,United States of America,"DMN Films, Compound B, Teo Ward Productions",False,2.159,en,2011-11-10,79,3.8,8
15,Berta's Motives,0,0,Drama,Spain,P.C. Guerín,False,1.231,es,1984-09-01,115,6.7,3
16,Melody for a Street Organ,0,0,Drama,Ukraine,Sota Cinema Group,False,0.718,ru,2009-06-21,153,5.4,5
17,A Place in the World,0,0,Drama,Russia,,False,1.632,ru,2001-06-12,126,4.5,8
18,"Harvest: 3,000 Years",0,0,Drama,Ethiopia,Haile Gerima,False,0.7,am,1976-04-06,150,7.3,3
19,Mix-Up,0,0,Documentary,France,France 2 (FR2),False,1.176,fr,1986-09-12,62,7.5,4
20,A Lover in Pawn,0,0,Drama,Sweden,Svensk Filmindustri,False,0.988,sv,1920-10-11,116,6.7,3
21,Invitation to a Suicide,0,0,,,,False,0.6,en,2004-11-09,85,0.0,0
22,Playboy: Cyber Girls,0,0,,,,False,0.6,en,2002-01-01,56,0.0,0
23,Soy Charro de Levita,0,0,,,,False,0.6,en,1949-06-16,110,7.5,2
24,Mudflow,0,0,,,,False,0.6,en,2003-01-01,,0.0,0
25,Supernatural,0,0,,,,False,1.264,en,1996-10-19,100,5.0,7
26,A Necklace for My Beloved,0,0,"Romance, Drama","Georgia, Soviet Union",Georgian-Film,False,0.6,ka,1971-09-09,75,4.5,2
27,A Nest of Gentry,0,0,Romance,"Russia, Soviet Union",Mosfilm,False,2.169,ru,1969-01-01,111,5.7,3
28,Let Fury Have the Hour,0,0,,,,False,0.6,en,2012-12-14,100,0.0,0
29,Taste of Vengeance,0,0,Western,"Spain, Italy","Copercines, Cooperativa Cinematográfica, Metheus Film",False,0.893,it,1968-04-02,119,0.0,0
30,Las Aventuras de Pito Pérez,0,0,,,,False,1.491,es,1957-02-23,94,5.0,1
31,Ms. Scrooge,0,0,"Drama, Fantasy, TV Movie",United States of America,"Power Pictures, Wilshire Court Productions, USA Network",False,1.274,en,1997-12-10,87,4.0,4
32,Tormento,0,0,Drama,Italy,"Titanus, Labor Film",False,1.351,it,1950-02-11,87,7.0,4
33,Kvaska,0,0,"Comedy, Music",Czech Republic,,False,0.715,cs,2007-02-22,106,6.5,2
34,The Pink Phink,0,0,"Animation, Comedy, Family",United States of America,DePatie-Freleng Enterprises (DFE),False,1.734,en,1964-12-18,7,6.9,19
35,The Third Wish,0,0,,,,False,0.625,zh,2012-03-23,94,6.0,1
36,Po hlavě do prdele,0,0,Comedy,Czech Republic,"Marcel Bystroň - Film, Motion Pictures Agency, Jan Juřica - Jukon, Studio Virtual, i/o post, Cyberdyne Technologies",False,0.965,cs,2006-11-23,,5.5,2
37,Once Upon a Time,0,0,"Animation, Family, Fantasy","Germany, Italy","Rolf Kauka Film, Gamma Film",False,0.798,de,1973-12-12,78,4.4,4
38,Matusalem II: le dernier des Beauchesne,0,0,"Adventure, Family, Fantasy",Canada,,False,1.521,fr,1997-12-05,98,4.0,2
39,The Hook of Woodland Heights,0,0,,,,False,0.664,en,1990-01-01,40,0.0,0
40,Hookers in a Haunted House,0,0,"Horror, Comedy",,,False,0.841,en,1999-01-01,86,0.0,0
41,UFO Files: Hangar 18: The UFO Warehouse,0,0,,,A+E Studios,False,0.6,en,2008-07-17,50,0.0,0
42,François Damiens - Tour de France,0,0,Comedy,Belgium,RTL-TVi,False,1.269,fr,2007-01-30,,6.5,3
43,"What Have We Learned, Charlie Brown?",0,0,Animation,United States of America,,False,1.981,en,1983-05-30,23,5.7,6
44,The Princess and the Pea,0,0,"Romance, Family, Fantasy",Russia,Gorky Film Studios,False,1.069,ru,1976-11-01,89,7.0,4
45,"Robinsonade, or My English Grandfather",0,0,Comedy,"Georgia, Soviet Union",Georgian-Film,False,0.943,ka,1987-09-27,76,6.0,3
46,Stardust Stricken - Mohsen Makhmalbaf: A Portrait,0,0,Documentary,,,False,0.84,en,1996-10-19,70,0.0,0
47,Ruslan and Ludmila,0,0,"Adventure, Family, Fantasy","Russia, Soviet Union",Mosfilm,False,1.367,ru,1972-10-12,150,6.5,4
48,The Fairy of Solbakken,0,0,Drama,"Norway, Sweden",,False,0.6,sv,1919-10-20,111,0.0,0
49,Sea Cadet of Northern Fleet,0,0,"War, Drama",Soviet Union,Киностудия им. М.Горького,False,0.6,en,1974-01-01,,6.5,2
50,whisper & SHOUT,0,0,"Documentary, Music",East Germany,DEFA,False,0.694,de,1989-02-15,120,7.7,3
51,Buddha Bless America,0,0,,Taiwan,,False,0.6,zh,1996-07-20,118,5.0,1
52,Savage Hunt of King Stakh,0,0,"Thriller, Drama, Horror, Mystery","Belarus, Soviet Union","Belarusfilm, Satra, Sovexportfilm",False,0.851,ru,1979-12-02,105,7.0,3
53,The Hijacking of 'Savoy',0,0,"Adventure, Family","Bulgaria, Poland, Russia, Soviet Union","Boyana Film, Gorky Film Studios",False,1.287,ru,1979-01-01,92,4.3,4
54,Jonathan Lambert n'est pas couché,0,0,Comedy,,,False,0.701,fr,2008-12-09,,8.0,1
55,Chris,0,0,,Switzerland,,False,0.6,de,2007-06-11,87,0.0,0
56,Der Frankfurter Auschwitz-Prozess,0,0,,Germany,,False,0.6,de,,,0.0,0
57,Enid Is Sleeping,0,0,"Comedy, Crime",United States of America,"Vestron Pictures, Davis Entertainment",False,1.27,en,1991-05-17,105,3.5,2
58,Gloriously Wasted,0,0,,,,False,2.118,fi,2012-12-28,85,5.2,5
59,Baby on Board,0,0,,,,False,1.525,en,1992-12-28,90,3.3,3
60,The Point of Least Resistance,0,0,Drama,Switzerland,T&C Film AG,False,0.84,de,1981-01-01,30,0.0,0
61,Pactar amb el gat,0,0,,Spain,,False,0.754,ca,2007-09-07,,4.0,1
62,"Concepción Arenal, la visitadora de cárceles",0,0,,,,False,2.116,en,2012-01-01,80,8.8,5
63,Usted puede ser un asesino,0,0,"Comedy, Crime, Mystery",Spain,As Films Producción,False,0.6,es,1961-05-20,96,7.0,1
64,Where the Truth Lies,0,0,Thriller,United States of America,,False,0.967,es,1999-09-13,91,10.0,1
65,Manila Skies,0,0,Drama,"Philippines, United States of America","Ignite Media, PelikulaRed",False,0.631,en,2009-10-19,,0.0,0
66,Hush,0,0,Thriller,,,False,0.6,fi,2012-07-13,,6.5,1
67,Ninja Silent Assassin,0,0,,Hong Kong,IFD Films & Arts Company,False,0.6,en,1987-08-02,90,5.3,3
68,The Wind Rises,30000000,117932401,Animation,Japan,"Touchstone Pictures, Toho Company, Ltd., Studio Ghibli, Hakuhodo DY Media Partners, KDDI Corporation, Nippon Television Network (NTV), Mitsubishi Motors Corporation",False,12.935,ja,2013-07-20,126,7.8,1318
69,The Tale of the Princess Kaguya,49300000,24186232,"Animation, Drama, Fantasy",Japan,"Studio Ghibli, Hakuhodo DY Media Partners, KDDI Corporation, Mitsubishi Shoji, Gkids",False,7.63,ja,2013-11-23,137,8.1,682
70,Addicted to Acting,0,0,,Germany,,False,0.6,de,2004-07-03,,7.0,3
71,Jim,0,0,Science Fiction,United States of America,,False,0.6,en,2010-10-08,101,0.0,0
72,New Hope,0,0,Drama,United States of America,R-Squared Productions,False,0.715,en,2012-02-10,124,5.0,4
73,Gloria Estefan: The Evolution Tour Live In Miami,0,0,Music,,,False,1.091,en,1996-07-14,116,0.0,0
74,Yoga Is: A Transformational Journey,0,0,,United States of America,,False,0.6,en,2012-10-25,64,0.0,0
75,Eugene Mirman: An Evening of Comedy in a Fake Underground Laboratory,0,0,Comedy,United States of America,,False,1.132,en,2012-12-21,60,7.0,1
76,Sade: Live in Munich,0,0,,,,False,0.6,en,,48,0.0,0
77,The Scam,0,0,,,,False,0.6,ru,2001-01-01,,1.0,1
78,The School Waltz,0,0,"Family, Romance, Drama",Russia,Gorky Film Studios,False,0.71,ru,1977-06-26,96,6.0,4
79,Two Lives,0,0,"Drama, Thriller","Germany, Norway","Helgeland Film, Zinnober Film- und Fernsehproduktion, B&T Film",False,2.111,de,2012-10-19,97,6.4,30
80,The Secret of the Iron Door,0,0,"Adventure, Family, Fantasy","Russia, Soviet Union",Gorky Film Studios,False,1.542,ru,1970-01-01,69,7.1,7
81,The Red Ball Express,0,0,"War, Drama",,Universal International Pictures,False,2.134,en,1952-05-24,83,6.0,1
82,Superstition,0,0,"Horror, Thriller","Luxembourg, Netherlands, United Kingdom","Movie Masters, Delux Productions, Woodline Productions, Innocap",False,1.785,en,2001-10-13,,4.5,4
83,The Deserter and the Nomads,0,0,Drama,"Czechoslovakia, Italy","Ultra Film, Slovenská filmová tvorba Koliba (SFT)",False,2.665,sk,1968-12-06,103,6.8,4
84,"The Tyrant's Heart, or Boccaccio in Hungary",0,0,Drama,Hungary,Mafilm Audio Kft.,False,0.84,hu,1981-10-26,96,0.0,0
85,Frodo Is Great... Who Is That?!!,0,0,Documentary,New Zealand,Midnight Film Productions Limited,False,1.181,en,2004-07-23,60,6.0,1
86,"Amy Winehouse: T In The Park, V Festival and Bestival",0,0,,,,False,0.6,en,,,0.0,0
87,Talking to Strangers,0,0,Drama,United States of America,,False,0.966,en,1988-09-14,90,7.7,3
88,Bryan Adams: So Far So Good,0,0,,,,False,0.6,en,2002-04-01,,0.0,0
89,Augsburger Puppenkiste - Der Räuber Hotzenplotz,0,0,Family,Germany,Augsburger Puppenkiste,False,0.665,de,1967-08-24,,0.0,0
90,Super Buddies,0,0,"Family, Comedy",United States of America,Key Pix Productions,False,5.804,en,2013-08-07,81,5.5,56
91,Titanic at 100: Mystery Solved,0,0,,,,False,0.67,en,2012-04-15,86,8.0,2
92,Augsburger Puppenkiste - Der Wolf und die sieben Geißlein & Frau Holle,0,0,,Germany,Augsburger Puppenkiste,False,0.841,de,1967-01-01,,0.0,0
93,At The Tattooist,0,0,,Australia,,False,0.908,en,2010-05-30,9,6.0,1
94,Sambesi - Der donnernde Fluss,0,0,Documentary,"Mozambique, Zambia","ORF Universum, WDR/Arte, National Geographic",False,0.964,de,2010-11-25,,0.0,0
95,12-12-12 The Concert for Sandy Relief,0,0,Music,United States of America,,False,1.366,en,2012-12-12,96,7.7,5
96,Champions,0,0,Drama,United States of America,Embassy Films Associates,False,1.444,en,1984-04-20,106,6.8,5
97,The Naked Trees,0,0,"Drama, Romance",Denmark,"Hemdale U.K., Norsk Film, Lise Lense-Møller Film, ESICMA, Studio Tor, Film Effekt",False,1.123,da,1991-12-25,100,6.0,1
98,Ultim8 Separation,0,0,,,,False,0.6,en,2012-01-01,26,0.0,0
99,The Invisible Army,0,0,"Drama, War",Denmark,Palladium Productions,False,0.84,da,1945-10-04,83,7.0,1
100,When Pigs Fly,0,0,Comedy,"Netherlands, Germany, United States of America","Sultan Driver Films Inc., Allarts, Capitol Films, Pandora Film",False,0.663,en,1993-09-12,97,5.0,1
101,Waiting for Sancho,0,0,,,,False,1.4,en,2008-10-06,105,5.0,1
102,Second Class Citizens,0,0,"Drama, Romance, Comedy",,Ukrainian Ministry of Arts & Culture,False,0.6,ru,2001-02-17,105,3.0,2
103,Three Stories,0,0,,Russia,,False,2.309,ru,1997-03-13,109,6.6,7
104,Turumba,0,0,"Adventure, Comedy, Documentary",Philippines,Kidlat Kulog Productions,False,0.6,tl,1981-04-08,95,5.0,1
105,Vildanden,0,0,Drama,Sweden,SVT Drama,False,0.6,sv,1989-09-03,165,0.0,0
106,Double Tide,0,0,,United States of America,,False,0.904,en,2009-10-21,99,9.0,2
107,Song of the Scarlet Flower,0,0,"Drama, Romance",Sweden,Svenska Biografteatern AB,False,0.786,sv,1919-04-14,100,6.3,3
108,Two in One,0,0,,,,False,0.6,ru,2007-11-27,124,1.0,1
109,Nina Simone: The Legend,0,0,"Music, Documentary","United Kingdom, France","BBC, La Sept, System TV",False,0.698,en,1992-06-13,54,5.0,1
110,The Computer Revolution: The Birth of the Most Powerful and Fastest Brains,0,0,"Animation, Science Fiction",Japan,Production I.G,False,0.711,ja,2012-06-06,,3.0,3
111,The Pearl,0,0,Fantasy,Belgium,ARC,False,2.268,fr,1929-06-06,33,7.2,7
112,Three Godfathers,0,0,Western,United States of America,Metro-Goldwyn-Mayer,False,1.611,en,1936-03-06,81,7.0,2
113,Jungle Man-Eaters,0,0,Adventure,United States of America,Katzman Corporation,False,0.882,en,1954-06-01,68,3.0,1
114,Guitar Nights – The Four Martins,0,0,Music,,,False,0.652,it,2003-09-08,,3.8,2
115,"Giovanni Falcone, l'uomo che sfidò Cosa Nostra",0,0,,,,False,0.84,it,2006-05-04,,6.5,10
116,The Sentimental Swordsman,0,0,"Action, Adventure, Drama",Hong Kong,Shaw Brothers,False,1.912,zh,1977-10-14,101,6.0,4
117,Fatal Error,0,0,"Western, Drama",Germany,DEFA,False,0.624,de,1970-07-03,103,5.0,1
118,El Chanfle 2,0,0,"Family, Comedy",Mexico,Televicine S.A. de C.V.,False,0.736,es,1982-11-20,,8.0,4
119,El día de los albañiles: Los maistros del amor,0,0,Comedy,Mexico,Frontera Films,False,0.84,en,1982-01-13,,6.2,5
120,King Crimson - Larks' Tongues In Aspic  The Complete Recordings,0,0,,,,False,0.9,es,2012-12-13,,0.0,0
121,Luke's Movie Muddle,0,0,,United States of America,Rolin Films,False,1.335,en,1916-12-03,11,4.7,6
122,The President,0,0,,,,False,0.6,da,1919-02-01,75,5.0,3
123,Branford Marsalis: A Love Supreme Live In Amsterdam,0,0,,,,False,0.6,en,2003-04-11,49,0.0,0
124,"Carmen, Jr.",0,0,Comedy,,Century Films,False,0.625,en,1923-08-29,13,7.0,1
125,Good Evening Ev'rybody: In Celebration of Louis Armstrong,0,0,,,,False,0.667,en,2008-06-01,,0.0,0
126,Long Jeanne Silver,0,0,,,,True,0.93,en,1977-04-22,62,4.7,3
127,Banjo on My Knee,0,0,"Comedy, Romance",United States of America,20th Century Fox,False,2.231,en,1936-12-11,95,6.5,4
128,Passion Potion,0,0,,,,False,0.699,en,1971-01-01,96,3.0,1
129,Die Rückkehr der Zeitmaschine,0,0,"Drama, Science Fiction",Germany,,False,0.87,de,1984-09-22,,5.5,1
130,MicroPlanet 3D,0,0,Documentary,United States of America,3DigitalVision,False,0.6,en,2012-10-01,41,0.0,0
131,Operation Mata Hari,0,0,,,,False,0.6,es,1968-05-15,,0.0,0
132,Star in the Night,0,0,"Drama, Family",United States of America,"The Vitaphone Corporation, Warner Bros. Pictures",False,1.679,en,1945-10-13,22,7.6,8
133,The Wedding March,0,0,Comedy,"France, Italy","Transinter Films, Sancro Film",False,0.6,it,1965-04-25,83,7.5,4
134,If I Were Free,0,0,"Romance, Drama",United States of America,RKO Radio Pictures,False,0.901,en,1933-12-01,66,6.5,2
135,Blind Boys Of Alabama  Go Tell It On The Mountain - Live In New York,0,0,,,,False,0.804,it,,,0.0,0
136,2005 Academy Award Nominated Short Films,0,0,,,,False,0.6,en,2015-01-01,162,5.0,1
137,Trío de damas,0,0,,,,False,0.665,es,1960-01-01,,0.0,0
138,The Pogues in Paris - 30th Anniversary Concert,0,0,Music,,,False,0.6,en,2012-11-19,100,9.0,1
139,Scent of a Crime,0,0,Drama,,,False,1.456,es,1988-10-21,,0.0,0
140,Push Pull Point Pow,0,0,,,,False,0.6,en,2012-11-23,80,0.0,0
141,H-Bomb,0,0,Action,Thailand,Bangkok Film,False,0.6,en,1971-01-08,98,0.0,0
142,All Saints Day,0,0,,United States of America,,False,0.805,en,2000-10-18,82,0.0,0
143,Miguel Hernández: viento del pueblo,0,0,"Drama, TV Movie, History",Spain,"Antea Films, Lotus Films Internacional S.A., Generalitat Valenciana",False,1.4,es,2002-02-28,180,0.0,0
144,When Angels Fall,0,0,Fantasy,Poland,,False,2.248,pl,1959-12-31,21,6.3,16
145,Celestial Navigations,0,0,Animation,,,False,0.664,en,1984-04-28,15,0.0,0
146,"Lola, espejo oscuro",0,0,Drama,,,False,0.699,es,1966-04-23,,0.0,0
147,Bireli Lagrene Gipsy Project  Live In Paris,0,0,,,,False,0.6,it,,,0.0,0
148,As Aventuras de Sérgio Mallandro,0,0,"Comedy, Family",Brazil,Ercamp Filmes,False,1.19,pt,1985-11-24,82,3.4,5
149,Baby's First Christmas,0,0,,,,False,1.118,en,2012-11-29,90,5.3,3
150,Everything Is Terrible! Holiday Special,0,0,,,,False,0.955,en,2012-12-07,,9.5,1
151,Juarez: The City Where Women Are Disposable,0,0,,Mexico,,False,0.6,it,2007-01-01,,0.0,0
152,When the Lights Go Out,0,0,Drama,United States of America,Swirl Films,False,0.854,en,2010-03-23,,0.0,0
153,How to Kill Your Boss,0,0,,,,False,0.6,fr,,,0.0,0
154,The Forgotten Village,0,0,,,,False,0.621,en,1941-02-07,67,5.0,1
155,The Third Bank of the River,0,0,"Fantasy, Drama","Brazil, France",Regina Filmes,False,0.997,pt,1993-08-20,99,5.0,1
156,Finding Mrs. Claus,0,0,"Comedy, Romance",Canada,"Foxfield Entertainment, Pitchblack Pictures Inc.",False,1.641,en,2012-12-02,89,5.9,22
157,Elton John: Dream Ticket,0,0,Music,,Universal island records Ltd,False,1.092,en,2004-11-08,420,0.0,0
158,Menino do Rio,0,0,"Drama, Adventure",Brazil,,False,1.15,pt,1982-12-05,,7.0,1
159,Merry In-Laws,0,0,"Comedy, Fantasy",Canada,"Johnson Production Group, Nomadic Pictures",False,1.556,en,2012-12-08,83,7.3,3
160,Goodbye & Amen,0,0,Thriller,Italy,"Capital Film s.p.a., Cineriz",False,1.4,it,1978-02-08,103,8.5,2
161,For 80 Days,0,0,Drama,Spain,"Irusoin, Moriarti Prudkzioak",False,1.597,eu,2010-05-21,104,6.4,5
162,Garota Dourada,0,0,"Drama, Adventure",,,False,1.428,pt,1984-06-06,,3.7,3
163,La mujer del eternauta,0,0,,Spain,,False,0.6,en,2011-01-01,82,5.0,1
164,Romeo e Giulietta,0,0,,"Italy, Spain",,False,1.341,es,1964-08-28,,0.0,0
165,The Real St. Nick,0,0,"Comedy, Romance, TV Movie",,,False,2.468,en,2012-12-15,85,6.0,13
166,A Christmas Wedding Date,0,0,"Comedy, Romance",United States of America,Hybrid,False,1.764,en,2012-12-02,82,4.8,21
167,"Killerjagd. Töte mich, wenn du kannst",0,0,"Crime, Thriller",Germany,,False,0.6,de,2009-09-21,,7.0,1
168,Judge Roy Bean,0,0,Western,"France, Italy","Milvia Cinematografica, Comacico",False,0.874,it,1971-03-03,91,0.0,0
169,His Name was King,0,0,Western,Italy,Foro Film,False,2.447,it,1971-05-18,96,5.8,5
170,The Flower on the Stone,0,0,Drama,"Russia, Soviet Union",Dovzhenko Film Studios,False,0.7,ru,1962-12-11,71,5.0,1
171,Black Sheep,0,0,"Drama, War",Russia,Film.UA,False,0.6,ru,2010-07-01,110,5.8,4
172,Cinderella,95000000,543514353,"Romance, Fantasy, Family, Drama","United Kingdom, United States of America","Walt Disney Pictures, Genre Films, Beagle Pug Films, Allison Shearmur Productions",False,22.391,en,2015-03-12,105,6.7,4619
173,My Name Is Texas Bill,0,0,Western,,,False,0.626,it,1972-05-27,87,0.0,0
174,My Name Is Mallory... M Means Death,0,0,"Action, Romance, Western",,,False,0.6,it,1971-12-17,90,3.0,2
175,The Boldest Job in the West,0,0,Western,,,False,0.941,es,1972-03-06,,6.0,1
176,Gunman of One Hundred Crosses,0,0,Western,,"Virginia Cinematografica, Kamar Film",False,0.6,it,1971-07-03,95,4.3,3
177,"Mario Barth: Stadion Tour 2011: Männer sind peinlich, Frauen manchmal auch!",0,0,Comedy,,,False,1.4,de,2011-09-09,,10.0,1
178,Orphans of Apollo,0,0,,,,False,0.6,en,2008-01-01,52,0.0,0
179,Four Gunmen of the Holy Trinity,0,0,Western,,,False,0.6,it,1971-05-29,107,0.0,0
180,Fuses,0,0,,United States of America,,False,1.639,en,1967-12-31,22,5.4,8
181,Terrible Day of the Big Gundown,0,0,Western,,,False,0.6,it,1971-06-26,94,0.0,0
182,The Christmas Consultant,0,0,Comedy,Canada,"Noel Productions Inc., Reel One Entertainment, 224 Entertainment, Super Écran, Movie Central, Province of British Columbia Film Incentive BC, Canadian Film or Video Production Tax Credit Fund (CPTC), The Movie Network",False,1.4,en,2012-01-01,,6.4,6
183,Paid in Blood,0,0,Western,Italy,Constitution Films,False,0.84,it,1971-11-14,91,5.0,1
184,Fake Fruit Factory,0,0,Documentary,United States of America,,False,1.665,en,1986-12-31,22,5.4,5
185,They Gave Him a Gun,0,0,"War, Crime, Drama",United States of America,Metro-Goldwyn-Mayer,False,1.422,en,1937-05-07,94,8.0,1
186,The Fantastic Adventures of the Ugly Duckling,0,0,Animation,,,False,1.091,en,2000-01-01,72,0.0,0
187,The Sheriff of Rock Spring,0,0,Western,,,False,0.679,it,1971-12-17,86,0.0,0
188,En ganske almindelig pige,0,0,Comedy,Denmark,ASA,False,0.662,da,1940-12-25,,7.0,1
189,Joe Dakota,0,0,,,,False,0.6,it,1972-05-10,90,0.0,0
190,The Christmas of the Ugly Duckling,0,0,,,,False,0.6,en,2004-01-01,75,0.0,0
191,Max And Ruby - Max's Feast,0,0,,,,False,0.6,en,,50,0.0,0
192,Max and Ruby - Ruby Writes A Story,0,0,,,,False,0.62,en,,50,4.0,1
193,Hum Kisise Kum Naheen,0,0,,India,,False,0.6,hi,1977-08-25,169,7.8,3
194,WWE TLC: Tables Ladders & Chairs 2012,0,0,"Action, Drama",United States of America,World Wrestling Entertainment (WWE),False,1.523,en,2012-12-16,170,7.1,9
195,Recto/Verso,0,0,,France,,False,0.668,fr,1999-06-16,85,1.0,1
196,Síndrome,0,0,Drama,Spain,Zebra Productions,False,2.121,es,2004-08-17,95,4.6,4
197,Dead Man Talking,0,0,"Comedy, Drama",Belgium,Nexus Factory,False,1.625,en,2012-10-03,101,6.4,21
198,When Lynch Met Lucas,0,0,,,,False,0.916,en,2010-02-13,3,7.0,1
199,Fils unique,0,0,,Belgium,Entre Chien et Loup,False,0.913,en,2012-02-15,99,5.8,2
200,When Herzog Rescued Phoenix,0,0,,,,False,0.665,en,2010-09-06,3,7.0,1
201,Egg and Stone,0,0,,China,,False,0.71,en,2012-01-24,97,7.0,1
202,Sleepless Night,0,0,Drama,South Korea,Mocushura,False,1.031,ko,2012-04-29,66,6.0,4
203,Slaughter Claus,0,0,,,,False,1.382,en,2011-12-08,74,0.0,0
204,Limited Edition,0,0,"Thriller, Drama",France,CTV International,False,0.662,fr,1997-01-22,,5.0,1
205,Ramji Rao Speaking,0,0,"Drama, Comedy",India,Century Films,False,1.398,ml,1989-01-01,150,7.5,12
206,Mannar Mathai Speaking,0,0,"Comedy, Drama",India,O.K. Pictures,False,1.582,ml,1995-01-01,150,7.6,8
207,Anna Karenina,0,0,Drama,,,False,1.255,ru,2009-03-01,,5.5,2
208,The Little Patriot,0,0,"Adventure, Family",,Amsell Entertainment,False,0.888,en,1995-03-28,90,0.0,0
209,Goth Cruise,0,0,Documentary,,,False,0.6,en,2008-11-07,,6.2,3
210,Abominable Christmas,0,0,"Animation, Family",United States of America,Kickstart,False,3.004,en,2012-01-01,44,5.8,14
211,So Proudly We Hail,0,0,"War, Drama, Romance",United States of America,Paramount,False,1.886,en,1943-09-08,126,5.8,10
212,Rockets Galore,0,0,,United Kingdom,The Rank Organisation,False,0.871,en,1958-12-26,94,6.0,1
213,Bikini Frankenstein,0,0,Comedy,,,False,3.358,en,2010-01-18,81,6.0,4
214,Bikini Royale 2,0,0,,,,False,1.176,en,2010-01-18,81,4.0,1
215,The Brain Leeches,0,0,"Science Fiction, Horror",United States of America,Firdbird International Pictures,False,0.6,en,1978-01-01,55,4.0,2
216,Busty Housewives of Beverly Hills,0,0,Comedy,United States of America,Retromedia Entertainment,False,2.286,en,2012-05-15,81,5.3,4
217,Men in Red Suits,0,0,Documentary,,,False,0.6,en,2007-12-22,52,6.3,2
218,Dear Santa,0,0,"Family, Fantasy",United States of America,,False,0.6,en,1998-01-01,90,4.3,3
219,Dirty Blondes from Beyond,0,0,"Comedy, Science Fiction",United States of America,Retromedia Entertainment,False,1.16,en,2012-05-04,82,5.2,3
220,Demon Cop,0,0,"Horror, Action",United States of America,American Independent Productions,False,1.851,en,1990-12-30,90,3.3,6
221,Genie in a String Bikini,0,0,Comedy,United States of America,American Independent Productions,False,1.459,en,2006-01-01,,4.5,5
222,Theatre 1,0,0,,Japan,Laboratory X,False,0.6,ja,2012-11-21,172,5.0,1
223,Theatre 2,0,0,,Japan,Laboratory X,False,0.6,ja,2012-11-21,170,4.0,1
224,Behave,0,0,Documentary,Brazil,,False,0.683,en,2007-12-01,90,6.3,3
225,La maison de Himiko,0,0,,Japan,,False,1.331,ja,2005-08-27,130,7.4,5
226,A Bachelor's Pad For Ten,0,0,Comedy,Greece,Greka Film,False,1.143,el,1981-10-05,109,7.8,4
227,Sleepy Eyes of Death 11: In the Spider's Lair,0,0,"Drama, Action",Japan,"Daiei Motion Picture Co., Ltd.",False,0.6,ja,1968-05-01,81,7.0,1
228,The Majestic Plastic Bag,0,0,,,,False,1.293,en,2010-01-01,4,7.7,3
229,Alvin Lee & Ten Years Later Live a At Rockpalast 1978,0,0,Music,,,False,0.6,en,1978-09-15,51,0.0,0
230,Zrcadlení,0,0,,,,False,0.6,cs,1966-12-31,32,4.0,3
231,The Last Traitor,0,0,,,,False,1.176,en,1971-03-12,93,0.0,0
232,The Volunteer Worker,0,0,Animation,United States of America,Walt Disney Productions,False,0.869,en,1940-09-01,3,3.9,8
233,His Name Was Holy Ghost,0,0,Western,"Spain, Italy","Astro C.C., Lea Film",False,0.6,it,1972-03-30,94,8.0,1
234,"Faith, Fraud, & Minimum Wage",0,0,"Comedy, Drama",Canada,,False,0.788,de,2011-11-01,,4.6,4
235,A Gunman Called Dakota,0,0,,Italy,,False,0.731,it,1972-03-05,95,0.0,0
236,Let's Go And Kill Sartana,0,0,Western,,,False,0.6,it,1971-09-06,87,0.0,0
237,Panhandle 38,0,0,Western,Italy,Cinegai S.p.A.,False,0.616,it,1972-02-08,93,0.0,0
238,Alice's Wild West Show,0,0,Animation,,,False,1.53,en,1924-05-01,10,4.9,7
239,Ben and Me,0,0,"Animation, Comedy, Family",United States of America,"Walt Disney Productions, Buena Vista Pictures",False,1.25,en,1953-11-11,21,6.7,15
240,A Kid for Two Farthings,0,0,"Family, Comedy, Drama",United Kingdom,London Film Productions,False,1.207,en,1956-01-20,96,5.5,7
241,Disquiet,0,0,Drama,Portugal,Ar de Filmes,False,1.024,pt,2010-09-28,90,7.2,5
242,Native Son,0,0,Drama,"Argentina, United States of America",Argentina Sono Film S.A.C.I.,False,0.6,en,1951-03-02,91,0.0,0
243,Wholly Communion,0,0,,,,False,0.857,en,1965-12-31,33,5.8,5
244,Eric Clapton & Buddy Guy - South Bank Session,0,0,,,,False,0.914,en,,26,0.0,0
245,Master Hands,0,0,,,,False,1.48,en,1936-12-31,33,6.0,4
246,Toss Me a Dime,0,0,Documentary,Argentina,Instituto de Cinematografía de la Universidad Nacional del Litoral,False,2.329,es,1960-12-31,33,6.9,9
247,The March,0,0,Documentary,United States of America,United States Information Agency (USIA),False,0.984,en,1964-12-31,33,5.0,2
248,Handmade Nation,0,0,,,,False,0.6,en,,66,0.0,0
249,Boobs in the Woods,0,0,,,,False,1.101,en,1950-01-28,7,6.9,12
250,Golden Yeggs,0,0,,,,False,2.386,en,1950-08-05,7,6.2,10
251,Bosko the Talk-Ink Kid,0,0,Animation,United States of America,Leon Schlesinger Studios,False,1.3,en,1929-01-01,3,5.3,6
252,Umphrey's McGee: UM10,0,0,,,,False,0.6,en,2009-01-09,,0.0,0
253,Playthings,0,0,,United States of America,Studio A Entertainment,True,0.6,fr,1999-01-01,120,0.0,0
254,Kot v sapogakh,0,0,"Animation, Comedy, Drama, Family",,,False,1.641,ru,1995-01-01,27,5.3,6
255,Umphrey's McGee: Death by Stereo Webcast,0,0,,,,False,0.6,en,2011-10-24,,0.0,0
256,Sanpei the Fisher Boy,6000000,0,,Japan,"Akita Sakigake Shimposha, East Japan Marketing & Communications Inc., Higashinippon Broadcasting Co.",False,0.721,ja,2009-03-20,118,7.0,1
