,title,budget,revenue,genres,production_countries,production_companies,adult,popularity,original_language,release_date,runtime,vote_average,vote_count
0,When Wind and Rain Knock at the Window,0,0,"Drama, Adventure",Soviet Union,,False,0.6,lv,1968-01-01,96,0.0,0
1,Winter,0,0,Documentary,,,False,0.84,en,2007-04-09,5,0.0,0
2,The PSA Project,0,0,Documentary,,,False,0.805,en,2005-04-09,45,0.0,0
3,Rapsodia de sangre,0,0,Thriller,Spain,Isasi P.C.,False,0.633,es,1957-01-01,,0.0,0
4,Still Life,0,0,Documentary,,,False,0.722,en,2004-04-09,16,0.0,0
5,Devotion,0,0,Documentary,,,False,0.6,en,2003-04-09,34,0.0,0
6,Broken,0,0,Drama,Nigeria,High Definition Films,False,0.6,en,2013-03-28,93,4.0,1
7,Laali Ki Shaadi Mein Laaddoo Deewana,0,0,"Music, Comedy, Drama",India,,False,0.913,hi,2017-04-07,130,0.0,0
8,Tehran Has No More Pomegrenates!,0,0,"Comedy, Documentary",Iran,Documentary & Experimental Film Center,False,0.6,fa,2007-01-15,68,8.0,1
9,The Long Way Back: The Story of Todd Z-Man Zalkins,0,0,Documentary,,,False,0.6,en,2017-04-07,90,0.0,0
10,Must Watch,0,0,,,,False,0.6,en,,,0.0,0
11,A Nervous Life of Cosmos,0,0,Animation,Poland,Se-Ma-For,False,0.6,pl,1986-01-01,4,4.0,1
12,"LBW: Love, Breakup and War",0,0,,,,False,0.663,ml,2016-08-26,,0.0,0
13,Les bidasses aux grandes manoeuvres,0,0,Comedy,,,False,0.915,fr,1981-10-28,,6.0,2
14,The Strange Strangers,0,0,"Drama, Adventure",,,False,1.592,en,2012-04-02,15,0.0,0
15,Pierre Bonnard : les couleurs de l'intime,0,0,Documentary,France,ARTE France Cinéma,False,0.6,fr,,,0.0,0
16,Ketch! & HIRO-PON Get It On,0,0,,,,False,0.6,en,2009-02-06,30,0.0,0
17,Simple Minds - Acoustic in Concert,0,0,Music,Germany,Universal Pictures,False,0.6,en,2017-06-16,,0.0,0
18,The Happiness of the World,0,0,"Comedy, Drama",Poland,"Polski Instytut Sztuki Filmowej, Argomedia Productions, D35 (koprodukcja)",False,1.4,pl,2016-12-23,98,0.0,0
19,Simple.Minds: Radio 2 In Concert.2016-11-10,0,0,,,,False,0.6,en,,,0.0,0
20,El fin de ETA,0,0,Documentary,Spain,Quality Media Producciones,False,2.984,es,2017-01-27,107,7.0,3
21,Reno Roc III: Klinik der Wölfe,0,0,,,,False,0.6,en,2016-02-02,35,0.0,0
22,Tauchfahrt ins Verderben,0,0,,,,False,0.6,en,2013-02-02,57,0.0,0
23,Anna,0,0,,,,False,0.6,en,2014-02-02,25,0.0,0
24,Senorita from the West,0,0,"Comedy, Music, Western",United States of America,Universal Pictures,False,1.13,en,1945-10-12,63,5.0,1
25,Contacts,0,0,Documentary,,,False,0.661,en,1990-04-28,13,6.0,1
26,"Luchino Visconti, entre vérité et passion",0,0,Documentary,France,ARTE,False,0.6,fr,2016-11-15,,0.0,0
27,All Women Have Secrets,0,0,Comedy,United States of America,Paramount,False,1.377,en,1939-12-15,66,0.0,0
28,3 Men,0,0,Science Fiction,,,False,0.6,en,2015-06-06,3,0.0,0
29,Summoning,0,0,,,,False,0.611,en,2017-03-21,10,0.0,0
30,Young as You Feel,0,0,Comedy,United States of America,20th Century Fox,False,0.655,en,1940-02-16,60,0.0,0
31,Mile 19,0,0,Documentary,,,False,0.6,en,2016-02-27,10,0.0,0
32,L'Ampélopède,0,0,Fantasy,France,"Nanou Film, Office de Radiodiffusion Télévision Française (ORTF)",False,0.6,fr,1974-09-25,85,0.0,0
33,Die Meisterfälscher aus Neukölln,0,0,Documentary,,,False,0.6,de,2015-05-31,,0.0,0
34,The Stockholm Bloodbath,2200,0,"Horror, Thriller",Sweden,,False,0.914,en,,57,0.0,0
35,Giselle,0,0,,United States of America,Opus Arte,False,0.6,en,2014-07-22,,0.0,0
36,The encounter,0,0,Drama,Canada,,False,0.706,xx,,,5.0,1
37,Spatss!,0,0,Comedy,Canada,Les Films Rebel Art,False,0.6,en,2018-07-29,14,0.0,0
38,Black Site Delta,0,0,Action,United States of America,"Base Film Productions, Benattar/Thomas Productions",False,2.648,en,2017-05-05,87,5.8,19
39,"Mini-jupe, tout court !",0,0,Documentary,Belgium,"Crescendo Films, ARTE",False,0.6,fr,2011-08-30,,0.0,0
40,André Rieu's 2017 Maastricht Concert,0,0,Music,,,False,0.673,en,2017-07-22,167,1.0,2
41,Ecstasy,0,0,Drama,Italy,,False,0.99,it,1989-01-01,,4.5,1
42,"Loudly, Death Unties",0,0,Drama,Canada,,False,0.6,xx,,,4.0,1
43,Service,0,0,,,,False,0.6,en,2015-08-11,6,0.0,0
44,The Real Secrets Hidden in Antarctica... Revealed,0,0,Documentary,,,False,0.6,en,2017-04-10,44,0.0,0
45,The Rehabilitation of Sleep,0,0,,,,False,0.6,en,2014-05-22,2,0.0,0
46,Authentic,0,0,,Australia,,False,0.6,en,2012-12-15,13,7.5,2
47,Nervous Energy,0,0,,United Kingdom,,False,0.918,en,1995-11-09,104,5.0,1
48,Navajo Kid,0,0,Western,United States of America,"Alexander-Stern Productions, Producers Releasing Corporation (PRC)",False,1.388,en,1945-11-21,59,0.0,0
49,Deadpool Musical: Beauty and the Beast Gaston Parody,0,0,"Comedy, Music, Romance",,,False,1.28,en,2017-03-22,5,7.3,10
50,Untitled Short Film (2017),0,0,,,,False,0.6,pt,,,0.0,0
51,"Chocolate, Chewing Gum & Brown Babies",0,0,Documentary,,,False,0.6,lb,2010-11-10,95,0.0,0
52,Struggle on the Wulinclen,0,0,,,,False,0.84,zh,,,0.0,0
53,Starved,0,0,Horror,United States of America,Spectrum Films International,False,0.6,en,1998-01-01,90,0.0,0
54,J'ai tué ma femme,0,0,"Drama, Comedy",France,Ecce Films,False,0.608,fr,2017-02-04,30,0.0,0
55,The Love Boat: A Valentine Voyage,0,0,"Drama, Comedy, Romance",United States of America,,False,0.6,en,1990-02-12,120,4.0,1
56,Listen,0,0,,,,False,0.6,en,,14,0.0,0
57,Moral Code,0,0,"Drama, Science Fiction",United States of America,,False,0.94,en,1997-02-07,90,0.0,0
58,Cirque du Soleil: Le Cirque Réinventé,0,0,"Documentary, Comedy",,,False,0.876,en,1987-05-07,56,0.0,0
59,Hope Dies Last,0,0,"Drama, History",United Kingdom,,False,0.6,en,2017-08-10,8,0.0,0
60,Running Lights,0,0,"Animation, Drama, Family","Finland, India, Lithuania","Petpunk, Whitelight",False,0.899,lt,2017-03-24,11,0.0,0
61,Rabb Da Radio,0,0,"Drama, Family",India,Vehli Janta Films,False,1.2,pa,2017-03-31,121,7.3,3
62,Jungle Heat,0,0,Action,"Philippines, United States of America",,False,1.486,en,1988-05-06,85,4.0,1
63,Broken Trust,0,0,,United States of America,,False,0.6,en,1993-01-01,93,0.0,0
64,Alfred's Max Keyboard Complete,0,0,,,,False,0.6,en,,,0.0,0
65,Past Perfect,0,0,Documentary,,,False,0.84,en,2002-04-09,38,0.0,0
66,In Chris Marker's Studio,0,0,,France,,False,0.665,fr,2011-12-19,11,7.0,2
67,Sites Unseen,0,0,Documentary,,,False,0.805,en,2002-04-09,8,0.0,0
68,Ritual by Rote,0,0,Documentary,,,False,0.6,en,2001-04-09,5,0.0,0
69,Cool As Hell 2,80000,0,"Horror, Comedy",United States of America,Acid Bath Productions,False,0.6,en,2017-07-17,,4.0,1
70,Gopichand Jasoos,0,0,,India,,False,0.654,en,1982-02-19,,0.0,0
71,Internal Combustion,0,0,Documentary,,,False,1.4,en,1995-04-09,8,0.0,0
72,We At Her,0,0,Documentary,,,False,0.6,en,1995-04-09,8,0.0,0
73,Misfits of Science,0,0,Science Fiction,,,False,0.6,en,,96,0.0,0
74,Common Carrier,0,0,,,,False,0.608,en,2017-01-01,,0.0,0
75,Jag heter Stelios,0,0,Drama,Sweden,,False,0.844,sv,1972-09-04,115,0.0,0
76,Yeh Dil Aashiqanaa,0,0,,India,,False,0.6,hi,2002-01-18,152,10.0,1
77,Britain at War: Imperial War Museums at 100,0,0,,,,False,0.6,en,,,0.0,0
78,Zodiac 12: Five Steps of Love,0,0,"Comedy, Romance",Vietnam,,False,0.6,vi,2015-11-11,99,6.0,1
79,Dream of a Shadow,0,0,,,,False,0.6,en,,,0.0,0
80,The Missing Links,0,0,Mystery,United States of America,Fine Arts Film Company,False,0.609,en,1916-01-16,50,0.0,0
81,Elly baly balak,0,0,,,,False,1.077,en,,,6.2,5
82,Last Call at Murray's,0,0,"Romance, Comedy, Drama",,,False,0.812,en,2016-03-05,105,0.0,0
83,Talk Sex,0,0,"Romance, Drama",United States of America,Indigo Entertainment,False,1.96,en,2001-01-01,86,0.0,0
84,Wild Horses,0,0,,United Kingdom,,False,0.6,en,2017-05-17,26,0.0,0
85,Closeness,0,0,Drama,Russia,"Example of Intonation, Alexander Sokurov's Fund",False,1.626,ru,2017-08-03,118,6.8,18
86,Beauty and the Dogs,0,0,"Drama, Crime, Thriller","France, Lebanon, Norway, Qatar, Sweden, Switzerland, Tunisia","Cinétéléfilms, Tanit Films, Sister Productions",False,1.783,ar,2017-10-18,100,7.2,23
87,S&M Sally,0,0,"Romance, Comedy",,,False,0.6,en,2015-06-21,80,5.0,2
88,Desire and Deception,0,0,"Thriller, Drama, Mystery",United States of America,MRG Entertainment,False,0.6,en,2001-01-01,,0.0,0
89,A Man of Integrity,0,0,Thriller,Iran,Europe Media Nest,False,0.891,fa,2017-12-06,117,6.3,15
90,Le voci di dentro,0,0,,Italy,RAI,False,0.6,it,2014-11-02,,8.5,3
91,Psychokinesis,0,0,"Fantasy, Action",South Korea,"RedPeter Film, Next Entertainment World",False,5.822,ko,2018-01-31,101,5.8,80
92,Montparnasse Bienvenüe,0,0,Drama,France,Blue Monday Productions,False,3.439,fr,2017-06-15,97,6.0,41
93,L.A. Burning: The Riots 25 Years Later,0,0,"TV Movie, Documentary",United States of America,"Entertainment One, A+E Studios",False,1.4,en,2017-04-18,86,0.0,0
94,After the War,0,0,Drama,"France, Italy","Sensito Films, Bord Cadre Films, Cinéma Defacto",False,2.415,it,2018-03-21,100,7.6,9
95,Needle in a Timestack,0,0,"Science Fiction, Romance",,Mirimax,False,0.667,en,,,0.0,0
96,Chacales de la calle,0,0,"Adventure, Action",Mexico,Metropoli Films,False,0.6,es,2000-01-01,87,0.0,0
97,The Coffin Footage,0,0,"Thriller, Horror, Mystery",United States of America,"Blue 88 Studios, Filmstreet Productions",False,0.6,en,2016-01-10,71,1.5,2
98,Kirmes in Hollywood,0,0,Animation,Germany,,False,0.6,de,1929-12-31,,0.0,0
99,The Bank of Broken Hearts,0,0,Drama,Turkey,Ay Yapım,False,1.358,tr,2017-04-13,,0.0,0
100,American Football,0,0,Documentary,United States of America,,False,0.6,en,2013-10-23,145,0.0,0
101,El víbora,0,0,"Crime, Action, Adventure",Mexico,"Metropoli Films, Provicine",False,0.665,es,2002-01-01,99,0.0,0
102,Prague Winter,0,0,,,,False,0.6,en,2007-09-01,8,0.0,0
103,Tales from the Royal Bedchamber,0,0,"Documentary, History",United Kingdom,Tiger Aspect Productions,False,1.4,en,2013-08-05,59,8.0,1
104,Ghostbusters XXX Parody,0,0,,,Brazzers,True,0.794,en,2016-09-27,140,8.2,3
105,Cinderella's Hot Night,0,0,"Fantasy, Comedy",United States of America,Retromedia Entertainment,False,4.794,en,2017-05-30,80,6.0,55
106,Populace,0,0,,,,False,0.6,en,2015-08-15,14,5.0,1
107,Delights of an Undirected Mind,0,0,,,,False,0.667,en,2017-03-31,7,0.0,0
108,Hairy Twatter: A DreamZone Parody,0,0,,,,True,0.6,en,2012-08-20,106,0.0,0
109,Madame Freedom,0,0,"Romance, Drama",South Korea,Golden Tide Pictures,False,0.6,ko,2017-04-04,81,10.0,1
110,Gravity and Me: The Force That Shapes Our Lives,0,0,Documentary,United Kingdom,Furnace,False,0.909,en,2017-03-09,90,0.0,0
111,In Slumberland,0,0,Drama,United States of America,Fine Arts Film Company,False,0.6,en,1917-07-21,50,0.0,0
112,Strip Club Massacre,0,0,"Thriller, Horror",United States of America,"Reel Bloody Films, Top Ticket Productions",False,2.3,en,2017-05-02,101,3.9,8
113,The Guys,0,0,"Romance, Comedy, Drama",Indonesia,Soraya Intercine Films,False,0.6,id,2017-04-13,115,0.0,0
114,Beavers: Invasion of the End of the World,0,0,"History, Documentary, Animation",,,False,1.187,en,2017-04-25,97,0.0,0
115,Madame Bo-Peep,0,0,"Western, Comedy",United States of America,Fine Arts Film Company,False,0.6,en,1917-05-26,50,0.0,0
116,London Knights: A Heroes & Villains XXX Parody,0,0,"Action, Fantasy",United States of America,Digital Playground,True,1.425,en,2016-08-08,146,0.0,0
117,Souls Triumphant,0,0,Drama,United States of America,Fine Arts Film Company,False,0.6,en,1917-05-19,50,0.0,0
118,The Man Who Made Good,0,0,"Drama, Comedy",United States of America,Fine Arts Film Company,False,0.6,en,1917-05-12,50,0.0,0
119,Might and the Man,0,0,Drama,United States of America,Fine Arts Film Company,False,0.6,en,1917-05-05,50,0.0,0
120,Hands Up!,0,0,Western,United States of America,Fine Arts Film Company,False,0.6,en,1917-04-28,50,0.0,0
121,The House on Todville Road,0,0,Horror,United States of America,,False,0.6,en,1994-01-01,93,0.0,0
122,Lady of the Rings 2,0,0,,,,True,0.6,en,2005-11-28,85,0.0,0
123,Cheerful Givers,0,0,"Drama, Comedy",United States of America,Fine Arts Film Company,False,0.6,en,1917-04-21,50,0.0,0
124,Trapped,0,0,,United States of America,Vivid Entertainment,True,0.6,en,1996-08-15,78,7.0,1
125,An Old Fashioned Young Man,0,0,Drama,United States of America,Fine Arts Film Company,False,0.6,en,1917-04-14,50,0.0,0
126,Wassily Kandinsky,0,0,Documentary,Germany,Arthaus Musik,False,1.21,en,1986-03-06,56,0.0,0
127,Her Official Fathers,0,0,Comedy,United States of America,Fine Arts Film Company,False,0.6,en,1917-04-07,50,0.0,0
128,Indecent Disclosure,0,0,Drama,,,False,0.6,en,2000-01-01,76,0.0,0
129,The Boss of the Lazy Y,0,0,Western,United States of America,"Triangle Film Corporation, Fine Arts Film Company",False,0.6,en,1917-04-07,50,0.0,0
130,Yami Douga 11,0,0,Horror,Japan,,False,0.6,en,2014-05-05,60,0.0,0
131,Yami Douga 12,0,0,Horror,Japan,,False,0.6,en,2015-06-05,71,0.0,0
132,Her Father's Keeper,0,0,Drama,United States of America,Fine Arts Film Company,False,0.6,en,1917-04-01,50,0.0,0
133,Super Folk Song: Piano ga Aishita Onna,0,0,"Documentary, Music",Japan,Sony Music Entertainment Japan,False,0.84,ja,1992-09-02,79,0.0,0
134,De mère en fille,0,0,"Documentary, Drama",Canada,ONF,False,0.6,en,1968-01-01,76,0.0,0
135,A Woman's Awakening,0,0,Drama,United States of America,Fine Arts Film Company,False,0.6,en,1917-03-24,50,0.0,0
136,Sex Files: Pleasure World,0,0,"Science Fiction, Thriller, Drama","United States of America, France, Ireland, Netherlands","Click Productions Inc., Oranton Ltd., Riouw Beleggingen BV, asp s.a.",False,0.887,en,1998-01-01,91,0.0,0
137,Catalogue Vol. 4,0,0,,United States of America,,False,1.107,en,2016-10-21,4,0.0,0
138,On the Sunnyside,0,0,,Czechoslovakia,A-B,False,0.915,cs,1933-12-01,77,0.0,0
139,Silo Killer,6000,0,Horror,United States of America,Prescott Films,False,0.6,en,2002-10-31,90,0.0,0
140,Drone,4000000,0,Thriller,Canada,"Pacific Northwest Pictures, Gold Star Productions, Look to the Sky Films, Daylight Media",False,5.914,en,2017-05-26,91,5.2,143
141,Steve Martin: The Television Stuff,0,0,,,,False,0.6,en,2012-09-18,390,10.0,1
142,Wolverine: Weapon X - Tomorrow Dies Today,0,0,Animation,United States of America,Marvel Knights,False,0.6,en,2014-05-13,66,0.0,0
143,Young Sister-In-Law 2,0,0,,,,False,0.609,en,2017-02-08,94,0.0,0
144,Betsy Palmer: A Scream Queen Legend,0,0,Documentary,United States of America,Cinemarr Entertainment,False,0.6,en,2006-08-15,115,0.0,0
145,Misconduct,0,0,Comedy,United States of America,Continental Films (US),False,0.6,en,1966-08-12,,0.0,0
146,I Like Sexy Women 2,0,0,,,,False,0.6,en,2014-10-01,80,0.0,0
147,Janus: Two Faces of Desire,0,0,,,,False,0.888,en,2014-08-14,83,1.0,1
148,Elaan,0,0,"Music, Action, Drama, Adventure",India,United Producers,False,0.937,en,1971-05-19,142,6.0,3
149,Beyond Hell's Kitchen,0,0,"Crime, Documentary, Action",United States of America,,False,0.763,en,2004-11-30,58,6.0,2
150,The Story of the Hanyang Gibang House,0,0,,,,False,0.6,en,2015-12-30,101,0.0,0
151,A Daughter of the Poor,0,0,"Drama, Comedy",United States of America,Fine Arts Film Company,False,0.6,en,1917-03-17,50,0.0,0
152,A Love Sublime,0,0,Drama,United States of America,Fine Arts Film Company,False,0.6,en,1917-03-11,50,0.0,0
153,Betsy's Burglar,0,0,"Romance, Comedy",United States of America,Fine Arts Film Company,False,0.6,en,1917-03-04,50,0.0,0
154,Stage Struck,0,0,Drama,United States of America,Fine Arts Film Company,False,0.6,en,1917-02-25,50,0.0,0
155,Tumblefuckers,0,0,Drama,United States of America,,False,0.901,en,2017-04-13,2,0.0,0
156,Disney Parks: Disney Cruise Line,0,0,Documentary,United States of America,Lightship Entertainment,False,1.344,en,2010-01-01,49,0.0,0
157,A Girl of the Timber Claims,0,0,Drama,United States of America,Fine Arts Film Company,False,0.6,en,1917-02-11,50,0.0,0
158,The Plan,0,0,Documentary,South Korea,"Project Boo, Atnine Film",False,1.513,ko,2017-04-20,102,8.5,2
159,The Love Child,0,0,"Drama, Comedy",United Kingdom,"British Film Institute, Channel 4 Television",False,0.698,en,1988-09-22,102,7.0,1
160,The Song of Scorpions,0,0,Drama,"Switzerland, France",,False,0.6,en,2017-08-22,,4.3,3
161,Bee Nation,0,0,Documentary,Canada,,False,0.6,en,2017-04-27,78,0.0,0
162,The Great Easter Egg Hunt,0,0,,,,False,0.6,en,2000-03-11,47,6.0,1
163,Halbdrei,0,0,"Comedy, Drama, Romance",Germany,,False,1.527,de,1999-01-01,10,0.0,0
164,Strange Rampage,0,0,Comedy,United States of America,"Monique Productions, K & W Productions",False,0.6,en,1967-07-06,54,4.0,1
165,CBeebies Panto: Jack And The Beanstalk,0,0,"Family, TV Movie",United Kingdom,BBC,False,0.739,en,2012-12-24,45,10.0,2
166,René,0,0,,Switzerland,,False,0.6,de,2008-03-06,30,0.0,0
167,The Game Changer,0,0,"Action, Crime, Drama",China,Horgos Heng Xing Film-Television Culture Development,False,0.6,zh,2017-02-10,126,6.0,3
168,Silenzi e parole,0,0,Documentary,,,False,0.61,it,2017-04-05,86,0.0,0
169,Indro. L'uomo che scriveva sull'acqua,0,0,Documentary,Italy,Sky Arte HD,False,0.778,it,2016-07-22,,6.3,5
170,Der Rausschmeisser,0,0,Drama,Germany,Tele-München,False,0.679,de,1989-07-31,,8.0,1
171,A Brief Message from the Heart,0,0,Drama,Japan,"Toei Company, Ltd.",False,0.6,ja,1995-11-23,112,0.0,0
172,Comedy of the Heart,0,0,,,,False,0.6,de,1924-09-19,,0.0,0
173,Из Уфы с любовью!,0,0,Comedy,Russia,,False,1.554,ru,2017-04-13,100,0.0,0
174,Forest of Fear,0,0,"Animation, Horror",,Mustache Maniacs Film Co.,False,0.6,en,2011-10-20,18,0.0,0
175,PROGRESS: Orlando,0,0,,United States of America,PROGRESS,False,1.4,en,2017-03-31,151,0.0,0
176,"I Went France, Cannes",0,0,"Horror, Drama",Iran,,False,0.6,en,2016-09-27,52,0.0,0
177,Saddam's Mass Graves,0,0,Documentary,Iraq,Evini Films,False,1.092,ku,2004-10-30,60,0.0,0
178,Alpha Team: Mission Deep Jungle,0,0,"Animation, Action, Adventure",United States of America,Mustache Maniacs Film Co.,False,0.6,en,2015-12-25,37,0.0,0
179,Captain Majid,0,0,Drama,"United States of America, Chad","Aboudigin Films, Association d'Art Théâtral des Acteurs d'Ati",False,0.656,fr,2009-04-04,94,0.0,0
180,The Ballad of Billie Blue,0,0,,,,False,0.804,en,1972-02-23,78,0.0,0
181,Free City,0,0,"War, Drama, History",,,False,0.6,en,1958-08-31,98,0.0,0
182,Inferno d'August Strindberg,0,0,,,,False,0.671,fr,2017-05-10,,0.0,0
183,Q'eros: The Shape of Survival,0,0,Documentary,,,False,0.6,en,1979-01-01,50,0.0,0
184,Jack's Teen America: Mission 9,0,0,,United States of America,Digital Playground,True,0.6,en,2005-11-03,120,6.0,1
185,Days of Buffalo Bill,0,0,Western,United States of America,Republic Pictures,False,0.872,en,1946-02-02,56,0.0,0
186,The GX1000 Video,0,0,Documentary,United States of America,,False,0.662,en,2016-06-22,28,0.0,0
187,Julien,0,0,Documentary,,,False,1.378,fr,2010-07-07,,6.0,1
188,Notes sur le système de transport collectif de la ville de Mexico,0,0,Documentary,,,False,0.6,fr,,,0.0,0
189,Not Airplane XXX: Cockpit Cuties,0,0,,,,True,0.6,en,2011-11-23,127,0.0,0
190,La rue est à eux,0,0,Documentary,France,"Télessonne, Aurora Films",False,0.876,fr,,,0.0,0
191,Death Game,0,0,,,,False,0.6,en,2015-09-29,84,0.0,0
192,Love Song For You,0,0,"Romance, Comedy",Japan,,False,0.6,ja,2010-05-11,,1.0,1
193,Auroras,0,0,"Science Fiction, Drama",United States of America,"Aurora Lab, Marauder Film",False,0.84,en,2015-07-31,5,7.0,2
194,Resonant Islands,0,0,Documentary,,,False,0.649,fr,2017-03-30,41,0.0,0
195,Pipe Dream,0,0,"Comedy, Crime",Australia,"Revue Factory Productions, Lighthouse Home Entertainment",False,1.4,en,2015-05-30,95,6.0,2
196,Not Married with Children XXX,0,0,,,,True,1.527,en,2009-08-25,136,7.0,1
197,Passionate Love,0,0,,,,False,0.6,en,2014-07-23,84,0.0,0
198,Dead Serious,250000,0,Horror,United States of America,Moodude Films,False,0.6,en,2005-10-15,85,0.0,0
199,Her Addiction,0,0,,,,False,0.6,en,,83,0.0,0
200,Smoking Club (129 normas),0,0,Comedy,Spain,MoA Studio,False,0.6,es,2017-04-07,80,5.5,4
201,The Forgotten City of the Planet of the Apes,0,0,,,,False,0.6,en,1980-12-20,95,4.0,1
202,Tres caballeros,0,0,Animation,Germany,,False,0.6,es,1932-01-01,,0.0,0
203,Wolken über Sommarholm,0,0,Romance,,,False,0.6,de,2006-11-26,,6.0,1
204,Flavio,0,0,Documentary,,,False,0.807,en,1964-01-01,12,0.0,0
205,George Fest: A Night to Celebrate the Music of George Harrison,0,0,Music,,,False,0.84,en,2016-02-26,,0.0,0
206,Internees of Kampili,0,0,Drama,Japan,"Shochiku Co., Ltd.",False,0.6,ja,1960-09-29,89,0.0,0
207,Drifting Along,0,0,Western,United States of America,"Great Western Productions, Monogram Pictures",False,0.655,en,1946-01-26,60,0.0,0
208,Jack's My First Porn 2,0,0,Comedy,United States of America,Digital Playground,True,0.6,en,2006-01-19,104,7.0,1
209,La Caracas,0,0,Documentary,Argentina,,False,0.6,es,2012-10-25,,0.0,0
210,Tales from the Royal Wardrobe,0,0,"Documentary, History",United Kingdom,Tiger Aspect Productions,False,1.245,en,2014-07-07,59,8.0,1
211,Naalu Peruku Nalladhuna Edhuvum Thappilla,0,0,"Thriller, Drama, Crime",,,False,0.838,ta,2017-03-30,,0.0,0
212,Willful Infringement,0,0,Documentary,United States of America,Fiat Lucre,False,1.13,en,2003-07-23,58,0.0,0
213,Mafia,0,0,"Romance, Action",Egypt,,False,1.039,ar,2002-07-23,112,3.7,3
214,Thieves in KG2,0,0,"Comedy, Romance, Drama, Family",Egypt,,False,0.99,ar,2001-02-21,95,5.0,3
215,uno,0,0,,,,False,0.6,en,2002-04-30,14,2.0,1
216,Girl Band,0,0,,,,False,0.6,nl,,,0.0,0
217,#WhereIsBeauty,0,0,"Family, Drama",United States of America,"Silver Lining Entertainment, Mama-Sans Entertainment",False,0.84,en,2016-06-03,11,10.0,1
218,The Reagan Show,0,0,Documentary,,,False,2.351,en,2017-04-22,75,6.6,5
219,Ikkitousen: Shuugaku Toushi Keppuuroku,0,0,"Animation, Action",Japan,,False,0.84,ja,2011-11-12,,0.0,0
220,Cosmic Radio,0,0,,,,False,0.6,nl,,,0.0,0
221,Håkan Hellström live at Ullevi 2016,0,0,Music,Sweden,SVT,False,0.6,sv,2017-04-14,90,0.0,0
222,Adam's Testament,0,0,Drama,,,False,0.6,nl,2017-04-18,,0.0,0
223,University: The Third,0,0,,,,False,0.6,nl,,,0.0,0
224,Hitched,0,0,,,,False,0.6,nl,,,0.0,0
225,Die letzten Paradiese - Die Ökosysteme der Erde,0,0,Documentary,United Kingdom,BBC Earth,False,0.6,de,2016-08-26,,0.0,0
226,Vandaag is van ons,0,0,,,,False,0.6,nl,,,6.0,1
227,Beta,0,0,,,,False,0.6,en,2017-04-13,84,0.0,0
228,Gasht-e 2,0,0,Comedy,Iran,,False,1.354,fa,2017-03-20,,6.0,4
229,In-Saeng,0,0,,,,False,0.6,en,2003-01-01,10,0.0,0
230,Cirque du Bizarre,0,0,Documentary,United States of America,Marquis Media,False,0.914,en,2008-01-01,78,10.0,1
231,Tripoli Cancelled,0,0,,"Bangladesh, Greece, Germany, United States of America, United Kingdom",,False,0.6,en,2017-04-08,95,7.0,2
232,Dodoba,0,0,Animation,,,False,0.6,en,2015-05-04,6,0.0,0
233,Homo Paradoksum I,0,0,Documentary,Soviet Union,,False,0.6,ru,1989-01-01,17,0.0,0
234,Extraction,0,0,"Drama, Science Fiction",,,False,0.602,en,2015-11-03,7,0.0,0
235,The Tunnel,0,0,"Mystery, Horror",United States of America,Bloodshot Pictures,False,0.6,en,2001-11-17,35,0.0,0
236,Less Than the Dust,0,0,Drama,United States of America,Mary Pickford Company,False,1.187,en,1916-11-04,93,1.0,1
237,Willoughby Sharp Videoviews Vito Acconci,0,0,Documentary,United States of America,,False,0.6,en,1973-01-01,62,0.0,0
238,The Story of the Monkey King,0,0,"Adventure, Animation, Fantasy",Japan,,False,0.871,ja,1926-10-29,5,5.0,1
239,Le Brio,0,0,"Comedy, Drama",France,"Moonshaker, Chapter 2",False,7.863,fr,2017-11-22,95,7.2,469
240,Daddy Cool,0,0,Comedy,France,Les improductibles,False,6.832,fr,2017-11-01,97,6.1,105
241,Gil Scott-Heron: The Revolution Will Not Be Televised,0,0,"Music, Documentary",,"BBC Four, Something Else B.V.",False,0.666,en,2003-04-14,60,0.0,0
242,Um Cara Diferente,0,0,Documentary,Brazil,,False,0.84,pt,2014-04-14,,0.0,0
243,How to Top My Wife,0,0,,South Korea,"Morning Calm Entertainment Group Inc., CJ Entertainment",True,0.6,ko,1994-12-17,101,0.0,0
244,Separated,0,0,"Adventure, Family",,,False,0.84,en,,15,0.0,0
245,Whitlam: The Power and the Passion,0,0,,,,False,0.6,en,,115,0.0,0
246,Barely Proper,0,0,Drama,United States of America,,False,0.96,en,1975-01-01,,0.0,0
247,Can't Help Falling in Love,0,0,"Comedy, Romance",Philippines,Star Cinema – ABS-CBN Film Productions,False,0.905,tl,2017-04-15,119,8.0,15
248,Bloodied But Unbowed,0,0,,,,False,1.102,en,2015-10-22,75,0.0,0
249,Price of a Married Woman: Perfume of Desires,0,0,,Japan,,False,0.6,ja,2001-12-08,80,0.0,0
250,What Babies Want,0,0,Documentary,,,False,0.6,en,2004-04-14,57,0.0,0
251,Dead End,0,0,,Japan,,False,0.6,ja,1994-01-14,60,0.0,0
252,Mansfield K.,0,0,,France,,False,0.65,fr,1988-01-01,20,6.0,2
253,Les heures,0,0,,France,,False,0.6,fr,1990-11-13,6,0.0,0
254,Été,0,0,,,,False,0.6,fr,1991-01-01,50,0.0,0
255,Kleist,0,0,,France,,False,0.6,fr,1993-05-04,15,0.0,0
256,Creating The Time Capsule - The Making of Moonwalk One,0,0,Documentary,,An Attic Room,False,0.6,en,,,0.0,0
257,Un vent leger dans le feuillage,0,0,,France,,False,0.84,fr,1994-06-21,3,0.0,0
258,Chants,0,0,,France,,False,1.091,fr,1995-01-01,20,0.0,0
259,Passages,0,0,,France,,False,1.4,fr,1998-01-01,40,0.0,0
260,Hôtel Turkoman,0,0,,,,False,1.091,fr,2000-01-01,15,0.0,0
261,Mer,0,0,,,,False,0.841,en,2003-01-01,20,0.0,0
262,Istanbul,0,0,Documentary,"Turkey, France",,False,0.6,fr,2007-01-01,102,0.0,0
263,Hunting the KGB Killers,0,0,Documentary,,,False,0.6,en,2017-04-17,,7.0,1
264,À l'instant,0,0,,France,,False,1.093,fr,2008-01-01,5,0.0,0
265,Chemins,0,0,,,Centre National de la Cinématographie,False,0.6,fr,2014-01-01,80,0.0,0
266,Crépuscule aux Aresquiers,0,0,Documentary,France,,False,0.6,fr,2014-01-01,19,0.0,0
267,Dehors,0,0,,,,False,0.6,fr,1985-12-16,25,0.0,0
268,Laure,0,0,,France,,False,0.6,fr,1984-01-01,46,0.0,0
269,Karabudjan,0,0,,,,False,0.714,es,2010-04-06,,5.0,4
270,I-conic,0,0,,,,False,0.6,en,1986-01-01,3,0.0,0
271,No Meio de Nós,0,0,Documentary,Brazil,Pozati Filmes,False,1.187,pt,2017-04-20,,0.0,0
272,Buffalo Forever,0,0,,,,False,0.6,nl,,,0.0,0
273,Meet The in-Laws,0,0,Comedy,Nigeria,,False,1.361,en,2016-08-17,75,0.0,0
274,Die Luther Matrix,0,0,"Thriller, Documentary",,,False,0.897,de,2017-04-11,,4.0,1
275,Woody Allen: la vida y nada más,0,0,Documentary,Spain,Canal+ España,False,0.873,es,,,6.0,1
276,Black Mirror,0,0,Drama,United States of America,,False,2.553,en,2011-06-20,4,7.8,32
277,Simulacra,0,0,"Animation, Fantasy",Croatia,Bonobostudio,False,0.84,hr,2014-01-01,9,8.0,3
