,title,budget,revenue,genres,production_countries,production_companies,adult,popularity,original_language,release_date,runtime,vote_average,vote_count
429,PADI Enriched Air Diving,0,0,,,,False,0.6,en,,40,0.0,0
430,The PADI Deep Diver Course,0,0,,,,False,0.6,en,,22,0.0,0
431,Skyline Cruisers,0,0,,Hong Kong,,False,1.271,cn,2000-11-24,89,7.5,2
432,Warriors of the Net,0,0,Documentary,Sweden,,False,0.705,en,1999-01-01,13,5.3,2
433,Last Train Home,0,288,"Documentary, Drama","United Kingdom, Canada, China","Téléfilm Canada, EyeSteelFilm",False,3.458,zh,2009-06-06,85,7.2,27
434,Three Cases of Murder,0,0,Mystery,,,False,2.641,en,1955-03-15,99,5.9,12
435,A Letter to Three Wives,0,0,"Drama, Romance",United States of America,20th Century Fox,False,4.764,en,1949-01-20,103,7.3,49
436,The World's Greatest Lover,0,0,"Comedy, Romance",United States of America,"Jouer Limited, 20th Century Fox",False,3.766,en,1977-12-18,89,6.2,20
437,Solanin,0,0,"Drama, Music, Romance",Japan,"Yahoo Japan, Asmik Ace, IMJ Entertainment, Parco Co. Ltd., Shogakukan, tv asahi, WOWOW, Sony Music Entertainmant, Asahi Broadcasting Corporation",False,1.337,ja,2010-04-03,126,7.3,9
438,As Young as You Feel,0,0,Comedy,United States of America,20th Century Fox,False,2.54,en,1951-06-15,77,7.2,5
439,De Wielen van de Bus - Humpty Dumpty,0,0,"Animation, Family",,,False,0.637,en,2015-01-01,60,0.0,0
440,Pantera: 3 Watch It Go,0,0,"Music, Documentary",,,False,1.4,en,1997-11-11,122,0.0,0
441,Kill Me Please,0,0,"Comedy, Drama","France, Belgium","OXB Productions, Les Armateurs, La Parti Production",False,2.466,fr,2010-11-03,95,6.9,22
442,Angels in the Outfield,0,0,"Comedy, Family, Fantasy",United States of America,Metro-Goldwyn-Mayer,False,2.253,en,1951-10-19,99,6.5,12
443,Roman,250000,0,"Drama, Thriller",United States of America,Auteur Entertainment,False,2.095,en,2006-07-07,92,5.2,12
444,Collision Course Jay-Z and Linkin Park,0,0,Music,,,False,0.6,en,,21,5.3,2
445,Miral,0,852336,Drama,"France, Israel, Italy, India","Eran Riklis Productions Ltd., Pathé!",False,3.466,en,2010-10-01,112,6.1,28
446,Der blaue Affe,0,0,Drama,Germany,,False,0.6,en,2006-10-06,48,4.5,2
447,The Trouble with Girls,0,0,"Drama, Comedy, Music",United States of America,Metro-Goldwyn-Mayer,False,3.943,en,1969-09-03,97,4.8,10
448,The Tunnel of Love,0,0,"Comedy, Romance",United States of America,Arwin Productions,False,2.22,en,1958-11-21,98,6.6,7
449,Polska Love Serenade,0,0,Comedy,"Poland, Germany",,False,0.661,de,2008-01-15,75,4.5,2
450,Dead Cert,0,0,"Thriller, Horror, Action",United Kingdom,"Raw Film Productions, Black & Blue Films",False,4.067,en,2010-08-26,92,4.0,12
451,Jane Eyre,0,0,"Drama, Romance",United Kingdom,London Weekend Television (LWT),False,2.855,en,1997-03-09,108,7.3,20
452,Schlagende Wetter,0,0,"Drama, Action",Germany,Stern Film,False,0.84,de,1923-02-15,65,9.0,1
453,Sissi - Forever My Love,0,0,"Romance, Drama",Austria,Paramount,False,3.961,de,1962-03-27,147,6.5,23
454,Who Is Clark Rockefeller?,0,0,"Crime, Drama, Horror",United States of America,Sony Pictures Television,False,1.643,en,2010-03-13,87,5.5,5
455,Another Love,0,0,,Czechoslovakia,Slovenská filmová tvorba Koliba (SFT),False,0.644,sk,1985-01-01,72,0.0,0
456,Before Tonight is Over,0,0,Drama,Slovakia,Studio Hraných Filmov Bratislava,False,1.157,sk,1965-01-01,86,7.0,1
457,Wild Lilies,0,0,Drama,Czechoslovakia,"Studio Hraných Filmov Bratislava, Slovenská filmová tvorba Koliba (SFT)",False,0.966,sk,1972-01-01,77,9.0,2
458,Katsuni: Dirty Me,0,0,,United States of America,Digital Playground,True,0.742,en,2010-09-14,89,8.8,3
459,Attack on Darfur,0,0,"Drama, Action, Thriller","Canada, South Africa, Germany",,False,3.597,en,2009-11-06,98,6.1,15
460,The Ark,0,0,"Animation, Adventure, Family","Argentina, Italy",Patagonik,False,0.95,es,2007-06-13,88,4.4,10
461,The Tunnel,135000,0,"Horror, Thriller, Mystery",Australia,"Distracted Media, Zapruder's Other Films, DLSHS",False,8.441,en,2011-05-19,90,5.6,170
462,Storm,0,0,"Thriller, Drama, Mystery","Norway, Sweden","TLA Releasing, Sandrew Metronome Sverige, Breidablick Film, Film i Väst, SVT, Drylab, The Chimney Pot",False,3.557,sv,2006-01-20,110,6.6,14
463,Dangerous Davies,0,0,"Crime, Comedy",United Kingdom,"Inner Circle Films, Incorporated Television Company (ITC)",False,2.549,en,1981-01-04,120,4.5,3
464,Biblen - Fuhlendorff & Mørk,0,0,,,,False,1.478,da,2007-01-01,,9.0,2
465,O Diário Sexual de Maria,0,0,,Portugal,,True,0.654,en,2010-06-10,83,9.5,2
466,The Goddess of 1967,0,0,"Romance, Drama, Comedy",Australia,New South Wales Film & Television Office,False,1.927,en,2000-09-08,119,7.0,13
467,Susie Q,0,0,"Comedy, Drama, Family, Mystery, TV Movie",,"Disney Channel, Libra Pictures, Shavick Entertainment",False,2.588,en,1996-09-30,83,5.6,11
468,Christmas Comes but Once a Year,0,0,Animation,United States of America,Fleischer Studios,False,0.991,en,1936-01-01,9,6.2,5
469,Simon Jul: Slik Mig Hvid!,0,0,Comedy,Denmark,,False,1.53,da,2007-11-08,,0.0,0
470,Peace on Earth,0,0,"War, Animation",United States of America,"Hugh Harman Productions, Fred Quimby Productions, MGM Cartoon Studio, Quimby-Hanna/Barbera",False,2.971,en,1939-12-09,9,7.7,20
471,Tak For i Aften,0,0,,,,False,0.6,da,,,0.0,0
472,Good Will to Men,0,0,"Animation, Drama, Romance",United States of America,Metro-Goldwyn-Mayer,False,1.47,en,1955-12-23,9,6.0,6
473,No Time for Nuts,0,0,"Adventure, Animation, Family, TV Movie",United States of America,Blue Sky Studios,False,6.606,en,2006-10-23,7,7.2,78
474,Planzet,0,0,"Animation, Action, Science Fiction",Japan,CoMix Wave Films,False,1.592,ja,2010-05-22,53,6.5,4
475,Sekret Enigmy,0,0,"History, War",Poland,"Zespół Filmowy ""Profil""",False,0.948,pl,1979-09-01,158,5.0,1
476,Red Surf,0,0,"Action, Drama, Thriller",United States of America,Arrowhead Entertainment,False,1.277,en,1990-01-01,104,3.2,9
477,Rust,0,0,Drama,,,False,0.954,en,2010-10-07,94,8.0,1
478,Zoetrope,0,0,Science Fiction,United States of America,Match Girl Pictures,False,1.965,en,1999-01-01,18,5.8,6
479,Razördolls,0,0,,United States of America,Razordolls Entertainment,True,0.6,en,2007-05-22,75,0.0,0
480,Baronessen fra benzintanken,0,0,Comedy,Denmark,Saga Studio,False,2.044,da,1960-09-04,122,7.3,6
481,The Lion of Judah,15000000,0,"Adventure, Animation, Comedy, Family",United States of America,"Sunrise Productions, Animated Family Films, Character Matters",False,1.733,en,2011-06-03,87,4.5,3
482,No Love Lost,0,0,,United States of America,Digital Playground,True,0.919,en,2010-01-05,97,4.0,2
483,Blackout,0,0,"Drama, Horror, Thriller",Finland,,False,1.453,en,2007-10-01,95,4.0,3
484,Constellation,7200000,23006533,"Drama, Romance",United States of America,Constellation LLC,False,1.868,en,2007-02-01,96,5.0,2
485,Luckytown,0,0,"Drama, Crime, Mystery, Thriller",United States of America,"A Plus Entertainment, Mediapix",False,1.868,en,2000-08-04,105,6.2,5
486,Blue Ice,0,0,"Mystery, Action, Thriller","United Kingdom, United States of America","HBO, M&M Productions, Guild",False,3.406,en,1992-10-09,105,5.5,16
487,Raven Alexis: Desires,0,0,,United States of America,Digital Playground,True,0.672,en,2010-02-09,105,7.0,1
488,Ghost a go go,0,0,,,,False,0.6,en,,25,0.0,0
489,Global: A Surf Movie,0,0,,,,False,0.6,en,,,0.0,0
490,The Friendly Physician,0,0,,,,False,0.6,en,,25,0.0,0
491,Premium,0,0,"Comedy, Romance",,,False,1.319,en,2006-01-02,97,3.8,4
492,Iphigenia,0,0,"Action, Drama",Greece,Greek Film Centre,False,3.14,el,1977-09-10,127,6.8,13
493,The Ring Finger,0,0,"Drama, Romance",France,"Les Films du Veyrier, Integral Film, Tapioca Films, Eurimages, Région Ile-de-France, FilmFörderung Hamburg, Centre National de la Cinématographie, Canal+, The Bureau",False,4.173,en,2005-06-08,100,5.5,15
494,Jerry Cotton,0,0,"Comedy, Crime",Germany,"B.A. Filmproduktion, Studio Babelsberg, Beta Film, Rat Pack Filmproduktion",False,2.955,de,2010-03-11,90,6.2,17
495,Disney Sing-Along-Songs: Happy Haunting,0,0,Music,,,False,0.673,en,2006-09-05,,10.0,1
496,Almost Elvis,0,0,Comedy,,,False,1.381,sv,2009-10-30,85,0.0,0
497,No Time for Love,2800000,0,"Comedy, Romance",Denmark,Nepenthe Productions,False,1.857,da,2009-10-30,90,6.0,4
498,Awaken the Dead,10000,0,"Action, Comedy, Horror, Mystery, Science Fiction, Thriller",United States of America,,False,2.705,en,2007-11-06,102,2.2,5
499,Disney Sing-Along-Songs: Home On The Range - Little Patch Of Heaven,0,0,Music,,,False,1.4,en,2004-03-23,37,8.0,2
500,Examination 1977,0,0,,,,False,0.6,en,,,0.0,0
501,This Time for Keeps,0,0,"Comedy, Music, Romance",United States of America,Metro-Goldwyn-Mayer,False,1.96,en,1947-10-17,105,8.0,1
502,Disappearances,1500000,312642,"Action, Adventure, Drama",United States of America,Moody Street Pictures,False,2.531,en,2007-05-11,118,4.1,7
503,Drive Thru,0,0,"Comedy, Horror",United States of America,Lions Gate Films,False,5.253,en,2007-05-29,83,4.6,62
504,Fate/Stay Night: Unlimited Blade Works,0,0,"Action, Fantasy, Animation",Japan,Studio Deen,False,1.38,ja,2010-01-23,107,6.4,19
505,Westall 66: A Suburban UFO Mystery,0,0,Documentary,,,False,1.094,en,2010-06-04,,0.0,0
506,Second Glance,0,0,Drama,United States of America,Christiano Film Group,False,0.71,en,1992-01-01,50,2.6,4
507,Looking Through Lillian,0,0,"Drama, Romance, Thriller",,,False,0.6,en,2002-02-28,98,0.0,0
508,The Man on the Balcony,0,0,Crime,"Germany, Sweden","Victoria Film, SVT Drama, Rialto Film, Svensk Filmindustri, Nordisk Film & TV Fond",False,1.929,sv,1993-11-26,91,6.5,10
509,Blue Holes: Diving The Labyrinth,0,0,Documentary,,,False,1.4,en,2010-09-24,47,5.5,1
510,Kenny G - Live,0,0,Music,United States of America,Arista Records,False,0.6,en,2001-02-20,74,4.3,2
511,Sin Bandera: Hasta Ahora,0,0,"Drama, Action, Thriller, Music",Mexico,,False,0.903,en,2008-12-09,120,5.3,2
512,Port of Shadows,0,0,"Crime, Drama, Romance",France,Ciné-Alliance,False,5.659,fr,1938-05-17,91,7.6,92
513,Joy to the World,0,0,,,,False,1.092,en,2003-12-10,25,0.0,0
514,Gothic Vampires from Hell,0,0,Horror,United States of America,,False,0.6,en,2007-05-15,90,2.0,1
515,Illegal Aliens,0,0,"Comedy, Science Fiction",United States of America,,False,2.652,en,2007-05-01,96,3.9,7
516,The Phantom of the Opera,0,0,"Drama, Horror, Mystery",United Kingdom,Hammer Film Productions,False,2.008,en,1962-06-25,84,6.5,29
517,Of Gods and Men,4000000,41424067,"Drama, History",France,"Why Not Productions, Armada Films, Cinémage 4, Cofinova 6, Soficinéma 6, France Télévisions",False,7.343,fr,2010-05-18,120,6.7,178
518,Pervert!,0,0,"Comedy, Horror",United States of America,TLA Releasing,False,2.965,en,2005-02-12,81,5.0,28
519,Captain Conan,0,0,"Drama, War",France,"Studio Images 2, Canal+, Les Films Alain Sarde, Little Bear, TF1 Films Production",False,3.332,fr,1996-10-16,129,6.6,31
520,The Duchess of Langeais,0,0,"Drama, Music, Romance","France, Italy","Pierre Grise Productions, Cinemaundici, CinéCinéma, MEDIA Programme of the European Union, PROCIREP, Région Ile-de-France, Centre National de la Cinématographie, Canal+, ARTE France Cinéma, Ministero per i Beni e le Attività Culturali",False,1.879,fr,2007-03-28,137,5.0,9
521,Four Eyed Monsters,250000,245000,"Comedy, Drama, Fantasy, Romance",United States of America,,False,2.145,en,2005-01-21,71,5.9,18
522,Great Guy,0,0,"Crime, Drama, Mystery",United States of America,"Grand National Pictures, Zion Meyers Productions",False,1.982,en,1936-12-01,75,6.5,6
523,Piger På Prøveløsladelse - For Klam Til TV,0,0,,Denmark,,False,0.6,da,2009-02-03,,0.0,0
524,Winnie & Karina - The Movie,0,0,Comedy,Denmark,Regner Grasten,False,1.176,da,2009-08-07,75,5.5,2
525,Rain in the Mountains,0,0,"Comedy, Drama",United States of America,,False,0.66,en,2007-01-01,91,4.0,2
526,Unrequited,0,0,,United States of America,Lucky Day Studios,False,0.959,en,2010-06-08,,4.5,4
527,The Looking Glass War,0,0,"Action, Drama, Thriller",United Kingdom,"Frankovich Productions, Columbia Pictures",False,2.124,en,1969-09-22,108,5.3,8
528,Demons of the Mind,0,0,"Horror, Thriller",United Kingdom,"Hammer Film Productions, Anglo-EMI, Frank Godwin Productions",False,2.173,en,1972-11-05,89,5.6,16
529,Guns,0,0,"Action, Crime",United States of America,Malibu Bay Films,False,2.092,en,1990-11-09,96,5.4,7
530,The Magic Hour,0,0,"Comedy, Thriller",Japan,,False,2.702,ja,2008-06-07,136,7.0,17
531,Malpertuis,0,0,"Drama, Horror, Fantasy","Belgium, France, Germany","Artémis Productions, Les Productions Artistes Associés, SOFLDOC, Société d'Expansion du Spectacle",False,2.56,nl,1971-01-01,125,6.2,12
532,The Story of Vickie,0,0,"Drama, History, Comedy, Romance",Austria,Erma-Filmproduktionsgesellschaft,False,3.489,de,1954-12-15,103,7.0,22
533,Inseminoid,2000000,0,"Thriller, Horror, Science Fiction",United Kingdom,Jupiter Film Productions,False,3.904,en,1981-01-23,93,3.6,32
534,An Erotic Vampire in Paris,0,0,"Horror, Romance",United States of America,"Video Vamp, Artschiv Productions",False,1.4,en,2002-05-28,79,3.0,1
535,The Good the Bad and the Wicked,0,0,Western,United States of America,Wicked Pictures,True,1.125,en,1998-10-12,85,0.0,0
536,Barsaat,0,0,"Drama, Romance",,,False,4.198,hi,1995-09-29,,4.9,10
537,Bar Anal,0,0,,,,True,0.6,en,2010-02-18,,9.0,2
538,Big Natural Tits 23,0,0,,United States of America,"Clark Euro Angel, Evil Angel",True,1.4,en,2010-09-10,,9.3,3
539,Bhavnao Ko Samjho,0,0,Comedy,,,False,1.502,hi,2010-01-15,114,4.0,1
540,The Blue Umbrella,0,0,"Drama, Family",India,UTV Motion Pictures,False,2.988,hi,2005-12-11,90,6.2,5
541,Bombay Calling,0,0,,,,False,0.6,en,2006-08-22,,0.0,0
542,Buddha Mar Gaya,0,0,Comedy,India,,False,1.918,hi,2007-08-17,93,4.3,4
543,Dillagi,0,0,"Drama, Romance",,,False,1.4,hi,1978-01-01,,5.0,1
544,Dus Kahaniyaan,0,0,Drama,India,,False,2.002,hi,2007-12-07,110,3.9,10
545,Hadh Kar Di Aapne,0,0,"Romance, Comedy",India,R.R. Productions,False,2.061,hi,2000-04-14,134,4.6,7
546,Honeymoon Travels Pvt. Ltd.,1400000,2500000,"Comedy, Drama, Romance",India,Excel Entertainment,False,2.551,hi,2007-02-23,118,5.1,12
547,Hum Aapke Hain Koun..!,0,26900000,"Drama, Romance",India,Rajshri Productions,False,3.464,hi,1994-08-05,206,6.6,41
548,A Ghost of A Chantz,0,0,,,,False,0.6,en,,25,0.5,1
549,The Thing That Couldn't Die,0,0,Horror,United States of America,Universal International Pictures,False,2.999,en,1958-06-27,69,6.4,11
550,Love Letter,0,0,"Drama, Romance",Japan,,False,3.853,ja,1995-03-25,117,7.7,49
551,The Deadly Bees,0,0,"Horror, Thriller, Mystery",United Kingdom,"Paramount, Amicus Productions",False,2.165,en,1966-12-23,83,4.2,12
552,The Bubble,0,0,,Greece,,False,1.16,el,2002-01-02,104,6.5,2
553,Female Company,0,0,Comedy,Greece,,False,1.974,en,1999-12-03,104,6.4,5
554,Deep Crimson,0,0,"Romance, Drama, Crime","France, Mexico, Spain",Fondo de Fomento a la Calidad Cinematográfica,False,2.257,es,1996-01-01,111,6.6,12
555,Smear,0,0,,United States of America,,False,0.696,en,1998-01-01,9,5.5,2
556,Stanley Beloved,0,0,,Hong Kong,,False,0.6,en,1998-01-01,20,5.5,2
557,Thanos and Despina,0,0,Drama,"France, Greece",Lenox Films,False,0.693,el,1967-01-01,96,7.0,3
558,Voyage in Time,0,0,Documentary,"Russia, Italy",,False,1.604,it,1983-01-01,62,7.0,19
559,Songs From The Road,0,0,Music,,,False,0.6,en,2010-09-01,,0.0,0
560,The Black Tea,0,0,Animation,France,"Les Films de l'Arlequin, ARTE",False,0.842,fr,2007-01-01,5,0.0,0
561,Brothers,0,0,,Russia,,False,0.84,en,1991-01-02,90,0.0,0
562,Her Own Rules,0,0,,United States of America,"Tracey Alexander Productions, Adelson Entertainment, Hamdon Entertainment",False,0.84,en,1998-01-01,86,5.0,1
563,The Last Yellow,0,0,,United Kingdom,,False,0.6,en,1999-01-01,93,6.0,1
564,Abandoned,0,0,Drama,Hungary,"Budapest Filmstúdió, Duna Televízió",False,2.194,hu,2001-10-25,100,7.2,5
565,Day of the Full Moon,0,0,Drama,Russia,"Kuryer, Mosfilm",False,1.676,ru,1998-08-29,93,5.0,4
566,The Cherry Orchard,5,135,"Drama, Comedy","Greece, Cyprus, France","Melanda Film Productions, Greek Film Centre, Amanda Productions, Les Films de l'Astre",False,0.991,en,1999-01-01,141,5.0,1
567,"Particularly Now, in Spring",0,0,,Belgium,,False,1.4,en,1995-01-01,8,0.0,0
568,The Pit,1000000,0,"Horror, Mystery, Thriller",Canada,Amulet Pictures,False,2.872,en,1981-10-23,97,5.8,37
569,The Rose King,0,0,"Drama, Music","France, Germany, Netherlands, Portugal","Futra Film, Werner Schroeter Filmproduktion, Juliane Lorenz Filmproduktion",False,2.469,de,1986-03-03,106,8.0,6
570,The Twilight of the Gods,0,0,"Drama, War",New Zealand,Zee Films Ltd.,False,1.897,en,1996-06-24,15,6.3,6
571,Private Dicks: Men Exposed,0,0,Documentary,United States of America,,False,1.312,en,1999-01-01,56,5.3,4
572,The Guardian's Son,0,0,Drama,Greece,,False,1.424,el,2006-01-01,97,0.0,0
573,The Stranger,0,0,"Drama, Crime",Austria,,False,1.301,de,2000-05-12,102,5.8,3
574,The Secret Life: Jeffrey Dahmer,0,0,,United States of America,,False,1.847,en,1993-01-01,99,4.6,7
575,Adventures in Odyssey: Baby Daze,0,0,"Family, Animation",,,False,1.121,en,1998-09-22,28,5.0,1
576,Journey on the Plain,0,0,Drama,Hungary,,False,2.168,hu,1995-01-01,35,5.7,3
577,Our Time Is Up,0,0,Comedy,United States of America,Station B,False,1.181,en,2004-01-01,14,5.9,7
578,Cool It,0,0,Documentary,United States of America,,False,1.551,en,2010-11-08,87,6.7,6
579,Hell Bound,0,0,"Action, Drama, Thriller",United States of America,Bel-Air Productions,False,1.738,en,1957-10-01,72,6.3,3
580,The Appointments of Dennis Jennings,0,0,Comedy,United States of America,,False,0.99,en,1988-01-01,29,7.0,2
581,Queen of the Lot,0,0,"Comedy, Drama",,,False,0.704,en,2013-11-20,,8.0,2
582,Boxing Gym,0,0,Documentary,,,False,2.025,en,2010-10-22,91,5.5,7
583,The Hole,0,0,"Drama, Fantasy, Music, Romance","Taiwan, France","Haut et Court, Arc Light Films, La Sept-Arte, Central Motion Picture Corporation, China Television (CTV)",False,3.521,zh,1998-09-14,95,7.2,25
584,311: Enlarged to Show Detail 2,0,0,,,,False,0.6,en,2001-12-11,120,0.0,0
585,Miraculous Virgin,0,0,"Mystery, Drama, Comedy",Czechoslovakia,"Štúdio hraných filmov Bratislava, Filmové Studio Bratislava",False,0.718,sk,1967-01-20,93,4.0,2
586,Three Daughters,0,0,Drama,Slovakia,Studio Hraných Filmov Bratislava,False,1.162,sk,1968-04-19,87,8.0,1
587,"Logic Skateboard Media 7,8,9",0,0,,,,False,0.6,en,2002-01-01,,0.0,0
588,Tales of an Ancient Empire,1000000,0,"Adventure, Fantasy, Horror, Action, Thriller, Science Fiction","Argentina, United States of America",,False,2.141,en,2010-07-31,86,3.3,12
589,Samson and Delilah,0,0,"Drama, Romance",Australia,"CAAMA Productions, Scarlett Pictures",False,3.265,en,2009-05-07,101,6.0,26
590,"Ni Hao, Kai-Lan: Kai-Lan's Great Trip to China",0,0,"Animation, Family",United States of America,Nickelodeon Movies,False,0.6,en,2009-07-14,96,6.0,1
591,Japanese Devils,0,0,"Documentary, War",Japan,Directors System Co.,False,1.341,en,2001-02-06,160,0.0,0
592,Suicide Blonde,0,0,"Action, Thriller",,,False,0.874,en,1999-11-10,93,5.0,1
593,The  Ultimate Underdog Collection,0,0,"Action, Family",,,False,0.6,en,2007-08-29,,6.4,5
594,The Extra Man,7000000,453079,Comedy,"France, United States of America","Wild Bunch, Likely Story, Tax Credit Finance, 3 Arts Entertainment",False,4.577,en,2010-08-01,108,5.9,46
595,The Middle of the World,0,0,Drama,Brazil,,False,3.021,en,2003-09-12,85,6.8,24
596,The Pit and the Pendulum,2000000,0,"Horror, Romance",United States of America,"Full Moon Entertainment, Empire Pictures",False,4.739,en,1991-06-27,97,6.0,45
597,WEC 28: Faber vs. Farrar,0,0,,,,False,1.343,en,2007-06-03,45,0.0,0
598,Just Broke Up,0,0,"Comedy, Romance, Family",Greece,,False,1.495,el,2008-02-14,97,4.7,9
599,The Angelic Conversation,0,0,Romance,United Kingdom,"British Film Institute, Channel 4 Television",False,2.598,en,1985-01-01,81,6.5,8
600,The Genesis Children,0,0,Drama,United States of America,Lyric Films International,False,7.467,en,1972-08-01,85,7.0,3
601,House of Cards,0,0,Drama,"Italy, United States of America","A&M Films, Penta Pictures",False,3.443,en,1993-06-25,109,6.8,28
602,I Love You,0,0,,China,,False,1.038,zh,2003-01-01,97,7.7,3
603,A Run for Money,0,0,"Action, Thriller",Turkey,Atlantik Film,False,1.461,en,1999-01-01,100,6.4,8
604,Through the Olive Trees,0,0,Drama,"Iran, France","CiBy 2000, Abbas Kiarostami Productions, Farabi Cinema Foundation",False,3.562,fa,1994-01-01,103,7.4,38
605,Latcho Drom,0,0,"Music, Documentary",France,,False,1.754,fr,1993-06-06,103,7.3,16
606,Matchbox,0,0,Drama,Greece,"Strada Films, Cassadaga Film Production",False,1.652,el,2002-11-14,80,6.4,5
607,Lust in the Dust,0,0,"Action, Comedy, Western",United States of America,,False,2.086,en,1985-03-01,84,5.5,13
608,I Come,0,124994,Drama,"France, Spain","Nikkatsu Corporation, Canal+",False,2.684,fr,2000-10-04,90,7.4,13
609,In Your Image,0,0,"Drama, Science Fiction, Thriller",France,,False,2.53,fr,2004-05-26,94,4.1,6
610,Αυστηρώς Κατάλληλο,0,0,Comedy,Greece,,False,1.813,el,2008-10-23,110,6.0,6
611,The Death of Poe,0,0,,United States of America,,False,0.6,en,2006-10-11,80,6.0,1
612,A Further Gesture,0,0,"Drama, Thriller, Romance","Germany, Ireland, Japan, Spain, United Kingdom","Zephyr Films, Channel Four Films, Neue Deutsche Filmgesellschaft (NDF), Pony Canyon, Road Movies Dritte Produktionen, Samson Films",False,1.271,en,1997-01-01,96,4.5,2
613,The Last Supper,0,0,Drama,Cuba,Instituto Cubano del Arte e Industrias Cinematográficos,False,2.095,es,1976-03-13,120,8.1,9
614,Flaming Creatures,300,0,Drama,United States of America,,False,3.356,en,1963-04-29,45,5.4,18
615,Man Walking on Snow,0,0,Drama,Japan,,False,0.6,ja,2001-01-01,103,5.0,4
616,Madame de Sade,0,0,Drama,Sweden,"Kungliga Dramatiska Teatern, SVT Drama",False,1.065,sv,1992-01-01,104,9.0,2
617,When Stand Up Stood Out,0,0,"Comedy, Documentary",,,False,1.555,en,2003-01-01,87,6.0,4
618,Windy City Heat,0,0,"Comedy, Documentary",,,False,2.211,en,2003-10-12,120,8.0,14
619,City of Sin,0,0,Comedy,United States of America,Apple Eye Production,True,0.6,en,1971-01-01,63,1.0,1
620,Three Daughters,70000,0,,,,True,1.52,en,1986-11-22,108,0.0,0
621,Coca-Cola: The History of an American Icon,0,0,Documentary,,,False,0.6,en,2001-01-01,106,2.0,1
622,House of Dreams,0,0,Horror,,,True,0.6,en,1999-12-15,76,0.0,0
623,Shock,0,0,Science Fiction,,,True,0.651,en,1996-07-30,,8.5,2
624,Roningai,0,0,"Action, Adventure",Japan,"Shochiku Co., Ltd.",False,1.121,ja,1957-04-03,110,6.0,1
625,Teenage Dessert,0,0,,United States of America,,True,1.12,en,1976-01-01,,2.0,1
626,Chronicle of a Boy Alone,0,0,Drama,Argentina,Instituto Nacional de Cinematografia,False,1.428,es,1965-05-05,79,6.8,9
627,The Intruder,0,0,Drama,France,"Pusan Film Commission, Ognon Pictures, Conseil Régional de Franche-Comté, Centre National de la Cinématographie, ARTE France Cinéma",False,3.384,fr,2005-05-04,130,7.1,19
628,Cabaret Balkan,0,0,Drama,"Serbia, France, Greece, Macedonia, Turkey","MACT Productions, Eurimages, Ministère de la Culture, Canal (II), Vans, Mine Film, Stefi S.A., Gradski Kina, Ticket Productions",False,1.815,sr,1998-08-01,102,7.7,9
629,Augustine: The Decline of the Roman Empire,0,0,Drama,"Italy, Germany",Lux Vide,False,1.216,en,2010-01-31,200,3.3,6
630,Highway Dragnet,0,0,"Crime, Drama, Thriller",United States of America,William F. Broidy Productions,False,2.622,en,1954-01-27,70,5.8,11
631,The Last Relic,0,0,"Adventure, History, Romance",Estonia,Tallinnfilm,False,2.573,et,1969-01-01,86,7.1,6
632,Life Without Gabriella Ferri,0,0,"Animation, Comedy, Romance",Estonia,,False,0.6,en,2008-01-01,43,5.2,3
633,"The Price of Pleasure: Pornography, Sexuality & Relationships",0,0,Documentary,United States of America,,False,1.4,en,2008-01-01,55,8.0,2
