,adult,budget,genres,original_language,popularity,production_companies,production_countries,release_date,revenue,runtime,title,vote_average,vote_count
2291,False,0,Comedy,en,0.699,Hal Roach Studios,United States of America,1934-12-15,0,19,Bum Voyage,6.0,1
2292,False,0,Comedy,en,1.021,Hal Roach Studios,United States of America,1933-09-16,0,18,Beauty and the Bus,0.0,0
2293,False,0,Drama,ml,2.124,Ordinary Films,India,2015-01-23,0,114,Mili,6.6,9
2294,False,0,Comedy,en,0.625,Hal Roach Studios,United States of America,1934-02-10,0,19,Babes in the Goods,8.0,1
2295,False,0,Comedy,en,0.628,Hal Roach Studios,United States of America,1936-01-25,0,20,An All American Toothache,0.0,0
2296,False,0,,hu,0.6,,,,0,,CROATIA 2008,10.0,1
2297,False,0,Drama,fr,0.6,,France,2007-11-20,0,,Ravages,0.0,0
2298,False,0,Comedy,en,0.907,Hal Roach Studios,United States of America,1932-09-24,0,19,Alum and Eve,4.0,1
2299,False,0,Comedy,en,0.877,Hal Roach Studios,United States of America,1933-12-23,0,19,Air Fright,0.0,0
2300,False,0,Drama,de,1.165,"ZDF, TeamWorx Television & Film",Germany,2009-12-05,0,95,Spring Awakening,7.0,1
2301,False,0,"Drama, Documentary",es,0.6,Iris Star,Spain,2007-06-22,0,,"Raval, Raval...",0.0,0
2302,False,0,Comedy,en,0.887,"Paragon Films Ltd, Golden Harvest Productions",Hong Kong,1987-03-31,0,101,Born to Gamble,0.0,0
2303,False,0,"Romance, Comedy, Drama",en,2.237,,Australia,2015-02-21,0,93,All About E,5.3,22
2304,False,0,,es,0.627,,,2013-08-22,0,82,Blessed Love,5.0,1
2305,False,0,,si,1.4,,,2014-09-20,0,90,Frangipani,5.0,1
2306,False,0,Drama,en,1.185,"The Steve Jaggi Company, IN CAHOOTS CREATIONS, FEET FIRST VENTURES",Australia,2014-10-25,0,68,Skin Deep,6.0,1
2307,False,0,,ru,0.888,,,2014-06-20,0,87,Stand,5.0,1
2308,False,0,,en,0.6,,,2014-09-21,0,84,Alex & Ali,0.0,0
2309,False,0,Drama,de,0.6,,Germany,1978-06-03,0,,Lady Audleys Geheimnis,0.0,0
2310,False,0,,en,0.876,,,1977-02-27,0,60,Spaghetti Two-Step,0.0,0
2311,False,0,Drama,de,0.6,,Germany,1978-01-01,0,,Schwüle Tage,0.0,0
2312,False,0,Comedy,de,0.918,,Germany,1979-04-30,0,,Es begann bei Tiffany,0.0,0
2313,False,0,Drama,en,1.164,BBC,United Kingdom,1974-03-14,0,70,Headmaster,0.0,0
2314,False,0,Drama,ja,0.6,,Japan,1938-04-01,0,57,So Goes My Love,0.0,0
2315,False,0,Comedy,de,0.6,,Germany,1993-01-01,0,,Bommels Billigflüge,0.0,0
2316,False,0,Comedy,de,1.128,,"Austria, Germany",2006-12-27,0,90,Herzdamen,0.0,0
2317,False,0,Documentary,en,1.34,,,,0,90,The Real Tom Thumb: History's Smallest Superstar,0.0,0
2318,False,0,"Horror, Drama, Family",bn,0.846,Rosevalley Films,India,2013-03-22,0,134,Chayamoy,0.0,0
2319,False,0,"Drama, Comedy",en,0.6,BBC,United Kingdom,1976-04-06,0,50,Double Dare,0.0,0
2320,False,0,Comedy,de,0.623,,Germany,2004-11-11,0,,Problemzone Schwiegereltern,0.0,0
2321,False,0,Mystery,de,0.655,Stern Film,Germany,1919-01-01,0,68,The Secret of the American Docks,0.0,0
2322,False,0,"Drama, Romance",en,0.658,"Windows Production House, Jalan International Films",India,2014-06-06,0,134,Ramdhanu-The Rainbow,7.8,2
2323,False,0,Comedy,en,0.676,BBC,United Kingdom,2005-10-04,0,22,Little Britain Comic Relief,8.5,1
2324,False,0,Documentary,en,1.454,Very Ape Productions,,2015-02-14,0,68,Cam Girlz,5.6,5
2325,False,0,"Drama, Action",ja,0.809,,Japan,2001-02-03,0,101,Drowning Fish,0.0,0
2326,False,0,,en,1.4,,,2007-03-07,0,45,Little Britain Comic Relief 2007,6.0,1
2327,False,0,"Comedy, Drama",en,1.526,,,1978-01-10,0,60,Licking Hitler,0.0,0
2328,False,0,Comedy,cn,0.6,,Hong Kong,1988-12-21,0,,My Dream is Yours,8.0,1
2329,False,0,,en,0.6,,United States of America,1971-01-01,0,10,Production Footage,0.0,0
2330,False,0,,en,0.6,,United States of America,1980-01-01,0,3,Red Boxing Gloves / Orange Kitchen Gloves,0.0,0
2331,False,0,,en,0.6,,,1978-01-31,0,75,Destiny,0.0,0
2332,False,0,"Drama, Comedy, Crime",en,0.841,Columbia Pictures,United States of America,1937-01-17,0,58,Woman in Distress,0.0,0
2333,False,0,,xx,0.84,Société Lumière,France,1897-12-12,0,1,Le prince et la princesse de Naples,0.0,0
2334,False,0,"Drama, Crime",en,1.96,Paramount,United States of America,1938-06-17,0,67,Prison Farm,6.0,1
2335,False,0,"Drama, Crime",ja,0.6,,Japan,2005-11-19,0,106,Under the Same Moon,2.0,1
2336,False,0,,xx,0.901,Société Lumière,France,1896-06-28,0,1,L'Impératrice mère et la grande-duchesse Eugénie en carrosse,5.5,2
2337,False,0,Horror,es,3.349,"The Other Side Films, Fonofox Servicios Audiovisuales, Artistic Films",Spain,2015-09-25,0,79,Vampyres,4.6,14
2338,False,0,,en,0.6,,,2003-02-20,0,,Unarm 72 Hours,0.0,0
2339,False,0,Comedy,ja,0.6,,Japan,2005-10-01,0,118,Tobi ga kururi to,0.0,0
2340,False,0,Documentary,fr,0.734,Société Lumière,France,1897-04-25,0,1,Espagne: Courses de taureaux,5.5,2
2341,False,0,Drama,en,1.723,Corner Piece Productions,United States of America,2016-02-06,0,90,West of Her,0.0,0
2342,False,0,Drama,ja,0.6,,Japan,2008-11-01,0,118,Where The Legend Lives,0.0,0
2343,False,0,,zh,0.6,,,2010-01-01,0,,此间的少年,0.0,0
2344,False,0,Drama,ja,0.657,,Japan,2011-12-10,0,100,Ugly,0.0,0
2345,False,0,,xx,0.6,Société Lumière,France,1898-04-01,0,1,"Une rue à Tokyo, [II]",0.0,0
2346,False,0,,xx,0.6,Société Lumière,France,1898-04-01,0,1,Une avenue à Tokyo,0.0,0
2347,False,0,"Music, Comedy",ja,0.623,,Japan,2008-11-15,0,100,GS Wonderland,7.0,1
2348,False,0,,xx,0.6,Société Lumière,France,1900-02-04,0,1,Une place publique à Tokyo,0.0,0
2349,False,0,"Action, Drama, History",de,0.6,Oriental Film Company,Italy,1960-12-23,0,,La vendetta dei barbari,0.0,0
2350,False,0,,xx,0.6,Société Lumière,France,1898-04-01,0,1,Station du chemin de fer de Tokyo,0.0,0
2351,False,0,,ja,0.85,,,2014-09-27,0,,Cold,0.0,0
2352,False,0,Comedy,cs,1.015,Československý státní film,Czech Republic,1949-09-23,0,,Hostinec U kamenného stolu,8.1,4
2353,False,0,,xx,0.6,Société Lumière,France,1899-04-11,0,1,Cuirassés de l'escadre française sur les côtes de Sardaigne,0.0,0
2354,False,0,,xx,0.6,Société Lumière,France,1899-04-14,0,1,Cuirassés de l'escadre italienne,0.0,0
2355,False,0,,en,0.6,,,2015-01-01,0,,Julius Jr: Pirates & Superheroes,0.0,0
2356,False,0,,xx,0.6,Société Lumière,France,1899-04-19,0,1,Inauguration du monument de Victor-Emmanuel à Sassari,0.0,0
2357,False,0,,en,0.653,,,2008-01-01,0,,The 9/11 Faker,8.0,2
2358,False,0,"Drama, Romance",en,0.709,Mattioli Productions,United States of America,2014-01-01,0,90,The Coffee Shop,6.2,3
2359,False,0,,en,0.627,,,1996-01-01,0,,The Chasers of Tornado Alley,0.0,0
2360,False,0,"Romance, Comedy",en,2.058,Vanishing Angle,United States of America,2015-02-10,0,89,The Dramatics: A Comedy,5.4,8
2361,False,0,Documentary,pt,1.4,"Canal Brasil, Elixir Entretenimento, Treze Produções",Brazil,2015-01-23,0,,Sabotage: O Maestro Do Canão,0.0,0
2362,False,0,,en,0.6,,,2014-12-12,0,,Chuckie - Dirty Dutch In the Valley,0.0,0
2363,False,0,,en,0.6,,,2013-09-04,0,,The Flag,0.0,0
2364,False,0,,en,0.6,,,2014-12-12,0,,Freaking Loud With Brennan Heart,0.0,0
2365,False,0,,en,0.6,,,,0,,Humne Jeena Seekh Liya,0.0,0
2366,False,0,Drama,it,0.992,"Frenesy Film Company, Faliro House Productions","Greece, Italy",2015-07-04,0,96,Antonia,5.3,3
2367,False,0,,en,0.6,,,2013-01-01,0,,Acceptance,6.0,1
2368,False,0,"Drama, Animation",en,0.845,,Spain,2011-09-16,0,12,Who Lasts Longer,0.0,0
2369,False,0,,en,0.6,,,2015-03-24,0,,Saints,0.0,0
2370,False,0,,xx,1.4,Société Lumière,France,1896-11-24,0,1,La Foule,0.0,0
2371,False,0,,en,0.6,,,2013-06-21,0,,Yeh Raat Phir Na Aayegi,0.0,0
2372,False,0,,en,1.22,,,1997-01-01,0,,A Doll in the Dark,0.0,0
2373,False,0,Documentary,en,0.6,,,2008-01-01,0,,A Ride Along the Lincoln Highway,0.0,0
2374,False,0,,xx,1.4,Société Lumière,France,1896-11-19,0,1,Arrivée du gouverneur,0.0,0
2375,False,0,,en,1.4,,,2002-01-01,0,90,Abbott & Costello in the Movies,0.0,0
2376,False,0,,en,0.6,,,1983-01-01,0,,All Tomorrow's Parties: Nico Live,0.0,0
2377,False,0,Music,en,1.4,"Kultur Video, NVC Arts",,2009-01-01,0,110,Antonín Dvorák: The Devil and Kate,0.0,0
2378,False,0,,xx,1.091,Société Lumière,France,1896-11-24,0,1,Enceinte du pesage,0.0,0
2379,False,0,,en,0.6,,,2005-01-01,0,,Best of the Big Bands: Artie Shaw & Friends,0.0,0
2380,False,0,,en,0.6,,,1984-01-01,0,,Celibidache: Ravel and Debussy,0.0,0
2381,False,0,,en,0.6,,,2003-01-01,0,,Clifton Chenier: The King of Zydeco,0.0,0
2382,False,0,Documentary,cs,0.6,Hejbej se ON LINE,Czech Republic,2011-04-01,0,,Hejbejse 10 - Zumba,0.0,0
2383,False,0,,en,0.6,,,2002-01-01,0,,Ghost Hunters: Vol. 1,0.0,0
2384,False,0,,en,0.6,,,2002-01-01,0,,Gillian Welch: The Revelator Collection,0.0,0
2385,False,0,Music,en,0.6,,Germany,1990-01-01,0,,Handel: Giulio Cesare,0.0,0
2386,False,0,Documentary,en,0.6,,,2015-01-18,0,,Nicki Minaj: My Time Again,9.5,2
2387,False,0,,en,0.6,,,2006-01-01,0,,Historic Encounters: Robert's Ridge,0.0,0
2388,False,0,,xx,1.377,Société Lumière,France,1896-11-24,0,1,La Course,0.0,0
2389,False,0,"Family, Animation, Fantasy, Adventure",en,0.895,,,2002-06-21,0,85,King of the Farm,0.0,0
2390,False,0,Drama,is,4.751,Alamode Film,"Denmark, Iceland",2015-03-20,0,90,Virgin Mountain,7.2,101
2391,False,0,,en,0.6,,,2004-01-01,0,,IdN Video 2.0: My Favourite Creators!,0.0,0
2392,False,0,,en,0.6,,,2007-01-01,0,,Journey of Light: The Search for God in the Holy Land,0.0,0
2393,False,0,,xx,1.4,Société Lumière,France,1896-11-24,0,1,Arrivée d'un train à Melbourne,0.0,0
2394,False,0,,en,0.6,,,1991-01-01,0,,Kiri Te Kanawa: Home and Afar,0.0,0
2395,False,0,"History, War",ml,2.168,Damor Cinemas,India,2008-01-01,0,109,Kurukshetra,4.8,4
2396,False,0,,en,0.6,,,2008-01-01,0,,Martha Speaks: Martha Goes to School,0.0,0
2397,False,0,,en,0.6,,,1977-01-01,0,,Menotti: The Medium: Maureen Forrester,0.0,0
2398,False,0,"Action, Comedy",cn,0.954,"Yes Visions Company, Same Way Productions Limited","Japan, Hong Kong",2002-02-06,0,90,No Problem 2,8.0,1
2399,False,0,,en,0.6,,,2000-01-01,0,,Parchhain,0.0,0
2400,False,0,,en,0.6,,,2008-01-01,0,,Paul Booth Presents: The Art Fusion Experiment,0.0,0
2401,False,0,,en,0.6,,,2006-01-01,0,,Pellam Oorelthe,0.0,0
2402,False,0,,en,0.6,,,1998-01-01,0,,Roaring Glory Warbirds: Vought F4U Corsair,0.0,0
2403,False,0,,hi,0.632,,,1992-07-31,0,,Bekhudi,0.0,0
2404,False,0,Drama,en,1.179,,,1984-10-30,0,100,Silence of the Heart,6.0,1
2405,False,0,,en,0.6,,,2008-01-01,0,,Stones Throw 102: In Living the True Gods,0.0,0
2406,False,0,Comedy,es,1.4,,,2011-11-11,0,12,Por los camareros,0.0,0
2407,False,0,,en,0.6,,,2004-01-01,0,,Tennessee Ernie Ford: His Life and Times,0.0,0
2408,False,0,,en,0.6,,,1993-01-01,0,,The Actors at Work Series: Directors on Acting,0.0,0
2409,False,0,,en,0.6,,,2003-01-01,0,,The Ataris: Live at Capitol Milling,0.0,0
2410,False,0,,en,0.6,,,2007-01-01,0,,The Best of Ivan Parker: From the Homecoming Series,0.0,0
2411,False,0,,en,0.6,,,1972-01-01,0,,The Festival of Family Classics: Vol. 2,0.0,0
2412,False,0,,en,0.6,,,2000-01-01,0,,The Films of Melissa & Hamid,0.0,0
2413,False,0,Comedy,es,0.694,"Fidecine, IMCINE, La Fabrica Films, Pajarracos Films, Estudios Churubusco Azteca",Mexico,2006-07-28,0,,Los Pajarracos,3.3,3
2414,False,0,,en,0.6,,,2004-01-01,0,,The Harlem Renaissance,0.0,0
2415,False,0,Thriller,en,0.664,bsr productions,United States of America,1983-01-01,0,98,The Haunting Passion,0.0,0
2416,False,0,,en,0.6,,,2001-01-01,0,,The Magic Flute Story: An Opera Fantasy,0.0,0
2417,False,0,,en,0.6,,,2005-01-01,0,,The Sex Pistols: Music Video Box Documentary,0.0,0
2418,False,0,Drama,de,0.746,,,2007-08-16,0,,Lauf der Dinge,5.0,1
2419,False,0,,en,0.6,,,2010-01-01,0,,The World According to Shorts Presents: L'Origine de la Tendresse and Other Tales,0.0,0
2420,False,0,Music,en,0.6,,,2006-01-01,0,,Theatres des Vampires: Addiction Tour 2006,10.0,1
2421,False,0,,ja,0.6,,,1989-01-01,0,48,Urusei Yatsura: Ryoko's September Tea Party,0.0,0
2422,False,0,,en,0.6,,,1983-01-01,0,,Washington National Cathedral,0.0,0
2423,False,0,,en,0.6,,,2000-01-01,0,,World Extreme Games: Street Skate,0.0,0
2424,False,0,,en,0.6,,,2004-01-01,0,,Bad Azz Muthaz: Black Dragon Fever,0.0,0
2425,False,0,,xx,0.6,Société Lumière,France,1897-05-30,0,1,Roi d'Italie et prince Victor passant la revue,0.0,0
2426,False,0,,ja,0.665,,Japan,1995-09-02,0,104,Goodbye Japan,0.0,0
2427,False,0,,en,0.6,,,2000-01-01,0,,Baghi Soormey,0.0,0
2428,False,0,,en,0.6,,,2003-01-01,0,,Beauty Shop: The Original Stage Play,0.0,0
2429,False,0,,en,0.6,,,2008-01-01,0,,Bill & Gloria Gaither: Homecoming Picnic,0.0,0
2430,False,0,Horror,en,0.6,Elftwin Films,,2007-02-13,0,,Bit Parts,0.0,0
2431,False,0,,en,0.6,,,2007-01-01,0,,Bon Jovi: Rock Case Studies,0.0,0
2432,False,0,Drama,nl,0.84,,Belgium,1989-03-09,0,,Sailors Don't Cry,0.0,0
2433,False,0,,en,0.6,,,1996-01-01,0,,Carol Burnett: Just to Have a Laugh,0.0,0
2434,False,0,,en,0.6,,,2005-01-01,0,,Celebration of Irish Dancing,0.0,0
2435,False,0,,ja,0.621,,Japan,1997-12-13,0,116,The Files of Young Kindaichi: Legend of the Shanghai Mermaid,9.0,1
2436,False,0,Drama,pl,0.6,,,2000-01-10,0,,Córy szczęścia,0.0,0
2437,False,0,,en,0.6,,,2001-01-01,0,,Chapel of Love: Jeff Barry and Friends,0.0,0
2438,False,0,,en,0.6,,,1998-01-01,0,,Charles Darwin: Evolution's Voice,0.0,0
2439,False,0,,en,0.6,,,2007-01-01,0,,Charlie Zahm: An Evening of Classic Melodies,0.0,0
2440,False,0,,gu,0.6,,,2005-01-01,0,,Chel Chabilo Gujarati: Gujarati,10.0,1
2441,False,0,,en,0.6,,,2000-01-01,0,,Cute & Cuddly Critters: Little Furry Friends,0.0,0
2442,False,0,,en,0.6,,,2008-01-01,0,,Essential Space Collection,0.0,0
2443,False,0,,en,0.6,,,1999-01-01,0,,Book of Mormon Stories,7.0,1
2444,False,0,,en,0.6,,,2009-01-01,0,,Finding Your Own True Love with Dr. Diana Kirschner,0.0,0
2445,False,0,,en,0.6,,,2007-01-01,0,,Frank Lloyd Wright's Taliesin West,0.0,0
2446,False,0,,en,0.6,,,2004-01-01,0,,Free at Last: Civil Rights Heroes,0.0,0
2447,False,0,,en,0.6,,,2003-01-01,0,,Geronimo: The U.S. Airborne in World War II,0.0,0
2448,False,0,Horror,ja,0.952,,Japan,1998-06-04,0,95,Hanako of the Toilet,6.5,2
2449,False,0,,en,0.6,,,2000-01-01,0,,Going Home: The Journey of Kim Jones,0.0,0
2450,False,0,Drama,de,0.6,,Germany,1980-09-08,0,,Am Südhang,0.0,0
2451,False,0,Crime,de,0.84,,Germany,1986-05-11,0,,Mord am Pool,0.0,0
2452,False,0,Documentary,cs,0.963,"Negativ, HBO Europe",Czech Republic,2009-02-26,0,76,Welcome to North Korea!,5.4,4
2453,False,0,,en,1.4,,,1960-08-08,0,85,El toro negro,0.0,0
2454,False,0,,en,0.6,,,2004-03-24,0,,25 More Country Number 1s,0.0,0
2455,False,0,,en,0.6,,,2006-04-25,0,,Aerobo Cop: Superhero of Fitness,0.0,0
2456,False,0,Music,en,0.6,,,1990-01-01,0,,Aerosmith Permanent Rock,0.0,0
2457,False,0,,en,0.6,,,1997-07-13,0,,Arthur C. Clarke: The Man Who Saw the Future,0.0,0
2458,False,0,,xx,1.4,Société Lumière,France,1903-01-18,0,2,La marmite diabolique,0.0,0
2459,False,0,,en,0.6,,,2004-01-27,0,,Arthur Saves the Day,0.0,0
2460,False,0,Family,en,0.842,The Baby Einstein Company,United States of America,2004-03-16,0,,Baby Einstein: Baby MacDonald - A Day on the Farm,0.0,0
2461,False,0,,en,0.6,,,2006-12-01,0,,Ballad of Ocher Land,0.0,0
2462,False,0,,en,0.6,,,1960-06-30,0,80,Vuelta al paraíso,0.0,0
2463,False,0,,en,0.6,,,2006-03-07,0,,Bamboo Mountain Chi Kung,0.0,0
2464,False,0,,xx,1.4,Société Lumière,France,1903-01-18,0,2,Substitutions,0.0,0
2465,False,0,Music,en,1.092,Ginger Group Productions,United States of America,2003-05-20,0,86,Barbara Cook: Mostly Sondheim,0.0,0
2466,False,0,Documentary,en,1.127,,,2013-12-01,0,92,Linda Lovelace: Loose Lips - Her Last Interview,1.0,1
2467,False,0,,en,0.6,,,2006-01-01,0,,Battle's Poison Cloud,0.0,0
2468,False,0,,en,0.6,,,2012-08-28,0,,Between Heaven and Ground Zero,0.0,0
2469,False,0,,xx,1.4,Société Lumière,France,1903-01-18,0,2,Le prestidigitateur au café,0.0,0
2470,False,0,,en,0.6,,,2004-03-30,0,,Casadesus: First Family of the Piano,0.0,0
2471,False,0,,en,0.6,,,2009-03-10,0,98,Circle: Saturnus Reality,0.0,0
2472,False,0,Documentary,es,0.6,,,2006-01-01,0,73,Como se forma una rumba,0.0,0
2473,False,0,,xx,1.341,Société Lumière,France,1903-01-18,0,2,Pierrot et la flûte enchantée,0.0,0
2474,False,0,Music,en,0.841,,,2002-01-01,0,107,Cypress Hill: Smoke Out,0.0,0
2475,False,0,,en,0.6,,,2008-03-26,0,,Deliverance in the House,0.0,0
2476,False,0,,en,0.6,,,2014-07-29,0,60,Dagfinn Lyngbø Stereo,8.5,1
2477,False,0,,en,0.6,,,1966-01-01,0,,Dus Lakh,0.0,0
2478,False,0,Documentary,en,0.6,,United States of America,1997-01-01,0,90,First Person Singular: John Hope Franklin,0.0,0
2479,False,0,,xx,1.4,Société Lumière,France,1903-01-18,0,2,Le gendarme et les domestiques,0.0,0
2480,False,0,,en,0.6,,,2007-07-24,0,,In the Cockpit: Red Star,0.0,0
2481,False,0,,en,0.6,,,2001-02-17,0,,In the Light of Reverence,0.0,0
2482,False,0,,en,0.6,,,2003-05-20,0,,Invitation to Dance: Wedding Dance,0.0,0
2483,False,0,,en,0.6,,,2005-02-01,0,,Janis Ian: Live at Club Cafe,0.0,0
2484,False,0,,en,0.6,,,2007-08-28,0,,Joanna's Flower Power: Flower Design,0.0,0
2485,False,0,,xx,1.091,Société Lumière,France,1903-01-18,0,2,Une scène à l'octroi,0.0,0
2486,False,0,,ta,0.6,,,1968-01-01,0,,Kudiyiruntha Kovil,6.0,1
2487,False,0,,en,0.6,,,2008-08-08,0,,Marcus Garvey: A Giant of Black Politics,0.0,0
2488,False,0,,en,0.6,,,1983-01-01,0,,Kung Fu Theater: Attack of the Venoms,0.0,0
2489,False,0,,xx,1.4,Société Lumière,France,1903-01-18,0,2,Arlequin et Méphistophélès,0.0,0
2490,False,0,,en,0.6,,,1987-01-01,0,,Naam O Nishan,0.0,0
2491,False,0,,en,0.6,,,2007-01-30,0,,Magritte: An Attempt at the Impossible,0.0,0
2492,False,0,Music,en,0.6,Sploshnoff Music Group,Russia,2005-03-15,0,,Manfred Mann's Earth Band: Angel Station in Moscow,0.0,0
2493,False,0,,en,0.6,,,2009-01-01,0,,Marina of the Zabbaleen,0.0,0
2494,False,0,,xx,1.341,Société Lumière,France,1903-01-18,0,2,Le cambrioleur,0.0,0
2495,False,0,,en,0.6,,,1974-06-20,0,,Me Cai De La Nube,0.0,0
2496,False,0,,en,0.6,,,1996-01-01,0,,Neon Signs,0.0,0
2497,False,0,,en,0.6,,,1992-01-01,0,,Old Rococo: The Life of Gioacchino Rossini,0.0,0
2498,False,0,Drama,ko,0.6,"Indiestory, National Human Rights Commission of Korea",South Korea,2011-04-28,0,144,If You Were Me 5,0.0,0
2499,False,0,,en,0.6,,,2007-01-01,0,,Pablo Escobar: King of Coke,5.0,1
2500,False,0,,en,0.6,,,2005-01-25,0,,Pietasters: Live at the 9:30 Club,0.0,0
2501,False,0,,en,0.6,,,1997-06-21,0,,Pride Divide,0.0,0
2502,False,0,,zh,0.916,,,1980-01-01,0,80,Rivals of the Dragon,7.0,1
2503,False,0,,en,0.6,,,2008-10-01,0,,Rock N' Learn: Multiplication Rap,0.0,0
2504,False,0,"Science Fiction, Action, Fantasy, Horror",en,0.969,Bill Zebub Productions,United States of America,2014-10-29,0,96,Holocaust Cannibal,0.0,0
2505,False,0,,en,0.6,,,2003-01-01,0,,Sarah Geronimo: Popstar: Live at the Music Museum,6.8,3
2506,False,0,,xx,1.4,Société Lumière,France,1903-01-18,0,2,Tentation de Saint-Antoine,0.0,0
2507,False,0,,en,0.971,,,2008-01-01,0,,Secrets of a Desperate Housewife,8.5,1
2508,False,0,,en,0.6,,,2006-10-17,0,,The Old Quarry and Other Haunted Places of Central New York,0.0,0
2509,False,0,,xx,1.4,Société Lumière,France,1903-01-18,0,2,Chirurgie mécanique,0.0,0
2510,False,0,,en,0.6,,,,0,,Off On a Comet,0.0,0
2511,False,0,,en,1.1,,,2003-09-22,0,180,The Piano Man's Daughter,0.0,0
2512,False,0,"Documentary, Music",de,0.6,"ARTE, MDR, DOKfilm Fernsehproduktion GmbH",Germany,2013-11-09,0,,Kalter Krieg der Konzerte - Wie Bruce Springsteen den Osten rockte,0.0,0
2513,False,0,Action,en,0.6,Absinthe Films,United States of America,2014-10-15,0,52,Heavy Mental,0.0,0
2514,False,0,,de,0.628,,,2006-12-07,0,99,The Short Life of José Antonio Gutierrez,0.0,0
2515,False,0,,en,0.622,,,2006-01-01,0,,The White Stripes: Rhinoceros,9.5,1
2516,False,0,,xx,1.4,Société Lumière,France,1903-01-18,0,2,Les poupées,0.0,0
2517,False,0,,en,0.6,,,2009-01-01,0,,Vera: Life of a Diva,0.0,0
2518,False,0,Documentary,en,0.841,,,2000-01-01,0,,Well-Founded Fear,0.0,0
2519,False,0,,en,0.6,,,2004-02-03,0,,World Music Discoveries: Drums and Djembes of Burkina Faso,0.0,0
2520,False,0,,en,0.6,,,2002-08-22,0,126,Todd Rundgren: Live in Japan,0.0,0
2521,False,0,,en,0.6,,,2004-12-21,0,,You Are There: America Grows Up,0.0,0
2522,False,0,,en,0.6,,,2007-06-11,0,,The Evading,1.0,2
2523,False,0,,en,0.6,,,2004-05-11,0,,The Exploited 83-87: Live at the Palm Cove,0.0,0
2524,False,0,,en,0.6,,,2014-08-03,0,90,Words - Live At The Edinburgh Fringe,10.0,1
2525,False,0,,en,0.6,,,,0,89,Eye on the Sixties: The Iconic Photography of Rowland Scherman,0.0,0
2526,False,0,,en,0.6,,,,0,,tdtydjd,8.0,1
2527,False,0,Horror,en,1.377,"Votiv Films, The October People",United States of America,2015-02-20,0,91,Hunting Grounds,5.8,11
2528,False,0,Animation,en,0.627,"M.J. Winkler Productions, Walt Disney Pictures, Universal Pictures",United States of America,1927-12-12,0,6,Empty Socks,0.0,0
2529,False,0,Animation,en,1.4,"M.J. Winkler Productions, Walt Disney Pictures, Universal Pictures",United States of America,1927-12-26,0,6,Rickety Gin,0.0,0
2530,False,0,Documentary,nl,0.6,,,2008-10-14,0,,De NSDAP,0.0,0
2531,False,0,"Comedy, Animation",en,0.84,,,2014-11-24,0,3,The Horse Raised by Spheres,5.0,1
2532,False,0,Drama,tr,1.119,,"Turkey, United States of America",2014-11-07,0,105,Deniz Seviyesi,6.6,5
2533,False,0,"Animation, Drama, Action",ja,1.522,Sanzigen,Japan,2015-05-23,0,62,New Initial D the Movie - Legend 2: Racer,7.5,2
2534,False,0,Drama,en,1.08,Oxford Films,United Kingdom,1939-12-01,0,58,The Mysterious Mr. Davis,5.0,3
2535,False,0,Comedy,de,0.6,,Germany,1998-01-01,0,,Freundinnen & andere Monster,0.0,0
2536,False,0,,en,0.6,,,1936-09-08,0,,They Met in a Taxi,0.0,0
2537,False,0,Drama,es,0.6,Este Films,Spain,1957-09-08,0,,Un tesoro en el cielo,0.0,0
2538,False,0,,en,0.696,World Wrestling Entertainment (WWE),United States of America,2015-02-11,0,120,NXT TakeOver: Rival,7.0,2
2539,False,0,Documentary,en,0.6,,Brazil,2009-01-01,0,20,Undertow Eyes,8.0,1
2540,False,0,Action,en,8.465,"Living Films, Arcade Pictures, Iron Fists, Universal 1440 Entertainment",United States of America,2015-03-10,0,90,The Man with the Iron Fists 2,4.9,92
2541,False,0,,fr,0.6,,,1936-12-04,0,,Monsieur Personne,0.0,0
2542,False,0,"Mystery, Drama, Thriller",en,2.86,"Arcadia Motion Pictures, Atlantic Pictures, Viracocha Films","Peru, United States of America, Spain",2015-04-24,0,99,The Debt,5.8,16
2543,False,0,Comedy,de,0.655,,Germany,1999-12-09,0,,"Waschen, Schneiden, Legen",0.0,0
2544,False,0,Documentary,en,1.4,Interakt,Netherlands,2015-01-30,0,75,Conducting Boijmans,9.0,1
2545,False,0,Action,cn,1.09,,Hong Kong,1989-01-01,0,,Satanic Crystals,0.0,0
2546,False,0,"Drama, History",en,0.6,B-Z-Film GmbH,Germany,1919-07-01,0,85,"Mazeppa, der Volksheld der Ukraine",0.0,0
2547,False,0,,en,0.6,,,1927-08-31,0,,Isle of Sunken Gold,0.0,0
2548,False,0,"Animation, Family",fr,0.6,Imavision Productions,United States of America,2013-07-16,0,,La Schtroumpfette,6.5,1
2549,False,0,Drama,fr,5.223,TF1 Films Production,France,2015-01-14,0,98,L'emprise,7.9,111
2550,False,0,Documentary,ru,0.6,,"Bulgaria, Russia, United States of America",2015-01-24,0,82,No Place for Fools,0.0,0
2551,False,0,Drama,ja,1.434,Phantom Film,Japan,2014-09-13,0,118,Undulant Fever,5.4,4
2552,False,0,"TV Movie, Drama, Music",de,1.46,Vegas-Film,Germany,1990-02-08,0,76,Carmen on Ice,0.0,0
2553,False,0,Drama,de,0.84,,"Germany, France",1998-07-01,0,104,Clarissa,4.2,3
2554,False,0,,en,0.6,,,1986-02-09,0,100,Honest Decent and True,0.0,0
2555,False,0,,en,0.6,,,2015-01-27,0,,Capital One Cup: Chelsea vs Liverpool,0.0,0
2556,False,0,Animation,en,0.6,"M.J. Winkler Productions, Walt Disney Pictures, Universal Pictures",United States of America,1928-01-23,0,,Neck 'n' Neck,0.0,0
2557,False,0,Animation,en,1.091,"M.J. Winkler Productions, Walt Disney Pictures, Universal Pictures",United States of America,1928-02-06,0,6,The Ol' Swimmin' Hole,0.0,0
2558,False,0,,en,0.895,,,1910-07-17,0,17,A Flash of Light,5.0,1
2559,False,0,,he,0.84,,,2011-01-01,0,76,Matinee,0.0,0
2560,False,0,,en,0.6,,,2011-03-23,0,,Overdrive: Istanbul in the New Millennium,0.0,0
2561,False,0,,en,0.6,,,2013-09-25,0,,Pandi,0.0,0
2562,False,0,,en,1.125,,,2011-07-26,0,,The Camera That Changed the World,7.0,1
2563,False,0,,en,0.6,,,2011-12-02,0,,Wild Horses in Winds of Change,0.0,0
2564,False,0,,xx,0.6,Société Lumière,France,1897-03-04,0,1,Executive Mansion,0.0,0
2565,False,0,,xx,0.901,Société Lumière,France,1897-03-21,0,1,Défilé de l'artillerie du district de Columbia,6.0,2
2566,False,0,,he,0.848,,,2014-07-17,0,,10% My Child,0.0,0
2567,False,0,,xx,0.6,Société Lumière,France,1897-03-28,0,1,Défilé du club républicain James Blaine,0.0,0
2568,False,0,,en,0.6,,,2013-11-01,0,,"Amor, etc...",0.0,0
2569,False,0,"Action, Adventure, Animation",en,7.938,"DC Entertainment, Warner Bros. Animation, DC Comics",United States of America,2015-04-14,0,72,Batman vs. Robin,6.9,372
2570,False,0,,en,0.6,,,2015-01-01,0,,Breach,0.0,0
2571,False,200000,"Documentary, Adventure",en,0.84,"Running Reel Films, Evoke Mediaworks",United States of America,2015-01-31,0,80,Caffeinated,0.0,0
2572,False,0,"Comedy, Drama, Crime",es,0.605,,,2014-10-10,0,,El Cordero,0.0,0
2573,False,0,,en,0.6,,,2014-10-09,0,,El karma de Carmen,0.0,0
2574,False,0,,en,0.6,,,2001-04-01,0,88,Dino De Laurentiis: The Last Movie Mogul,0.0,0
2575,False,0,,en,0.6,,,2015-04-01,0,,Energizing Our World,0.0,0
2576,False,0,,en,1.148,,,2014-10-01,0,,Far from Home: Uganda to the Tetons,0.0,0
2577,False,0,,xx,0.841,Société Lumière,France,1901-01-02,0,1,"Panorama de la ligne de Cauterets, [I]",0.0,0
2578,False,0,Documentary,en,0.6,,Israel,2014-05-12,0,80,Life According to Ohad,0.0,0
2579,False,0,,xx,0.841,Société Lumière,France,1901-01-02,0,1,"Panorama de la ligne de Cauterets, [II]",0.0,0
2580,False,0,"Documentary, Music",en,1.176,,,2015-01-30,0,93,Heartworn Highways Revisited,0.0,0
2581,False,0,,en,0.6,,,2013-01-01,0,,All Cats Are Grey,0.0,0
2582,False,0,Drama,es,0.6,Camila Films,Nicaragua,2014-11-05,0,90,The Naked Screen,0.0,0
2583,False,0,,en,0.6,,,2013-01-01,0,,Being Big: Fatism in America,0.0,0
2584,False,0,,en,0.6,,,2015-01-01,0,,Like Air,0.0,0
2585,False,0,,en,0.661,,,2015-11-26,0,,Alo,0.0,0
